id,pos,gloss,persian_gloss,checked
44110,noun,low-growing Eurasian plant with yellow central disc flowers and pinkish-white outer ray flowers,گیاه اوراسیا با رشد کم با گلهای دیسک مرکزی زرد و گلهای اشعه بیرونی به رنگ صورتی مایل به صورتی,1
44113,noun,the deliberate act of delaying and playing instead of working,عمل عمدی تأخیر و بازی به جای کار کردن,1
44108,noun,any of numerous composite plants having flower heads with well-developed ray flowers usually arranged in a single whorl,هر یک از گیاهان مرکب بیشماری که دارای سر گل با گلهای پرتوی کاملاً پیشرفته هستند ، معمولاً در یک حلقه قرار می گیرند,1
44114,noun,a native or inhabitant of Dalmatia,بومی یا ساکن دالمتیا,1
44117,noun,a brown-spotted dalmatian,یک دالمیایی لکه دار قهوه ای,1
44115,noun,a historical region of Croatia on the Adriatic Sea; mountainous with many islands,منطقه ای تاریخی از کرواسی در کنار دریای آدریاتیک.کوهستانی با بسیاری از جزایر,1
44118,noun,dam to make a millpond to provide power for a water mill,سد برای ایجاد یک آسیاب برای تأمین برق برای آسیاب آب,1
44116,noun,a large breed having a smooth white coat with black or brown spots; originated in Dalmatia,یک نژاد بزرگ که دارای کت سفید صاف و دارای لکه های سیاه یا قهوه ای است.در دالتمیا منشا گرفت,1
44119,noun,a low dam built across a stream to raise its level or divert its flow,یک سد کم که از طریق یک جریان ساخته شده است تا سطح آن را افزایش دهد یا جریان آن را منحرف کند,1
44120,noun,one of the world's largest dams on the Nile River in southern Egypt,یکی از بزرگترین سدهای جهان در رودخانه نیل در جنوب مصر,1
44121,noun,a large dam built in 1964 on the Colorado River in Arizona,یک سد بزرگ در سال 1964 در رودخانه کلرادو در آریزونا ساخته شده است,1
44122,noun,a large dam built in 1933 on the Colorado River in Nevada,یک سد بزرگ در سال 1933 در رودخانه کلرادو در نوادا ساخته شده است,1
44123,noun,a metric unit of length equal to ten meters,یک واحد متریک طول برابر با ده متر,1
44124,noun,a metric unit of length equal to 100 meters,یک واحد متریک طول برابر با 100 متر,1
44126,noun,female parent of an animal especially domestic livestock,پدر و مادر ماده یک حیوان به خصوص دام های خانگی,1
44125,noun,the basic unit of length adopted under the Systeme International d'Unites (approximately 1.094 yards),واحد اصلی طول تحت سیستم Systeme International d'Unites (تقریباً 1.094 یارد),1
44127,verb,"damage by frost; ""The icy precipitation frosted the flowers and they turned brown""","آسیب ناشی از سرما ؛""بارش یخ زده گلها را مات کرد و آنها قهوه ای شدند""",1
44129,verb,"damage as if by shaking or jarring; ""Don't disturb the patient's wounds by moving him too rapidly!""","آسیب به عنوان اگر با تکان دادن یا تکان دادن؛""با جابجایی سریع بیمار ، زخم هایی ایجاد نکنید!""",1
44128,verb,"damage beyond the point of repair; ""My son totaled our new car""; ""the rock star totals his guitar at every concert""","آسیب فراتر از نقطه تعمیر""پسرم کل ماشین جدید ما را تشکیل داد""؛""ستاره راک در هر کنسرت گیتار خود را جمع می کند""",1
44130,verb,"cause damage or affect negatively; ""Our business was hurt by the new competition""","باعث آسیب یا تأثیر منفی شود""تجارت ما از رقابت جدید آسیب دید""",1
44131,verb,"make worse or less effective; ""His vision was impaired""","بدتر یا کمتر موثر""بینایی او مختل شده است""",1
44132,verb,"remove soil or rock; ""Rain eroded the terraces""","خاک یا سنگ را حذف کنید""باران تراسها را فرسایش داد""",1
44134,verb,cut away in small pieces,برش در قطعات کوچک,1
44136,noun,a damage or loss,خسارت یا ضرر,1
44137,noun,a change for the worse,تغییر به بدتر,1
44133,verb,"destroy or injure severely; ""The madman mutilates art work""","تخریب یا صدمه شدید""دیوانه اثر هنری را مثله می کند""",1
44135,verb,"damage or destroy as if by violence; ""The teenager banged up the car of his mother""","آسیب یا تخریب مثل اینکه با خشونت ؛""این نوجوان ماشین مادرش را بنده زد""",1
44141,noun,the act of inflicting a wound,عمل زخم زدن,1
44139,noun,damage that results in a reduction of strength or quality,آسیب هایی که منجر به کاهش قدرت یا کیفیت می شود,1
44138,noun,"a row of unravelled stitches; ""she got a run in her stocking""","یک ردیف از بخیه های باز نشده""او در جوراب زنانه خود اجرا شد""",1
44142,noun,an act that despoils the innocence or beauty of something,عملی که بی گناهی یا زیبایی چیزی را از بین می برد,1
44143,noun,the price at which something is offered for sale,قیمتی که در آن چیزی برای فروش ارائه می شود,1
44144,noun,(stock market) the price at which a broker is willing to buy a certain security,(بورس) قیمتی است که یک کارگزار مایل به خرید یک اوراق بهادار خاص است,1
44145,noun,(stock market) the price of the last transaction completed during a day's trading session,(بورس سهام) قیمت آخرین معامله انجام شده در طی یک روز معاملات روزانه,1
44140,noun,"the act of damaging the appearance or surface of something; ""the defacement of an Italian mosaic during the Turkish invasion""; ""he objected to the dam's massive disfigurement of the landscape""","عمل صدمه زدن به ظاهر یا سطح چیزی ؛""نقص زدایی از یک موزاییک ایتالیایی در زمان حمله ترکیه""؛""او به تغییر شکل چشمگیر چشم انداز سد اعتراض کرد""",1
44146,noun,price charged for goods picked up at the factory,قیمت شارژ شده برای کالاهای برداشت شده در کارخانه,1
44147,noun,"an exorbitant price; ""what they are asking for gas these days is highway robbery""","قیمت گزاف""آنچه این روزها برای بنزین درخواست می کنند سرقت از بزرگراه است""",1
44148,noun,the price at which something is actually purchased,قیمتی که در آن چیزی خریداری شده است,1
44149,noun,the current delivery price of a commodity traded in the spot market,قیمت تحویل فعلی کالایی که در بازار بورس معامله می شود,1
44151,noun,"assessed price; ""the valuation of this property is much too high""","قیمت ارزیابی شده""ارزیابی این ملک بسیار زیاد است""",1
44150,noun,(stock market) the price at which a certain security becomes attractive to investors,(بورس) قیمتی که در آن امنیت خاصی برای سرمایه گذاران جذاب می شود,1
44152,noun,any harm or injury resulting from a violation of a legal right,هرگونه آسیب یا صدمه ناشی از نقض یک حق قانونی,1
44156,verb,inlay metal with gold and silver,منبت کاری فلز با طلا و نقره,1
44157,noun,a native or inhabitant of Damascus,بومی یا ساکن دمشق است,1
44154,adjective,"designed or tending to discredit, especially without positive or helpful suggestions; ""negative criticism""","مخصوصاً بدون پیشنهادات مثبت یا مفید ، طراحی یا تمایل به بی اعتبار کردن.""انتقاد منفی""",1
44153,adjective,"(sometimes followed by `to') causing harm or injury; ""damaging to career and reputation""; ""the reporter's coverage resulted in prejudicial publicity for the defendant""","(گاهی اوقات با ""به"" همراه است) باعث آسیب یا آسیب می شود.""آسیب رساندن به شغل و شهرت"" ؛""پوشش گزارشگر منجر به تبلیغات مغرضانه متهم شد""",1
44155,adjective,"(of metals) decorated or inlaid with a wavy pattern of different (especially precious) metals; ""a damascened sword""","(از فلزات) تزئین یا منبت کاری شده با الگوی مواج از فلزات مختلف (به ویژه گرانبها) ؛""یک شمشیر لعنتی""",1
44159,noun,a design produced by inlaying gold or silver into steel,طرحی که با خاتم سازی طلا یا نقره به فولاد تولید می شود,1
44161,adjective,"having a woven pattern; ""damask table linens""","داشتن الگوی بافته شده ؛""ملحفه های میز داماسک""",1
44163,noun,linens for the dining table,ملافه برای میز ناهار خوری,1
44162,noun,a table linen made from linen with a damask pattern,یک پارچه رومیزی ساخته شده از پارچه با طرح داماسک,1
44160,noun,"a decorative or artistic work; ""the coach had a design on the doors""","یک اثر تزئینی یا هنری ؛""مربی روی درها طراحی داشت""",1
44167,noun,title used for a married Frenchwoman,عنوانی که برای یک زن فرانسوی متاهل استفاده می شود,1
44158,noun,"an ancient city (widely regarded as the world's oldest) and present capital and largest city of Syria; according to the New Testament, the Apostle Paul (then known as Saul) underwent a dramatic conversion on the road to Damascus",یک شهر باستانی (که به عنوان قدیمی ترین شهر جهان شناخته می شود) و پایتخت کنونی و بزرگترین شهر سوریه ؛طبق عهد جدید ، پولس رسول (که آن زمان به عنوان شاول شناخته می شد) در جاده دمشق دچار یک تغییر چشمگیر شد,1
44166,noun,a middle-aged or elderly woman who is stylish and highly respected,یک زن میانسال یا پیر که شیک پوش و بسیار مورد احترام است,1
44165,noun,"a woman of refinement; ""a chauffeur opened the door of the limousine for the grand lady""","یک زن پالایش شده""یک راننده درب لیموزین را برای بانوی بزرگ باز کرد""",1
44164,noun,large hardy very fragrant pink rose; cultivated in Asia Minor as source of attar of roses; parent of many hybrids,گل رز صورتی بسیار معطر و بزرگدر آسیای صغیر به عنوان منبع عطر گل رز کشت می شود.پدر و مادر بسیاری از هیبریدها,1
44170,noun,the act of damning,عمل لعنتی,1
44168,noun,"something of little value; ""his promise is not worth a damn""; ""not worth one red cent""; ""not worth shucks""","چیزی که ارزش کمی دارد.""قول او لعنتی ارزش ندارد""؛""یک سنت قرمز ارزش ندارد""؛""ارزش شاک نیست""",1
44171,noun,the state of being condemned to eternal punishment in Hell,دولت محکوم به مجازات ابدی در جهنم,1
44173,adjective,threatening with damnation,تهدید به لعنت,1
44172,noun,"(Old Testament) God's means of destroying sinners; ""his sermons were full of fire and brimstone""","(عهد عتیق) وسیله خدا برای نابودی گناهکاران ؛""خطبه های او پر از آتش و گوگرد بود""",1
44169,noun,"having no qualities that would render it valuable or useful; ""the drill sergeant's intent was to convince all the recruits of their worthlessness""","نداشتن خصوصیاتی که آن را با ارزش یا مفید جلوه دهند.""هدف گروهبان مته متقاعد کردن همه استخدام شدگان در بی ارزش بودن آنها""",1
44175,noun,a young unmarried woman,یک زن جوان مجرد,1
44176,noun,an unmarried girl (especially a virgin),یک دختر مجرد (به خصوص یک باکره),1
44178,verb,"deaden (a sound or noise), especially by wrapping",deaden (صدا یا صدا) ، به ویژه با بسته بندی,1
44180,noun,a slight wetness,کمی رطوبت,1
44174,noun,"people who are condemned to eternal punishment; ""he felt he had visited the realm of the damned""","افرادی که به مجازات ابدی محکوم می شوند.""او احساس کرد که از قلمرو لعنتی بازدید کرده است""",1
44179,verb,make (images or sounds) soft or softer,(تصاویر یا صداها) را نرم یا نرم تر کنید,1
44177,adjective,"slightly wet; ""clothes damp with perspiration""; ""a moist breeze""; ""eyes moist with tears""","کمی مرطوب""لباس با تعریق مرطوب است""؛""نسیم مرطوب""؛""چشمان مرطوب از اشک""",1
44181,noun,unpleasant wetness,رطوبت ناخوشایند,1
44184,verb,reduce the amplitude (of oscillations or waves),دامنه (نوسانات یا امواج) را کاهش دهید,1
44182,noun,"a chilly dampness; ""the rawness of the midnight air""","رطوبت سرد""خام بودن هوای نیمه شب""",1
44183,verb,"make (more) humid; ""We have a machine that humidifies the air in the house""","مرطوب (بیشتر)""ما دستگاهی داریم که هوای خانه را مرطوب می کند""",1
44185,noun,damper consisting of a small felted block that drops onto a piano string to stop its vibration,دمپر متشکل از یک بلوک نمدی کوچک است که برای جلوگیری از لرزش روی سیم پیانو می افتد,1
44186,noun,a mechanical damper; the vibrating part is attached to a piston that moves in a chamber filled with liquid,دمپر مکانیکی؛قسمت ارتعاشی به پیستونی متصل می شود که در محفظه ای پر از مایع حرکت می کند,1
44187,noun,"a depressing restraint; ""rain put a damper on our picnic plans""","یک مهار دلگیر""باران برای برنامه های پیک نیک ما یک دمپر قرار داد""",1
44190,noun,sweet dark purple plum,آلو بنفش تیره شیرین,1
44189,noun,large primitive predatory aquatic insect having two pairs of membranous wings,حشره آبزی درنده ابتدایی بزرگ دارای دو جفت بال غشایی,1
44188,noun,slender non-stinging insect similar to but smaller than the dragonfly but having wings folded when at rest,حشره باریک و بدون نیش شبیه به سنجاقک اما کوچکتر از آن اما در حالت استراحت بالهایی تا خورده است,1
44191,noun,plum tree long cultivated for its edible fruit,درخت آلو به مدت طولانی برای میوه خوراکی خود کشت می شد,1
44193,verb,"shift or move by taking a step; ""step back""","با برداشتن یک قدم تغییر مکان دهید یا حرکت کنید ؛""قدم به عقب""",1
44194,verb,"perform a glissade, in ballet",یک بامزه را در باله اجرا کنید,1
44195,verb,"perform a chasse step, in ballet",اجرای یک مرحله تعقیب و گریز ، در باله,1
44196,verb,dance to jive music; dance the jive,رقص با موسیقی جیورقصیدن,1
44197,verb,perform a tap dance,اجرای رقص ضربه بزنید,1
44192,noun,any of numerous varieties of small to medium-sized round or oval fruit having a smooth skin and a single pit,انواع مختلف میوه های گرد یا بیضی شکل کوچک تا متوسط دارای پوستی صاف و یک گودال,1
44198,verb,perform a belly dance,اجرای رقص شکم,1
44200,verb,dance a shimmy,براق,1
44199,verb,"perform with the heels; ""heel that dance""","با پاشنه پا انجام دهید؛""آن پاشنه رقص""",1
44201,verb,do the twist,پیچ و تاب انجام دهید,1
44202,verb,dance a waltz,یک والس برقص,1
44204,verb,dance a tango,رقص تانگو,1
44205,verb,dance the shag,رقصیدن,1
44206,verb,dance the foxtrot,رقص حرامزاده,1
44207,verb,perform a contradance,انجام یک تناقض,1
44209,verb,dance the conga,کنگا برقص,1
44208,verb,perform the cakewalk dance,رقص cakewalk را انجام دهید,1
44210,verb,dance the samba,رقص سامبا,1
44211,verb,dance the two-step,دو مرحله ای برقص,1
44203,verb,"dance and make rhythmic clicking sounds by means of metal plates nailed to the sole of the dance shoes; ""Glover tapdances better than anybody""","با صفحات فلزی میخ شده به کف کفش رقص برقصید و صدای کلیک موزون ایجاد کنید.""Glover tapdances بهتر از هر کسی""",1
44212,verb,dance the Charleston,چارلستون را برقص,1
44214,verb,dance the cha-cha,رقصیدن,1
44213,verb,dance to boogie music,رقص به موسیقی بوگی,1
44215,verb,dance to disco music,رقصیدن به موسیقی دیسکو,1
44216,verb,dance a mambo,رقص مامبو,1
44217,verb,dance a polka,رقص پولکا,1
44218,verb,dance the one-step,یک مرحله رقصیدن,1
44219,verb,dance the rhumba,رقص رومبا,1
44220,verb,dance the slam dance,رقص اسلم را برقصید,1
44222,verb,do the jitterbug,jitterbug را انجام دهید,1
44223,verb,perform a folk-dance,اجرای رقص محلی,1
44224,verb,perform a quickstep,انجام سریع,1
44225,verb,kick a leg up,لگد زدن به بالا,1
44221,verb,dance a quick dance with leaping and kicking motions,با حرکات جهشی و لگد زدن ، یک رقص سریع برقصید,1
44226,verb,dance the skank,رقصیدن,1
44228,verb,"skip, leap, or move up and down or sideways; ""Dancing flames""; ""The children danced with joy""","پرش ، جهش ، یا حرکت به سمت بالا و پایین یا پهلو ؛""شعله های رقص""؛""بچه ها از شادی رقصیدند""",1
44230,noun,"a group of people gathered together for pleasure; ""she joined the party after dinner""","گروهی از مردم برای لذت دور هم جمع شدند.""او بعد از شام به مهمانی پیوست""",1
44227,verb,"dance by rotating the pelvis in an erotically suggestive way, often while in contact with one's partner such that the dancers' legs are interlaced",با چرخاندن لگن به روشی وابسته به عشق شهوانی ، اغلب در تماس با شریک زندگی خود به گونه ای رقصید که پاهای رقصنده بهم بخورد,1
44231,noun,a form of solo dancing that involves rapid acrobatic moves in which different parts of the body touch the ground; normally performed to the rhythm of rap music,نوعی رقص انفرادی است که شامل حرکات سریع آکروباتیک است که در آن نقاط مختلف بدن با زمین تماس می گیرند.به طور معمول با ریتم موسیقی رپ اجرا می شود,1
44229,noun,"the ability to raise the working leg high in the air; ""the dancer was praised for her uncanny extension""; ""good extension comes from a combination of training and native ability""","توانایی بالا بردن پای کار در هوا ؛""این رقصنده به دلیل تمدید غیرعادی خود مورد ستایش قرار گرفت""؛""پیشرفت خوب از ترکیبی از آموزش و توانایی بومی ناشی می شود""",1
44233,noun,a stately court dance of the 16th and 17th centuries,رقص دادگاه با شکوه قرون 16 و 17,1
44232,noun,an intricate traditional dance in India performed by professional dancing girls,یک رقص سنتی پیچیده در هند که توسط دختران رقصنده حرفه ای اجرا می شود,1
44234,noun,dance movements that are linked in a single choreographic sequence,حرکات رقصی که در یک سکانس رقص تنها به هم پیوند می خورند,1
44235,noun,a stately court dance of the 17th and 18th centuries; in slow time,رقص درباری باشکوه قرن 17 و 18؛در زمان کند,1
44239,noun,a dance performed on tiptoe,رقصی که روی نوک پا اجرا می شود,1
44238,noun,dancing in which the steps are more important than gestures or postures,رقصیدن که در آن مراحل مهم تر از حرکات یا حالت ها هستند,1
44237,noun,a form of dancing in which dancers slam into one another; normally performed to punk rock,نوعی رقص که در آن رقصنده ها به یکدیگر انتقاد می کنند.به طور معمول برای پانک راک اجرا می شود,1
44236,noun,a rhythmic dance to reggae music performed by bending forward and extending the hands while bending the knees,رقص موزون به موسیقی رگی که با خم شدن به جلو و کشیدن دستها هنگام خم شدن زانوها انجام می شود,1
44240,noun,dancing as part of a social occasion,رقصیدن به عنوان بخشی از یک مناسبت اجتماعی,1
44241,noun,a Latin American dance similar in rhythm to the rumba,رقص آمریکای لاتین از نظر ریتم شبیه رومبا,1
44242,noun,a dance that is part of a religious ritual,رقصی که بخشی از یک آیین مذهبی است,1
44245,noun,a dance party featuring country dancing,یک مهمانی رقص با رقص کشور,1
44243,noun,a small metal plate that attaches to the toe or heel of a shoe (as in tap dancing),یک صفحه فلزی کوچک که به انگشت یا پاشنه کفش متصل می شود (مانند رقص شیر),1
44246,noun,an informal dance where popular music is played,رقص غیررسمی که موسیقی عامه پسند پخش می شود,1
44244,noun,a person who entertains people for money in public places (as by singing or dancing),شخصی که مردم را برای پول در مکانهای عمومی سرگرم می کند (مانند آواز یا رقص),1
44248,noun,a man who directs and teaches and rehearses dancers for a ballet company,مردی که رقصنده ها را برای یک شرکت باله کارگردانی و آموزش می دهد و تمرین می کند,1
44247,noun,"a dance party that lasts all night and electronically synthesized music is played; ""raves are very popular in Berlin""","یک مهمانی رقص که تمام شب ادامه دارد و موسیقی تلفیقی الکترونیکی پخش می شود.""raves در برلین بسیار محبوب هستند""",1
44251,noun,a professional teacher of dancing,یک معلم حرفه ای رقص,1
44249,noun,a woman who directs and teaches and rehearses dancers for a ballet company,زنی که رقصنده ها را برای یک شرکت باله کارگردانی و آموزش می دهد و تمرین می کند,1
44250,noun,a woman who performs a solo Oriental dance using exaggerated abdominal movements,زنی که با استفاده از حرکات اغراق آمیز شکم ، یک رقص شرقی شرقی را اجرا می کند,1
44252,noun,a professional dancer,یک رقاص حرفه ای,1
44254,noun,a professional dancing girl in India,یک دختر رقصنده حرفه ای در هند,1
44253,noun,a masked dancer during a Pueblo religious ceremony who is thought to embody some particular spirit,یک رقصنده نقابدار در طی یک مراسم مذهبی پوبلو که تصور می شود روح خاصی را مجسم می کند,1
44257,noun,Cuban dancer and choreographer (born in 1921),رقصنده و طراح رقص کوبایی (متولد 1921),1
44256,noun,a woman employed to dance with patrons who pay a fee for each dance,یک زن شاغل برای رقص با مشتریانی که برای هر رقص هزینه می پردازند,1
44255,noun,a dancer who sounds out rhythms by using metal taps on the toes and heels of the shoes,رقصنده ای که با استفاده از ضربه های فلزی روی انگشتان پا و پاشنه کفش ریتم ها را به صدا در می آورد,1
44258,noun,United States dancer and choreographer (born in Russia) noted for his abstract and formal works (1904-1983),رقصنده و طراح رقص ایالات متحده (متولد روسیه) به خاطر کارهای انتزاعی و رسمی خود (1903-1983),1
44260,noun,United States dancer and choreographer (born in 1922),رقصنده و طراح رقص ایالات متحده (متولد 1922),1
44259,noun,Russian dancer and choreographer who migrated to the United States (born in 1948),رقاص و طراح رقص روسی که به ایالات متحده مهاجرت کرده است (متولد 1948),1
44262,noun,United States dancer and pioneer of modern dance (1878-1927),رقصنده و پیشگام رقص مدرن ایالات متحده (1878-1927),1
44261,noun,United States dancer and choreographer who introduced formal dance to a wide audience (born in 1905),رقصنده و طراح رقص ایالات متحده که رقص رسمی را به مخاطبان گسترده ای معرفی کرد (متولد 1905),1
