id,pos,gloss,persian_gloss,checked
44623,adjective,"lacking animation or excitement or activity; ""the party being dead we left early""; ""it was a lifeless party until she arrived""","فاقد انیمیشن یا هیجان یا فعالیت ؛""حزب در حال مردن است که ما زود ترک کردیم""؛""این یک مهمانی بی روح بود تا وقتی که او آمد""",1
44626,noun,"people who are no longer living; ""they buried the dead""","افرادی که دیگر زندگی نمی کنند.""آنها مردگان را دفن کردند""",1
44628,noun,"someone who is no longer alive; ""I wonder what the dead person would have done""","کسی که دیگر زنده نیست.""من تعجب می کنم که شخص مرده چه کاری انجام می داد""",1
44632,noun,a tie in a race,یک تساوی در یک مسابقه,1
44629,noun,"a time when coldness (or some other quality associated with death) is intense; ""the dead of winter""","زمانی که سردی (یا برخی از کیفیت های دیگر مرتبط با مرگ) شدید است.""مردگان زمستان""",1
44630,noun,the position of a crank when it is in line with the connecting rod and not exerting torque,موقعیت میل لنگ هنگامی که با میله اتصال هم راستا باشد و گشتاور اعمال نکند,1
44634,noun,the state of something that has outlived its relevance,حالت چیزی که از اهمیت خود گذشته است,1
44631,noun,"a situation in which no progress can be made or no advancement is possible; ""reached an impasse on the negotiations""","وضعیتی که در آن هیچ پیشرفتی حاصل نمی شود یا پیشرفتی امکان پذیر نیست.""به بن بست در مذاکرات رسید""",1
44635,noun,mail that can neither be delivered nor returned,نامه ای که نه قابل تحویل است و نه برگشت,1
44636,noun,a slow march to be played for funeral processions,یک راهپیمایی آرام برای موکب های تشییع جنازه برگزار می شود,1
44637,noun,a march to be played for processions,راهپیمایی ای که برای موکب ها برگزار می شود,1
44633,noun,"the finish of a contest in which the score is tied and the winner is undecided; ""the game ended in a draw""; ""their record was 3 wins, 6 losses and a tie""","پایان مسابقه ای که در آن امتیاز مساوی شود و برنده بلاتکلیف باشد.""بازی با تساوی به پایان رسید""؛""رکورد آنها 3 برد ، 6 باخت و یک تساوی بود""",1
44638,noun,someone who fails to meet a financial obligation,کسی که قادر به انجام یک تعهد مالی نیست,1
44639,noun,a person who owes a creditor; someone who has the obligation of paying a debt,شخصی که طلبکار است.کسی که تعهد پرداخت بدهی را دارد,1
44640,noun,a father who defaults on his obligation to provide financial support for his offspring,پدری که به تعهد خود در تأمین حمایت مالی از فرزندان خود کوتاهی می کند,1
44642,verb,"lessen the momentum or velocity of; ""deaden a ship's headway""","حرکت یا سرعت را کاهش دهید""سر یک کشتی را بکش""",1
44641,verb,"cut a girdle around so as to kill by interrupting the circulation of water and nutrients; ""girdle the plant""","یک کمربند را به اطراف قطع کنید تا با قطع شدن جریان آب و مواد مغذی ، از بین برود.""گیاه را کمربند بزنید""",1
44643,verb,"cause to move more slowly or operate at a slower rate; ""This drug will retard your heart rate""","باعث حرکت کندتر یا کار با سرعت کمتری می شود.""این دارو ضربان قلب شما را عقب می اندازد""",1
44645,noun,a train or bus or taxi traveling empty,قطار یا اتوبوس یا تاکسی خالی سفر می کند,1
44646,noun,the quality of being deadly,کیفیت کشنده بودن,1
44644,noun,"a nonenterprising person who is not paying his way; ""the deadheads on the payroll should be eased out as fast as possible""","یک شخص غیرانتفاعی که راه خود را پرداخت نمی کند.""بن بستهای حقوق و دستمزد باید هرچه سریعتر کاهش یابد""",1
44650,adjective,bringing death,مرگ آوردن,1
44648,noun,the quality of being able to cause death or fatal disasters,کیفیت توانایی ایجاد مرگ یا فاجعه های مهلک,1
44647,noun,the quality of being unhealthful and generally bad for you,کیفیت ناسالم بودن و به طور کلی برای شما بد است,1
44649,adjective,"causing or capable of causing death; ""a fatal accident""; ""a deadly enemy""; ""mortal combat""; ""a mortal illness""","ایجاد یا توانایی ایجاد مرگ""یک حادثه مرگبار""؛""دشمن کشنده""؛""مبارزه مرگبار""؛""یک بیماری فانی""",1
44651,adjective,"of an instrument of certain death; ""deadly poisons""; ""lethal weapon""; ""a lethal injection""","از ابزار مرگ حتمی""سموم کشنده""؛""سلاح کشنده""؛""یک تزریق کشنده""",1
44652,adjective,"extremely poisonous or injurious; producing venom; ""venomous snakes""; ""a virulent insect bite""","بسیار سمی یا آسیب رسان ؛تولید سم""مارهای سمی""؛""نیش حشرات آلوده""",1
44654,adjective,"involving loss of divine grace or spiritual death; ""the seven deadly sins""","شامل از دست دادن فیض الهی یا مرگ معنوی ؛""هفت گناه مرگبار""",1
44653,adjective,"of or relating to or caused by a toxin or poison; ""suffering from exposure to toxic substances""","از یک سم یا سم یا مربوط یا ناشی از آن.""از قرار گرفتن در معرض مواد سمی رنج می برند""",1
44655,adjective,"not admitting of pardon; ""unpardonable behavior""","عدم پذیرش بخشش""رفتار غیرقابل بخشش""",1
44656,adjective,(of a disease) having a rapid course and violent effect,(از یک بیماری) دارای سیر سریع و اثر خشن,1
44657,adjective,infectious; having the ability to cause disease,عفونیتوانایی ایجاد بیماری,1
44659,noun,an act that is regarded by theologians as a transgression of God's will,عملی که نزد متکلمین به عنوان تخلف از اراده خداوند تلقی می شود,1
44660,noun,unreasonable and inordinate self-esteem (personified as one of the deadly sins),عزت نفس نامعقول و بی رویه (به عنوان یکی از گناهان کشنده),1
44658,adverb,"(used as intensives) extremely; ""she was madly in love""; ""deadly dull""; ""deadly earnest""; ""deucedly clever""; ""insanely jealous""","(به عنوان فشرده استفاده می شود) فوق العاده ؛""او دیوانه وار عاشق بود""؛""کسل کننده مرگبار""؛""جدی کشنده""؛""هوشمندانه باهوش""""دیوانه وار حسود""",1
44662,noun,eating to excess (personified as one of the deadly sins),خوردن بیش از حد (به عنوان یکی از گناهان کشنده),1
44661,noun,spite and resentment at seeing the success of another (personified as one of the deadly sins),کینه و کینه از دیدن موفقیت دیگری (به عنوان یکی از گناهان کشنده),1
44663,noun,self-indulgent sexual desire (personified as one of the deadly sins),تمایل جنسی به خویشتن داری (به عنوان یکی از گناهان کشنده),1
44665,noun,someone or something that is unwanted and unneeded,کسی یا چیزی که ناخواسته و غیر ضروری است,1
44667,adjective,lacking or deprive of the sense of hearing wholly or in part,حس شنوایی به طور کامل یا جزئی را کم یا محروم کنید,1
44664,adjective,"deliberately impassive in manner; ""deadpan humor""; ""his face remained expressionless as the verdict was read""","به عمد از نظر شیوه ای بی احساس ؛""شوخ طبعی مرده""؛""با خواندن حکم ، چهره او بی بیان ماند""",1
44668,adjective,lacking the sense of hearing and the ability to speak,فاقد حس شنوایی و توانایی صحبت کردن است,1
44669,adjective,caused to hear poorly or not at all,باعث ضعف یا اصلاً شنیدن نشود,1
44666,noun,"the attribute of being superfluous and unneeded; ""the use of industrial robots created redundancy among workers""","صفت زاید و بی نیاز بودن؛""استفاده از رباتهای صنعتی باعث ایجاد افزونگی در کارگران""",1
44670,adjective,having a hearing loss,کم شنوایی,1
44671,adjective,totally deaf; unable to hear anything,کاملا ناشنواقادر به شنیدن چیزی نیست,1
44672,adjective,unable to appreciate music,قادر به درک موسیقی نیست,1
44674,verb,"make or render deaf; ""a deafening noise""","ناشنوا کردن""یک صدای ناشنوا""",1
44676,noun,a person with a severe auditory impairment,شخصی با اختلال شنوایی شدید,1
44677,verb,"be unbearably loud; ""a deafening noise""","غیر قابل تحمل بلند""یک صدای ناشنوا""",1
44673,adjective,"(usually followed by `to') unwilling or refusing to pay heed; ""deaf to her warnings""","(که معمولاً ""به"" دنبال می شود) تمایلی یا امتناع از پرداخت توجه ندارید.""ناشنوا نسبت به هشدارهای او""",1
44675,noun,"people who have severe hearing impairments; ""many of the deaf use sign language""","افرادی که کم شنوایی شدید دارند.""بسیاری از ناشنوایان از زبان اشاره استفاده می کنند""",1
44678,verb,sell or offer for sale from place to place,فروش یا پیشنهاد فروش از مکانی به مکان دیگر,1
44679,verb,deal cards wrongly,کارت ها را اشتباه معامله کنید,1
44682,noun,a deal to provide military arms,یک معامله برای تهیه اسلحه نظامی,1
44680,verb,"give (a specific card) to a player; ""He dealt me the Queen of Spades""","(یک کارت خاص) به یک بازیکن بدهید.""او با من به ملکه پیک معامله کرد""",1
44683,noun,a business deal on a trivial scale,یک معامله تجاری در مقیاس بی اهمیت,1
44684,noun,wood that is easy to saw (from conifers such as pine or fir),چوبی که به راحتی دیده می شود (از مخروطیان مانند کاج یا صنوبر),1
44685,noun,softwood used to make paper,چوب نرم که برای ساختن کاغذ استفاده می شود,1
44686,noun,the 5 cards held in a game of poker,5 کارت برگزار شده در یک بازی پوکر,1
44681,noun,"a particular instance of buying or selling; ""it was a package deal""; ""I had no further trade with him""; ""he's a master of the business deal""","یک مورد خاص از خرید یا فروش ؛""این یک قرارداد بسته بود""؛""من دیگر تجارتى با او نداشتم""؛""او استاد معامله تجاری است""",1
44688,noun,fair treatment,برخورد عادلانه,1
44689,noun,unfair treatment,رفتار غیر منصفانه,1
44691,noun,an incorrect deal,یک معامله نادرست,1
44687,noun,"the type of treatment received (especially as the result of an agreement); ""he got a good deal on his car""","نوع درمان دریافت شده (به ویژه در نتیجه توافق)""او معامله خوبی با ماشین خود انجام داد""",1
44692,noun,a reapportioning of something,تغییر کاربری چیزی,1
44693,noun,a dealer in works of art requiring esthetic evaluation,یک فروشنده در کارهای هنری که نیاز به ارزیابی زیبایی دارند,1
44690,noun,"the act of distributing playing cards; ""the deal was passed around the table clockwise""","عمل توزیع کارت های بازی ؛""این معامله در جهت عقربه های ساعت به دور میز انجام شد""",1
44695,noun,someone who sells fish,کسی که ماهی می فروشد,1
44696,noun,a hard bargainer,یک معامله گر سخت,1
44694,noun,a dealer in fabrics and sewing materials (and sometimes in clothing and drygoods),فروشنده پارچه و مواد خیاطی (و گاهی اوقات در لباس و کالاهای خشک),1
44698,noun,a dealer in seeds,فروشنده بذر,1
44700,noun,someone who buys and sells stock shares,شخصی که سهام سهام را خریداری و می فروشد,1
44697,noun,"someone who sells hardware; ""in England they call a hardwareman an ironmonger""","کسی که سخت افزار می فروشد""در انگلیس آنها یک سخت افزار را آهن فروش می نامند""",1
44699,noun,a dealer in stamps (whose customers are stamp collectors),یک فروشنده تمبر (که مشتریان آن جمع کننده تمبر هستند),1
44701,noun,a firm engaged in trading,یک شرکت درگیر تجارت است,1
44702,noun,a firm that sells and buys cars,شرکتی که ماشین می فروشد و می خرد,1
44703,noun,a firm that sells and buys computers,شرکتی که کامپیوتر می فروشد و می خرد,1
44704,noun,a firm that sells and buys jewelry,یک شرکت فروش و خرید جواهرات,1
44705,noun,a firm that sells and buys trucks,شرکتی که کامیون می فروشد و می خرد,1
44706,noun,"a seller of illicit goods; ""a dealer in stolen goods""","فروشنده کالاهای غیرقانونی""فروشنده کالاهای سرقت شده""",1
44707,noun,someone who promotes or exchanges goods or services for money,کسی که کالاها یا خدمات را با پول تبلیغ یا مبادله می کند,1
44710,noun,the person who distributes the playing cards in a card game,شخصی که کارت های بازی را در یک بازی کارت توزیع می کند,1
44708,noun,the major party to a financial transaction at a stock exchange; buys and sells for his own account,طرف اصلی یک معامله مالی در بورس سهام؛برای حساب خودش خرید و فروش می کند,1
44711,noun,"method or manner of conduct in relation to others; ""honest dealing""","روش یا نحوه رفتار در ارتباط با دیگران ؛""معامله صادقانه""",1
44709,noun,a financial specialist who trades for his own account and so acts both as a broker and principal,یک متخصص مالی که برای حساب خودش معامله می کند و بنابراین هم به عنوان دلال و هم به عنوان مدیر اصلی عمل می کند,1
44713,noun,"transactions of professional or public interest; ""news of current affairs""; ""great affairs of state""","معاملات منافع حرفه ای یا عمومی ؛""اخبار امور روز""؛""امور بزرگ دولت""",1
44712,noun,"the management of someone or something; ""the handling of prisoners""; ""the treatment of water sewage""; ""the right to equal treatment in the criminal justice system""","مدیریت شخصی یا چیزی""رسیدگی به زندانیان"" ؛""تصفیه فاضلاب آب"" ؛""حق برخورد برابر در سیستم عدالت کیفری""",1
44716,noun,a transaction in the stock market at a price below the price of the preceding transaction,معامله در بازار سهام با قیمتی کمتر از قیمت معامله قبلی,1
44714,noun,financial transactions at a brokerage; having to do with the execution of trades and keeping customer records,معاملات مالی در کارگزاری ؛داشتن ارتباط با اجرای معاملات و ثبت سوابق مشتری,1
44718,noun,obtaining funds from a lender,اخذ وجوه از وام دهنده,1
44715,noun,"the act of giving something in return for something received; ""deductible losses on sales or exchanges of property are allowable""","عمل دادن چیزی در ازای دریافتی ؛""زیان کسر در فروش یا مبادله املاک مجاز است""",1
44717,noun,a transaction in the stock market at a price above the price of the preceding transaction,یک معامله در بازار سهام با قیمت بالاتر از قیمت معامله قبلی,1
44720,noun,an administrator in charge of a division of a university or college,یک مدیر مسئول یک واحد دانشگاه یا کالج,1
44719,noun,the transaction in 1867 in which the United States secretary of state William Henry Seward purchased Alaska from Russia,معامله در سال 1867 که در آن وزیر امور خارجه ایالات متحده ویلیام هنری سوارد آلاسکا را از روسیه خریداری کرد,1
44721,noun,"a man who is the senior member of a group; ""he is the dean of foreign correspondents""","مردی که عضو ارشد یک گروه است.""او رئیس خبرنگاران خارجی است""",1
44723,noun,a sweet innocent mild-mannered person (especially a child),یک فرد مطبوع و معصوم شیرین و بی گناه (به خصوص کودک),1
44724,noun,an acute insufficiency,یک نارسایی حاد,1
44722,adjective,"earnest; ""one's dearest wish""; ""devout wishes for their success""; ""heartfelt condolences""","جدی""عزیزترین آرزو""""آرزوهای متعال برای موفقیت آنها""؛""تسلیت صمیمانه""",1
44725,noun,an insufficient quantity or number,مقدار یا تعداد ناکافی,1
44726,noun,a small and inadequate amount,مقدار کمی و ناکافی,1
44729,noun,"euphemistic expressions for death; ""thousands mourned his passing""","عبارات خوش بیان برای مرگ؛""هزاران نفر از مرگ او عزادار شدند""",1
44727,noun,death that is imposed because of the person's adherence of a religious faith or cause,مرگی که به دلیل پایبندی شخص به ایمان یا علت دینی تحمیل می شود,1
44728,noun,"the death of a million people; ""they calibrate the effects of atom bombs in megadeaths""","مرگ یک میلیون نفر ؛""آنها اثرات بمبهای اتمی را در مقیاس بزرگ درجه بندی می کنند""",1
44731,noun,"the permanent end of all life functions in an organism or part of an organism; ""the animal died a painful death""","پایان دائمی تمام عملکردهای زندگی در ارگانیسم یا بخشی از ارگانیسم.""حیوان با مرگ دردناک مرد""",1
44732,noun,(physiology) the normal degeneration and death of living cells (as in various epithelial cells),(فیزیولوژی) تخریب طبیعی و مرگ سلولهای زنده (مانند سلولهای مختلف اپیتلیال),1
44730,noun,a death that results from a wrongful act or from negligence; a death that can serve as the basis for a civil action for damages on behalf of the dead person's family or heirs,مرگی که نتیجه یک عمل نادرست یا سهل انگاری باشد.مرگی که می تواند مبنای دادرسی مدنی برای جبران خسارت از طرف خانواده یا وراث شخص متوفی باشد,1
44733,noun,the localized death of living cells (as from infection or the interruption of blood supply),مرگ موضعی سلولهای زنده (مانند عفونت یا قطع خونرسانی),1
44734,noun,death when respiration and other reflexes are absent; consciousness is gone; organs can be removed for transplantation before the heartbeat stops,مرگ هنگام تنفس و سایر بازتاب هاآگاهی از بین رفته استاندامها را می توان قبل از توقف ضربان قلب برای پیوند خارج کرد,1
44735,noun,"the time at which life ends; continuing until dead; ""she stayed until his death""; ""a struggle to the last""","زمانی که زندگی به پایان می رسد.ادامه دادن تا مردن""او تا زمان مرگش ماند""؛""یک مبارزه تا آخرین""",1
44736,noun,"the personification of death; ""Death walked the streets of the plague-bound city""","شخصیت پردازی مرگ ؛""مرگ در خیابان های شهر طاعونی قدم زد""",1
44737,noun,Death personified as an old man or a skeleton with a scythe,مرگ به صورت پیرمرد یا اسکلتی با داس مجسم شده است,1
44738,noun,"the absence of life or state of being dead; ""he seemed more content in death than he had ever been in life""","عدم وجود زندگی یا حالت مرده بودن""به نظر می رسید که او در مرگ بیش از هرگز در زندگی راضی بود""",1
44740,noun,"no longer in existence; ""the extinction of a species""","دیگر وجود ندارد""انقراض یک گونه""",1
44741,noun,death of a liveborn infant within the first 28 days of life,مرگ یک نوزاد زنده در 28 روز اول زندگی,1
44742,noun,sudden and unexpected death of an apparently healthy infant during sleep,مرگ ناگهانی و غیرمنتظره یک نوزاد به ظاهر سالم در هنگام خواب,1
44743,noun,"the time when something ends; ""it was the death of all his plans""; ""a dying of old hopes""","زمانی که چیزی به پایان می رسد""این مرگ همه برنامه های او بود""؛""مردن امیدهای قدیمی""",1
44739,noun,"euphemisms for death (based on an analogy between lying in a bed and in a tomb); ""she was laid to rest beside her husband""; ""they had to put their family pet to sleep""","حسن تعبیر برای مرگ (براساس قیاس بین خوابیدن در تخت و آرامگاه) ؛""او در کنار همسرش آرام گرفت""""آنها مجبور شدند حیوان خانگی خانواده خود را بخوابانند""",1
44745,noun,"the act of killing; ""he had two deaths on his conscience""","عمل قتل""او بر وجدان خود دو مرگ داشت""",1
44744,noun,"death of a person; ""he went to his grave without forgiving me""; ""from cradle to grave""","مرگ یک نفر""او بدون اینکه مرا ببخشد به مزار خود رفت""؛""از گهواره تا گور""",1
44747,noun,a tax on the estate of the deceased person,مالیات بر املاک شخص متوفی,1
44746,noun,"a final state; ""he came to a bad end""; ""the so-called glorious experiment came to an inglorious end""","حالت نهایی""او به پایان بدی رسید""؛""آزمایش به اصطلاح با شکوه به پایان بی آبروئی رسید""",1
44749,noun,a warrant to execute the death sentence,حکمی برای اجرای حکم اعدام,1
44750,noun,the last few hours before death,چند ساعت قبل از مرگ,1
44748,noun,any tax levied on the passing of title to property,هر مالیاتی که از تصویب حق مالکیت گرفته می شود,1
44753,noun,a sound defeat,یک شکست صدا,1
44754,verb,"bar temporarily; from school, office, etc.",نوار به طور موقتاز مدرسه ، دفتر و غیره,1
44751,noun,flooding caused by a tumultuous breakup of ice in a river during the spring or summer,طغیان ناشی از شکست یخی یخ ها در رودخانه در بهار یا تابستان,1
44755,verb,"suspend temporarily from college or university, in England",به طور موقت از تحصیل در کالج یا دانشگاه در انگلیس معلق شوید,1
44752,noun,"the rising of a body of water and its overflowing onto normally dry land; ""plains fertilized by annual inundations""","بالا آمدن یک توده آب و سرریز شدن آن به زمین خشک معمولاً.""دشت هایی که با آبگیری سالانه بارور می شوند""",1
44756,verb,"go ashore; ""The passengers disembarked at Southampton""","ساحل رفتن""مسافران در ساوتهمپتون پیاده شدند""",1
44758,noun,debarkation from a boat or ship,پیاده سازی از یک قایق یا کشتی,1
44757,noun,the act of passengers and crew getting off of a ship or aircraft,عمل مسافران و خدمه که از کشتی یا هواپیما پیاده می شوند,1
44760,noun,a temporary debarment (from a privilege or position etc),تخفیف موقت (از یک امتیاز یا موقعیت و غیره),1
44759,noun,the state of being debarred (excluded from enjoying certain possessions or rights or practices),وضعیت محروم بودن (از برخورداری از دارایی ها یا حقوق یا شیوه های خاص مستثنی),1
44762,noun,destroying the moral basis for a doctrine or policy,از بین بردن اساس اخلاقی یک دکترین یا سیاست,1
44763,noun,the act of making something attractive to the general public,عمل جذاب ساختن چیزی برای عموم مردم,1
44761,noun,"the act of degrading people with respect to their best qualities; ""science has been blamed for the dehumanization of modern life""","عمل تحقیرآمیز مردم با توجه به بهترین خصوصیات آنها ؛""علم به دلیل غیرانسانی شدن زندگی مدرن مقصر شناخته شده است""",1
