id,pos,gloss,persian_gloss,checked
43605,noun,"having curves; ""he hated the sinuosity of mountain roads""","منحنی داشتن""او از صداقت جاده های کوهستانی متنفر بود""",1
43608,noun,a line on a graph representing data,یک خط روی نمودار نمایانگر داده ها,1
43606,noun,a curve or surface whose equation (in Cartesian coordinates) is of the second degree,منحنی یا سطحی که معادله آن (در مختصات دکارتی) درجه دوم است,1
43607,noun,a line generated by a point on one figure rolling around a second figure,یک خط تولید شده توسط یک نقطه روی یک شکل که در اطراف یک شکل دوم قرار دارد,1
43609,noun,a smooth curve fitted to the set of paired data in regression analysis; for linear regression the curve is a straight line,منحنی صاف متناسب با مجموعه داده های جفت شده در تحلیل رگرسیون.برای رگرسیون خطی منحنی یک خط مستقیم است,1
43611,noun,Eurasian pigeon with white patches on wings and neck,کبوتر اوراسیا با لکه های سفید روی بال و گردن,1
43612,noun,type genus of the Columbidae: typical pigeons,جنس نوع Columbidae: کبوترهای معمولی,1
43610,noun,a light leap by a horse in which both hind legs leave the ground before the forelegs come down,یک جهش سبک توسط اسبی که در آن هر دو پای عقب قبل از پایین آمدن بازوها ، زمین را ترک می کنند,1
43613,noun,wild and domesticated birds having a heavy body and short legs,پرندگان وحشی و اهلی دارای بدن سنگین و پاهای کوتاه,1
43616,noun,a mechanical device using confined air to absorb the shock of motion,یک وسیله مکانیکی با استفاده از هوای محدود شوک حرکت را جذب می کند,1
43614,noun,"a mechanical damper; absorbs energy of sudden impulses; ""the old car needed a new set of shocks""","دمپر مکانیکی؛انرژی تکانه های ناگهانی را جذب می کند.""ماشین قدیمی به مجموعه جدیدی از شوک نیاز داشت""",1
43618,noun,a cushion usually made of rubber or plastic that can be inflated,یک کوسن که معمولاً از لاستیک یا پلاستیک ساخته شده و قابل باد شدن است,1
43617,noun,a soft bag filled with air or a mass of padding such as feathers or foam rubber etc.,یک کیسه نرم پر از هوا یا انبوهی از پر کردن مانند پر یا لاستیک کف و غیره,1
43615,noun,"a device that decreases the amplitude of electronic, mechanical, acoustical, or aerodynamic oscillations",دستگاهی که دامنه نوسانات الکترونیکی ، مکانیکی ، صوتی یا آیرودینامیکی را کاهش می دهد,1
43619,noun,a cushion on a throne for a prince in India,یک بالش روی تخت برای شاهزاده ای در هند,1
43622,noun,a cushion that makes a seat more comfortable,بالشتکی که صندلی را راحت تر می کند,1
43621,noun,a small stiff cushion into which pins are stuck ready for use,یک بالشتک کوچک سفت که سنجاق ها برای استفاده در آن گیر کرده اند,1
43623,noun,a small cushion that is used for decorative purposes,یک بالشتک کوچک که برای اهداف تزئینی استفاده می شود,1
43620,noun,a cushion attached to the top of the back of an automobile's seat to prevent whiplash,یک بالشتک متصل به قسمت پشتی صندلی اتومبیل برای جلوگیری از شلاق زدن,1
43624,noun,point formed by two intersecting arcs (as from the intrados of a Gothic arch),نقطه ای که توسط دو قوس متقاطع شکل گرفته است (همانطور که از intrados یک قوس گوتیک است),1
43625,noun,a thin triangular flap of a heart valve,فلپ نازک مثلثی دریچه قلب,1
43626,noun,a valve to control one-way flow of blood,دریچه ای برای کنترل جریان یک طرفه خون,1
43627,noun,a movable piece of tissue partly connected to the body,یک قطعه متحرک از بافت که تا حدی به بدن متصل است,1
43628,noun,small elevation on the grinding surface of a tooth,ارتفاع کوچک در سطح آسیاب دندان,1
43631,noun,someone who torments,کسی که عذاب می دهد,1
43630,noun,a persistently annoying person,یک فرد مداوم آزار دهنده است,1
43629,noun,a receptacle for spit (usually in a public place),ظرف مخصوص تف (معمولاً در مکان عمومی),1
43632,adjective,stubbornly persistent in wrongdoing,سرسختانه در کار نادرست پافشاری می کند,1
43635,noun,baked custard topped with caramel,کاسترد پخته شده با کارامل,1
43636,noun,custard sauce flavored with vanilla or a liqueur,سس کاستارد با طعم وانیل یا لیکور,1
43637,noun,custard sprinkled with sugar and broiled,کاستارد پاشیده شده با شکر و کبابی,1
43634,noun,sweetened mixture of milk and eggs baked or boiled or frozen,مخلوط شیرین شده شیر و تخم مرغ پخته یا جوشانده یا منجمد,1
43633,adjective,"not reformed morally or spiritually; ""unregenerate human nature""; ""unregenerate conservatism""","اصلاح اخلاقی یا معنوی""طبیعت انسان تجدید نشده""؛""محافظه کاری غیرتولیدی""",1
43638,noun,a custard containing fruit,کاستارد حاوی میوه,1
43639,noun,a rich custard set with gelatin,یک کاستارد غنی با ژلاتین,1
43641,noun,a person employed to take care of game and wildlife,شخصی استخدام شده برای مراقبت از حیوانات وحشی و حیوانات وحشی,1
43642,noun,someone responsible for the maintenance of a golf course,کسی که مسئول نگهداری از یک زمین گلف است,1
43644,noun,someone employed to clean and maintain a building,کسی که برای تمیز کردن و نگهداری ساختمان کار می کند,1
43645,noun,the keeper of a lighthouse,نگهبان یک فانوس دریایی,1
43643,noun,a custodian who lives in and cares for a house while the regular occupant is away (usually without an exchange of money),متولی که در خانه ای زندگی می کند و از خانه مراقبت می کند در حالی که ساکن منظم از آن دور است (معمولاً بدون مبادله پول),1
43640,adjective,"providing protective supervision; watching over or safeguarding; ""daycare that is educational and not just custodial""; ""a guardian angel""; ""tutelary gods""","نظارت نظارتیمراقبت یا حفاظت""مهد کودک که آموزشی است و فقط حضانت نیست"" ؛""یک فرشته نگهبان""؛""خدایان سرپرستی""",1
43646,noun,someone left in charge of pets while their owners are away from home,کسی که مسئولیت حیوانات خانگی را بر عهده دارد در حالی که صاحبان آنها از خانه دور هستند,1
43647,noun,the chief person responsible for a zoological garden,مسئول اصلی یک باغ جانورشناسی,1
43648,noun,"holding by the police; ""the suspect is in custody""","نگهداری توسط پلیس ؛""مظنون در بازداشت است""",1
43651,adjective,built for a particular individual,ساخته شده برای یک فرد خاص,1
43650,noun,"the responsibility of a guardian or keeper; ""he left his car in my keeping""","مسئولیت قیم یا نگهدارنده""او ماشین خود را در نگهداری من گذاشت""",1
43653,noun,a custom that is peculiar to Germany or its citizens,عرفی که مخصوص آلمان یا شهروندان آن است,1
43652,noun,a custom among some peoples whereby the husband of a pregnant wife is put to bed at the time of bearing the child,عرفی در میان برخی مردم که به موجب آن شوهر همسر باردار هنگام به دنیا آوردن فرزند در رختخواب قرار می گیرد,1
43656,noun,a specific practice of long standing,یک تمرین خاص از ایستادن طولانی مدت,1
43654,noun,"a pattern of behavior acquired through frequent repetition; ""she had a habit twirling the ends of her hair""; ""long use had hardened him to it""","الگویی از رفتار که از طریق تکرار مکرر بدست می آید.""او عادت داشت موهای خود را بچرخاند""؛""استفاده طولانی مدت او را سخت کرده بود""",1
43657,noun,"an established custom; ""it was their habit to dine at 7 every evening""","یک رسم ثابت""این عادت آنها بود که هر شب ساعت 7 شام بخورند""",1
43655,noun,"the custom in some Islamic societies of women dressing modestly outside the home; ""she observes the hijab and does not wear tight clothing""","رسم در برخی از جوامع اسلامی این است که زنان لباس بیرون از خانه را می پوشند.""او حجاب را رعایت می کند و لباس تنگ نمی پوشد""",1
43649,noun,"(with `in') guardianship over; in divorce cases it is the right to house and care for and discipline a child; ""my fate is in your hands""; ""too much power in the president's hands""; ""your guests are now in my custody""; ""the mother was awarded custody of the children""","(با ""در"") سرپرستی بیش ازدر موارد طلاق ، حق داشتن خانه و مراقبت و تربیت کودک است.""سرنوشت من در دست شماست""؛""قدرت بیش از حد در دست رئیس جمهور""؛""مهمانان شما اکنون در بند من هستند""؛""مادر به حضانت فرزندان تعلق گرفت""",1
43658,noun,(Islam) a tradition based on reports of the sayings and activities of Muhammad and his companions,(اسلام) سنتی مبتنی بر گزارش سخنان و فعالیتهای محمد و یارانش,1
43660,noun,money collected under a tariff,پول جمع شده تحت تعرفه,1
43662,noun,an impost levied in England to provide money for ships for national defense,فریبکاری که در انگلیس برای تهیه پول برای کشتی ها برای دفاع ملی گرفته شده است,1
43663,noun,"habitual patronage; ""I have given this tailor my custom for many years""","حمایت عادت؛""من سالهاست که به این خیاط رسم خود را داده ام""",1
43661,noun,"a government tax on imports or exports; ""they signed a treaty to lower duties on trade between their countries""","مالیات دولت بر واردات یا صادرات ؛""آنها معاهده ای را برای کاهش وظایف تجارت بین کشورهای خود امضا کردند""",1
43659,noun,"a custom that for a long time has been an important feature of some group or society; ""the institution of marriage""; ""the institution of slavery""; ""he had become an institution in the theater""","عرفی که برای مدت طولانی از ویژگیهای مهم برخی از گروهها یا جامعه بوده است.""نهاد ازدواج"" ؛""نهاد برده داری""؛""او به یک نهاد در تئاتر تبدیل شده بود""",1
43667,adjective,cut into pieces,قطعه قطعه شدن,1
43664,noun,a government building where customs are collected and where ships are cleared to enter or leave the country,یک ساختمان دولتی که در آن گمرک جمع می شود و کشتی ها برای ورود یا خروج از کشور ترخیص می شوند,1
43668,adjective,cut into with a sharp instrument,برش با یک ابزار تیز,1
43666,adjective,"prepared by cutting; ""sliced tomatoes""; ""sliced ham""; ""chopped clams""; ""chopped meat""; ""shredded cabbage""","تهیه شده توسط برش ؛""گوجه فرنگی خرد شده""؛""ژامبون خرد شده""؛""صدف خرد شده""؛""گوشت خرد شده""؛""کلم خرد شده""",1
43665,adjective,"separated into parts or laid open or penetrated with a sharp edge or instrument; ""the cut surface was mottled""; ""cut tobacco""; ""blood from his cut forehead""; ""bandages on her cut wrists""","به قطعات جدا شده یا باز یا با لبه یا ابزار تیز نفوذ کنید.""سطح برش خورده بود""؛""توتون بریده شده""؛""خون از پیشانی بریده شده اش""؛""باند بر روی مچ های بریده شده""",1
43670,adjective,"having a hole cut through; ""pierced ears""; ""a perforated eardrum""; ""a punctured balloon""","داشتن سوراخ برش خورده""گوش های سوراخ شده""؛""یک پرده گوش""""یک بالون سوراخ شده""",1
43669,adjective,"having a number or series of holes; ""a perforated steel plate""; ""perforated cancellation""; ""perforated stamp""","داشتن تعداد یا یک سری سوراخ ؛""یک صفحه فولادی سوراخ دار"" ؛""لغو سوراخ""؛""تمبر سوراخ دار""",1
43671,adjective,"detached by cutting; ""cut flowers""; ""a severed head""; ""an old tale of Anne Bolyn walking the castle walls with her poor cut-off head under her arm""","جدا شده توسط برش؛""گلهای بریده شده""؛""یک سر بریده""؛""یک داستان قدیمی از آن بولین که با سر بریده ضعیف زیر بازو در دیوارهای قلعه قدم می زند""",1
43672,adjective,"(especially of wood) cut or ripped longitudinally with the grain; ""we bought split logs for the fireplace""","(به ویژه از چوب) به صورت طولی با دانه بریده یا پاره شود.""ما چوب های خرد شده را برای شومینه خریداری کردیم""",1
43674,adjective,"having been cut out; ""the cut-out pieces of the dress""","بریده شده""تکه های بریده شده لباس""",1
43673,adjective,"fashioned or shaped by cutting; ""a well-cut suit""; ""cut diamonds""; ""cut velvet""","مد یا شکل گرفته توسط برش ؛""کت و شلوار خوش تراش""؛""برش الماس""؛""مخمل برش""",1
43678,adjective,"with parts removed; ""the drastically cut film""","با قطعات برداشته شده""فیلم به شدت بریده شده""",1
43675,adjective,"cut or shaped with hard blows of a heavy cutting instrument like an ax or chisel; ""a house built of hewn logs""; ""rough-hewn stone""; ""a path hewn through the underbrush""","برش داده شده یا شکل گرفته با ضربات سخت یک ابزار برش سنگین مانند تبر یا اسکنه ؛""خانه ای ساخته شده از چوب های تراشیده شده""؛""سنگ تراش خورده""؛""مسیری که از زیر قلم مو تراشیده شده است""",1
43679,adjective,"(used of texts) shortened by condensing or rewriting; ""an abridged version""","(مورد استفاده از متن ها) با تغلیظ یا بازنویسی کوتاه می شود.""نسخه مختصر""",1
43676,adjective,"(used especially of fur or wool) shaped or finished by cutting or trimming to a uniform length; ""a coat of sheared lamb""","(به ویژه از خز یا پشم استفاده می شود) با برش یا اصلاح به طول یکنواخت شکل گرفته یا تمام می شود""یک کت بره بریده""",1
43677,adjective,"having long and narrow ornamental cuts showing an underlying fabric; ""a slashed doublet""; ""slashed cuffs showing the scarlet lining""","داشتن برشهای زینتی باریک و بلند که پارچه ای زیرین را نشان می دهد.""یک مضراب کوبیده""؛""دستبندهای بریده شده نشان دهنده پوشش قرمز مایل به قرمز""",1
43680,adjective,"made neat and tidy by trimming; ""his neatly trimmed hair""","مرتب و مرتب با اصلاح؛""موهای مرتب و مرتب او""",1
43682,adjective,newly mown,تازه برداشت شده,1
43683,adjective,"(of a male animal) having the testicles removed; ""a cut horse""","(از یک حیوان نر) که بیضه ها را برداشته است.""یک اسب بریده""",1
43684,adjective,deprived of sexual capacity or sexual attributes,از توانایی جنسی یا صفات جنسی محروم است,1
43681,adjective,"cut or trimmed by clipping; ""a handsome man with a clipped moustache""; ""clipped hedges""; ""close-clipped lawns""; ""a clipped poodle""","برش یا اصلاح""یک مرد خوش تیپ با سبیل های بریده شده""؛""پرچین های قطع شده""؛""چمنهای نزدیک بسته""؛""یک پودل کوتاه""",1
43686,adjective,"(used of rates or prices) reduced usually sharply; ""the slashed prices attracted buyers""","(که از نرخ ها یا قیمت ها استفاده می شود) معمولاً به شدت کاهش می یابد.""کاهش قیمتها خریداران را به خود جلب کرد""",1
43685,adjective,"wounded by cutting deeply; ""got a gashed arm in a knife fight""; ""had a slashed cheek from the broken glass""","با برش عمیق زخمی شد""در یک مبارزه با چاقو بازوی گاز گرفته ای پیدا کرد""؛""از شیشه شکسته گونه ای بریده داشت""",1
43687,adjective,"mixed with water; ""sold cut whiskey""; ""a cup of thinned soup""","مخلوط با آب""ویسکی برش خورده""""یک فنجان سوپ رقیق شده""",1
43689,verb,"trim carefully and neatly; ""manicure fingernails""","با دقت و مرتب اصلاح کنید؛""ناخن های مانیکور""",1
43690,verb,cut with or as if with scissors,قیچی یا مثل اینکه با قیچی بریده شود,1
43688,adjective,"reduced in strength or concentration or quality or purity; ""diluted alcohol""; ""a dilute solution""; ""dilute acetic acid""","کاهش قدرت یا غلظت یا کیفیت یا خلوص ؛""الکل رقیق شده"" ؛""یک محلول رقیق"" ؛""اسید استیک رقیق""",1
43692,verb,"cut into slices; ""Slice the salami, please""","برش به برش؛""سالامی را برش بزنید ، لطفا""",1
43693,verb,"cut in a zigzag pattern with pinking shears, in sewing",در خیاطی به صورت زیگزاگ با قیچی صورتی رنگ برش بزنید,1
43694,verb,cut teeth into; make a jagged cutting edge,دندان ها را برش دهیدیک لبه برش دندانه دار ایجاد کنید,1
43691,verb,"cut or remove with or as if with a plane; ""The machine shaved off fine layers from the piece of wood""","برش یا حذف با یا مثل اینکه با هواپیما باشد ؛""دستگاه لایه های ظریف تکه چوب را تراشید""",1
43695,verb,"cut into long thin strips; ""julienne the potatoes""","برش به نوارهای بلند نازک""ژولین سیب زمینی""",1
43697,verb,"cut away; ""he hacked his way through the forest""","بریدن""او راه خود را از طریق جنگل هک کرد""",1
43696,verb,cut obliquely into (a tree) below the main cut and on the side toward which the tree will fall,برش مایل به (درخت) در زیر برش اصلی و در طرفی که درخت به سمت آن سقوط خواهد کرد,1
43699,verb,"cut slightly, with a razor; ""The barber's knife nicked his cheek""","کمی برش ، با تیغ؛""چاقوی سلمانی گونه اش را لک کرد""",1
43698,verb,"cause to fall by or as if by delivering a blow; ""strike down a tree""; ""Lightning struck down the hikers""","باعث سقوط توسط یا مثل اینکه با وارد کردن ضربه شود.""زدن درخت""؛""صاعقه کوهنوردان را شکست""",1
43702,verb,cut a hole for a tenon in,یک سوراخ برای یک تن قطع کنید,1
43700,verb,"remove the edges from and cut down to the desired size; ""pare one's fingernails""; ""trim the photograph""; ""trim lumber""","لبه ها را برداشته و به اندازه دلخواه ببرید.""ناخن های دست خود را پارس کنید""؛""برش عکس""؛""اصلاح الوار""",1
43703,verb,"cut with a blade or mower; ""mow the grass""","برش با تیغه یا ماشین چمن زنی ؛""چمن زدن""",1
43704,verb,cut or cut through with shears,برش یا برش با قیچی,1
43705,verb,"cut open; ""she slashed her wrists""","باز کردن""او مچ خود را خرد کرد""",1
43701,verb,"cut or tear along an irregular line so that the parts can later be matched for authentication; ""indent the documents""","برش یا پاره شدن در امتداد یک خط نامنظم ، به طوری که بعداً قطعات می توانند برای تأیید اعتبار همسان شوند""اسناد را فرورفت""",1
43708,verb,cut with a hob,برش با اجاق گاز,1
43707,verb,cut a female screw thread with a tap,یک نخ پیچ زن را با یک شیر برش دهید,1
43706,verb,cut with sweeping strokes; as with an ax or machete,برش با سکته های جارو؛مثل تبر یا قمه,1
43710,verb,"cut in three; ""trisect a line""","برش در سه؛""یک خط را برش دهید""",1
43713,verb,cut with a tomahawk,بریده شده با توماهاوک,1
43709,verb,"cut across or divide transversely; ""the trails transect the property""","برش یا تقسیم عرضی""مسیرها مال را ترانسکت می کنند""",1
43711,verb,"cut small bits or pare shavings from; ""whittle a piece of wood""","تراشیدن بیت های کوچک یا تراشکاری از؛""یک تکه چوب را سفید کنید""",1
43714,verb,cut or injure with a saber,با یک صابر بریده یا زخمی کنید,1
43712,verb,"remove by cutting off or away; ""cut away the branch that sticks out""","حذف با قطع یا دور کردن""شاخه بیرون زده را برش دهید""",1
43715,verb,cut a rebate in (timber or stone),تخفیف در (چوب یا سنگ),1
43716,verb,make an incision into by carving or cutting,با تراش یا برش برش ایجاد کنید,1
43718,verb,"make a clean cut through; ""slit her throat""","یک برش تمیز ایجاد کنید""گلویش را شکاف""",1
43719,verb,"cut with a saw; ""saw wood for the fireplace""","برش با اره؛""چوب اره شده برای شومینه""",1
43717,verb,"cut or carve deeply into; ""letters trenched into the stone""","برش یا تراش عمیق در""حروف درون سنگ گودال""",1
43720,verb,cut (wood) along the grain,برش (چوب) در امتداد دانه,1
43724,verb,"cut drastically; ""Prices were slashed""","برش شدید""قیمت ها کاهش یافت""",1
43725,verb,"make thin or thinner; ""Thin the solution""","لاغر یا نازک تر کردن""محلول نازک""",1
43721,verb,"cut down on; make a reduction in; ""reduce your daily fat intake""; ""The employer wants to cut back health benefits""","قطع کردنکاهش در؛""مصرف روزانه چربی خود را کاهش دهید"" ؛""کارفرما می خواهد مزایای سلامتی را کاهش دهد""",1
43723,verb,"make a reduction, as in one's workforce; ""The company had to retrench""","همانند نیروی کار خود ، کاهش دهید""این شرکت مجبور به تعدیل نیرو شد""",1
43722,verb,reduce the degree of (luminescence or phosphorescence) in (excited molecules or a material) by adding a suitable substance,با افزودن ماده مناسب ، درجه (لومینسانس یا فسفرسانس) را در (مولکول های برانگیخته یا ماده) کاهش دهید,1
43729,verb,cut the price of,کاهش قیمت,1
43726,verb,"take away a part from; diminish; ""His bad manners detract from his good character""","برداشتن بخشی از؛کاهش؛""بد اخلاقی او از شخصیت خوب او می کاهد""",1
43728,verb,"increase the amount or availability of, creating a rise in value; ""inflate the currency""","افزایش مقدار یا در دسترس بودن ، ایجاد افزایش ارزش ؛""ارز را باد کنید""",1
43730,verb,"have a reducing effect; ""This cuts into my earnings""","دارای اثر کاهنده""این درآمد من را کاهش می دهد""",1
43727,verb,"reduce or cut back the amount or availability of, creating a decline in value or prices; ""deflate the currency""","کاهش یا کاهش مقدار یا در دسترس بودن ، ایجاد کاهش در ارزش یا قیمت ها ؛""تخلیه ارز""",1
43731,verb,"make an incision or separation; ""cut along the dotted line""","برش یا جدا کردن""برش در امتداد خط نقطه ای""",1
43732,verb,"discharge from a group; ""The coach cut two players from the team""","ترشح از یک گروه ؛""مربی دو بازیکن را از تیم جدا کرد""",1
43734,verb,"cut into gores; ""gore a skirt""","برش خورده""گور دامن""",1
43735,verb,"intentionally fail to attend; ""cut class""","عمداً در حضور شرکت نمی کنند""کلاس برش""",1
43733,verb,"style and tailor in a certain fashion; ""cut a dress""","سبک و خیاط به سبک خاص؛""لباس برش""",1
