id,pos,gloss,persian_gloss,checked
45037,adjective,"precisely and clearly expressed or readily observable; leaving nothing to implication; ""explicit instructions""; ""she made her wishes explicit""; ""explicit sexual scenes""","دقیق و واضح بیان شده یا به راحتی قابل مشاهده است.هیچ چیز را به نتیجه ندهید.""دستورالعملهای صریح""؛""او خواسته های خود را صریح""""صحنه های صریح جنسی""",1
45042,noun,process of changing to an inferior state,روند تغییر به حالت فرومایه,1
45043,noun,change toward something smaller or lower,تغییر به سمت چیزی کوچکتر یا پایین تر,1
45045,noun,a downward slope or bend,شیب رو به پایین یا خم شدن,1
45047,noun,a steep place (as on a hill),یک مکان شیب دار (مثل تپه),1
45046,noun,the downward slope of a hill,شیب پایین یک تپه,1
45049,noun,"a condition of decline following successes; ""in the twilight of the empire""","شرط انحطاط پس از موفقیت ؛""در گرگ و میش امپراتوری""",1
45044,noun,"a noticeable deterioration in performance or quality; ""the team went into a slump""; ""a gradual slack in output""; ""a drop-off in attendance""; ""a falloff in quality""","کاهش قابل توجه عملکرد یا کیفیت ؛""تیم به رکود رفت""؛""کندی تدریجی در تولید""؛""افت تحصیلی""""افت کیفیت""",1
45051,verb,"grow worse; ""Conditions in the slum worsened""","رشد بدتر""شرایط در زاغه بدتر شد""",1
45048,noun,"the state of something that has been unused and neglected; ""the house was in a terrible state of neglect""","حالت چیزی که استفاده نشده و مورد غفلت واقع شده است.""خانه در وضعیت غفلت وحشتناکی قرار داشت""",1
45054,verb,take away,بردن,1
45052,verb,"become inflamed; get sore; ""His throat inflamed""","ملتهب شدنزخم شدن""گلو ملتهب شد""",1
45055,verb,"get worse; ""Her health is declining""","بدتر شدن؛""سلامتی او رو به زوال است""",1
45050,noun,"something or someone that has suffered ruin or dilapidation; ""the house was a wreck when they bought it""; ""thanks to that quack I am a human wreck""","چیزی یا کسی که خراب یا ویران شده است.""وقتی خانه خراب شد خانه خراب شد""؛""با تشکر از آن غارت من یک انسان شکسته هستم""",1
45056,verb,"suffer a sudden downfall, overthrow, or defeat",دچار یک سقوط ، سرنگونی یا شکست ناگهانی شوید,1
45057,verb,"get worse; ""His grades suffered""","بدتر شدن؛""نمرات او رنج می برد""",1
45053,verb,"grow worse; ""Her condition deteriorated""; ""Conditions in the slums degenerated""; ""The discussion devolved into a shouting match""","رشد بدتر""وضعیت او خراب شد""؛""شرایط موجود در زاغه ها رو به زوال است""؛""بحث به یک مسابقه فریاد کشیده تبدیل شد""",1
45059,verb,get worse or fall back to a previous condition,بدتر شوید یا به شرایط قبلی برگردید,1
45058,verb,"be set at a disadvantage; ""This author really suffers in translation""","در یک نقطه ضعف تنظیم شود""این نویسنده واقعاً در ترجمه رنج می برد""",1
45061,verb,"refuse to accept; ""dishonor checks and drafts""","سرپیچی از پذیرش؛""چک و پیش نویس بی ناموسی""",1
45060,verb,"take a downward direction; ""The economy finally turned down after a long boom""","یک جهت رو به پایین بگیرید""سرانجام اقتصاد پس از یک رونق طولانی رو به زوال""",1
45062,verb,"reject with contempt; ""She spurned his advances""","رد با تحقیر؛""او پیشرفتهای خود را واژگون کرد""",1
45064,verb,refuse to pay a levy to a union for political use,از پرداخت مالیات به اتحادیه برای استفاده سیاسی خودداری کنید,1
45063,verb,"show unwillingness towards; ""he declined to join the group on a hike""","عدم تمایل نسبت به""او از پیوستن به گروه با پیاده روی خودداری کرد""",1
45065,verb,"decline formally or politely; ""I regret I can't come to the party""","به طور رسمی یا مودبانه کاهش یابد""متاسفم که نمی توانم به مهمانی بیایم""",1
45066,verb,"refuse to recognize or pay; ""repudiate a debt""","امتناع از شناسایی یا پرداخت""رد بدهی""",1
45067,verb,"grow smaller; ""Interest in the project waned""","کوچکتر شدن""علاقه به پروژه کم شد""",1
45068,verb,"go down momentarily; ""Prices dipped""","لحظه ای پایین برو""قیمت ها کاهش یافت""",1
45069,verb,"pass slowly (of time); ""The day wore on""","به آرامی عبور کنید (از زمان)""روز فرار کرد""",1
45071,verb,"go down; ""The roof declines here""","برو پایین؛""سقف در اینجا کاهش می یابد""",1
45070,verb,"go down in value; ""Stock prices dropped""","کاهش ارزش""قیمت سهام کاهش یافت""",1
45072,verb,"to fall vertically; ""the bombs are dropping on enemy targets""","عمودی افتادن ؛""بمب ها به اهداف دشمن می ریزند""",1
45073,verb,"appear to move downward; ""The sun dipped below the horizon""; ""The setting sun sank below the tree line""","به نظر می رسد که به سمت پایین حرکت می کند""خورشید زیر افق فرو رفت""؛""غروب خورشید زیر خط درخت غرق شد""",1
45076,noun,a gradual decline (in size or strength or power or number),کاهش تدریجی (در اندازه یا قدرت یا قدرت یا تعداد),1
45075,noun,diminution of swelling; the subsidence of anything swollen,کاهش تورم ؛فرونشست هر چیز متورم,1
45074,verb,"inflect for number, gender, case, etc., ""in many languages, speakers decline nouns, pronouns, and adjectives""","عدد ، جنس ، حروف ، و غیره را عطف کنید ، ""در بسیاری از زبانها ، اسامی ، ضمایر و صفت را گویندگان کاهش می دهند""",1
45077,noun,"a gradual decline of something; ""after the accounting scandal there was an erosion of confidence in the auditors""","کاهش تدریجی چیزی ؛""پس از رسوایی حسابداری ، اعتماد به نفس در حسابرسان به وجود آمد""",1
45080,noun,a temporary decline in health or value,کاهش موقتی سلامت یا ارزش,1
45078,noun,"gradual decline in amount or activity; ""weight loss""; ""a serious loss of business""","کاهش تدریجی مقدار یا فعالیت ؛""کاهش وزن""؛""از دست دادن جدی تجارت""",1
45079,noun,"a sudden sharp drop or rapid decline; ""the stock took a nosedive""","یک افت شدید ناگهانی یا افت سریع ؛""سهام یک دماغ گرفت""",1
45081,noun,decline from a standard level of performance or achievement,کاهش از سطح استاندارد عملکرد یا موفقیت,1
45082,adjective,sloping down rather steeply,شیب دار نسبتاً تند,1
45083,adjective,coming down or downward,پایین یا پایین آمدن,1
45084,verb,steep in hot water,شیب در آب گرم,1
45086,noun,(pharmacology) the extraction by boiling of water-soluble drug substances,(داروسازی) استخراج با جوشاندن مواد دارویی محلول در آب,1
45087,noun,a machine that converts a coded text into ordinary language,ماشینی که متن رمزگذاری شده را به زبان معمولی تبدیل می کند,1
45089,noun,a low-cut neckline on a woman's dress,یک خط گردن کوتاه بر روی لباس زنانه,1
45088,noun,restoring compressed information to its normal form for use or display,بازیابی اطلاعات فشرده شده به شکل طبیعی خود برای استفاده یا نمایش,1
45085,verb,"let sit in a liquid to extract a flavor or to cleanse; ""steep the blossoms in oil""; ""steep the fruit in alcohol""","بگذارید در مایعات بماند تا عطر و طعم آن گرفته شود یا پاک شود.""شکوفایی شکوفه ها در روغن"" ؛""میوه را در الکل شیب دهید""",1
45090,adjective,"(of a garment) having a low-cut neckline; ""a low neckline""","(از یک لباس) دارای گردن بند کوتاه""یک خط گردن کم""",1
45094,noun,the analysis of a vector field,تجزیه و تحلیل یک زمینه برداری است,1
45091,adjective,having a neck or having a neck especially as specified (often used in combination),داشتن گردن یا داشتن گردن مخصوصاً همانطور که مشخص شده است (که اغلب به صورت ترکیبی استفاده می شود),1
45093,verb,"suspend (meat) in order to get a gamey taste; ""hang the venison for a few days""","تعلیق (گوشت) به منظور گرفتن طعم بازی؛""گوساله را چند روز آویزان کنید""",1
45092,verb,"break down naturally through the action of biological agents; ""Plastic bottles do not biodegrade""","به طور طبیعی از طریق عملکرد عوامل بیولوژیکی تجزیه می شوند.""بطری های پلاستیکی از بین نمی روند""",1
45096,verb,"restore to its uncompressed form; ""decompress data""","بازگرداندن به شکل فشرده نشده آن""فشرده سازی داده ها""",1
45095,noun,the disintegration of social norms governing behavior and thought and social relationships,از هم پاشیدگی هنجارهای اجتماعی حاکم بر رفتار و اندیشه و روابط اجتماعی,1
45098,verb,"cause to lose air pressure or collapse by piercing; ""puncture an air balloon""","از دست دادن فشار هوا یا فروپاشی با سوراخ کردن ؛""سوراخ کردن یک بالون هوا""",1
45097,verb,"return to its original or usable and functioning condition; ""restore the forest to its original pristine condition""","بازگشت به شرایط اولیه یا قابل استفاده و عملکرد خود.""جنگل را به شرایط بکر اولیه خود برگردانید""",1
45101,verb,settle into a comfortable sitting position,در یک حالت نشسته راحت قرار بگیرید,1
45099,verb,"become less tense, rest, or take one's ease; ""He relaxed in the hot tub""; ""Let's all relax after a hard day's work""","کمتر تنش کنید ، استراحت کنید ، یا آرامش خود را حفظ کنید.""او در وان آب گرم آرام گرفت""؛""بیایید همه بعد از یک کار سخت روزانه آرام بگیریم""",1
45100,verb,"engage in passive relaxation; ""After a hard day's work, I vegetate in front of the television""","درگیر آرامش منفعل شوید""بعد از یک روز کاری سخت ، جلوی تلویزیون گیاه خواری می کنم""",1
45102,verb,"relax or remove controls of; ""decontrol marijuana""","شل کردن یا از بین بردن کنترل های""کنترل ماری جوانا""",1
45103,noun,decoration consisting of the layout and furnishings of a livable interior,دکوراسیون متشکل از چیدمان و مبلمان یک فضای داخلی مناسب,1
45106,noun,something placed at the center of something else (as on a table),چیزی که در مرکز چیز دیگری قرار گرفته باشد (مانند روی میز),1
45104,verb,"award a mark of honor, such as a medal, to; ""He was decorated for his services in the military""","اعطای نشان افتخار ، مانند مدال ، به؛""او برای خدماتش در ارتش تزئین شده بود""",1
45107,noun,an ornamented evergreen used as a Christmas decoration,همیشه سبز تزیینی که به عنوان دکوراسیون کریسمس استفاده می شود,1
45105,verb,"bestow honor or rewards upon; ""Today we honor our soldiers""; ""The scout was rewarded for courageous action""","اهدای افتخار یا پاداش.""امروز ما سربازان خود را ارج می نهیم""؛""پادشاه پیشاهنگی برای اقدام شجاعانه پاداش گرفت""",1
45110,noun,ornamental objects of no great value,اشیا ornam زینتی که ارزش زیادی ندارند,1
45108,noun,an ornament (such as a knot of ribbon or a rosette) usually worn on the hat,یک زیور آلات (مانند گره روبان یا روزت) که معمولاً روی کلاه می بندند,1
45109,noun,an ornament at the top of a spire or gable; usually a foliated fleur-de-lis,تزئینی در بالای گلدسته یا شیروانی.معمولاً یک برگ دهان داره برگ دار,1
45112,noun,any decoration added as a trimming or adornment,هر تزئینی که به عنوان پیرایش یا زینت اضافه شود,1
45111,noun,an ornament consisting of a grotesquely carved figure of a person or animal,تزئینی متشکل از یک شکل شخص یا حیوان تراش خورده به شکل ناخالص,1
45113,noun,a rude decoration inscribed on rocks or walls,یک تزئین بی ادبانه که روی سنگها یا دیوارها نقش بسته است,1
45114,noun,a decorative coating of contrasting material that is applied to a surface as an inlay or overlay,یک پوشش تزئینی از مواد متضاد که به عنوان خاتم یا روکش روی سطح اعمال می شود,1
45117,noun,a crescent-shaped metal ornament of the Bronze Age,یک تزئین فلزی هلالی شکل از عصر مفرغ,1
45115,noun,a decoration made by fitting pieces of wood into prepared slots in a surface,تزئینی که با قرار دادن تکه های چوب در شکاف های آماده شده در یک سطح ساخته می شود,1
45116,noun,an ornament in the shape of a ball on the hilt of a sword or dagger,تزئینی به شکل توپ بر روی شمشیر یا خنجر,1
45118,noun,something resembling the head of a nail that is used as an ornamental device,چیزی شبیه سر ناخن که به عنوان وسیله ای زینتی استفاده می شود,1
45119,noun,decoration worn about the neck (fur piece or tight necklace) as an ornament,دکوراسیونی که به دور گردن (تکه خز یا گردنبند تنگ) به عنوان زینت پوشیده شده است,1
45121,noun,a decoration used as part of the set of a theatrical or movie production,دکوراسیونی که به عنوان بخشی از مجموعه نمایش های تئاتر یا فیلم استفاده می شود,1
45122,noun,a ceramic or mural decoration made by scratching off a surface layer to reveal the ground,یک تزئینات سرامیکی یا نقاشی دیواری ساخته شده با خراشیدن یک لایه سطحی برای آشکار کردن زمین,1
45120,noun,a Scandinavian style of carved or painted decoration (as on furniture or walls or dinnerware) consisting of floral motifs,یک سبک اسکاندیناویایی از تزئینات حکاکی شده یا نقاشی شده (مانند مبلمان یا دیوارها یا ظروف غذاخوری) متشکل از نقوش گل,1
45123,noun,ornament consisting of a curve on a plane that winds around a center with an increasing distance from the center,زیور آلات متشکل از یک منحنی در صفحه ای که دور یک مرکز با فاصله فزاینده از مرکز می پیچد,1
45124,noun,an ornament that resembles a spray of leaves or flowers,زینتی که شبیه اسپری برگ یا گل است,1
45125,noun,ornament consisting of a circular rounded protuberance (as on a vault or shield or belt),زیور آلات متشکل از یک برجستگی مدور گرد (مانند طاق یا سپر یا کمربند),1
45127,noun,decoration consisting of an open pattern of interlacing ribs,دکوراسیون متشکل از یک الگوی باز از دنده های در هم آمیخته,1
45126,noun,"a showy decoration that is basically valueless; ""all the tinsel of self-promotion""","یک تزئین نمایشی که اساساً بی ارزش است.""همه زنجیر تبلیغات شخصی""",1
45129,noun,something (such as parsley) added to a dish for flavor or decoration,چیزی (مانند جعفری) که برای طعم یا تزئین به ظرف اضافه می شود,1
45128,noun,a decorative arrangement of pieces of metal or glass or pottery that hang together loosely so the wind can cause them to tinkle,چیدمان تزیینی قطعات فلزی یا شیشه ای یا سفالی که به آرامی به هم آویزان شده اند تا باد باعث خرد شدن آنها شود,1
45130,noun,the highest U.S. military decoration awarded for bravery and valor in action `above and beyond the call of duty',"بالاترین نشان نظامی ایالات متحده برای شجاعت و دلاوری در عمل ""بالاتر و فراتر از وظیفه"" اعطا شده است",1
45132,noun,a United States Army decoration for extraordinary heroism against an armed enemy,یک تزئین ارتش ایالات متحده برای قهرمانی خارق العاده در برابر یک دشمن مسلح,1
45133,noun,a United States Navy decoration for extraordinary heroism against an armed enemy,یک تزئین نیروی دریایی ایالات متحده برای قهرمانی خارق العاده در برابر دشمن مسلح,1
45131,noun,a United States military decoration for meritorious service in wartime duty of great responsibility,یک تزئین نظامی ایالات متحده برای خدمات شایسته در زمان جنگ با مسئولیت بزرگ,1
45134,noun,a United States Air Force decoration for heroism while participating in an aerial flight,یک تزئین نیروی هوایی ایالات متحده برای قهرمانی هنگام شرکت در پرواز هوایی,1
45136,noun,a United States military decoration for gallantry in action,یک تزئین نظامی ایالات متحده برای شجاعت در عمل,1
45135,noun,a United States Air Force decoration for meritorious achievement while participating in an aerial flight,یک تزئین نیروی هوایی ایالات متحده برای موفقیت شایسته هنگام شرکت در پرواز هوایی,1
45137,noun,a United States military decoration awarded for meritorious service (except in aerial flight),یک تزئین نظامی ایالات متحده به دلیل خدمات شایسته (به جز پرواز هوایی) اعطا می شود,1
45138,noun,a United States military decoration awarded to any member of the armed forces who is wounded in action,یک تزئین نظامی ایالات متحده به هر عضو نیروهای مسلح که در عمل مجروح شود اعطا می شود,1
45140,noun,a British military decoration for gallantry,یک تزئین نظامی انگلیس برای جلب توجه,1
45139,noun,a United States military decoration consisting of bronze or silver oak leaves and acorns awarded to anyone who has won a given medal before,یک تزئین نظامی ایالات متحده متشکل از برگها و بلوطهای برنز یا نقره بلوط که به هر کسی که قبلاً مدال داده باشد ، اعطا می شود,1
45144,noun,a French military decoration,یک تزئین نظامی فرانسوی,1
45143,noun,a French military decoration for gallantry,یک تزئین نظامی فرانسوی برای جلب توجه,1
45141,noun,a British military decoration for distinguished conduct in the field,یک تزئین نظامی انگلیس برای رفتارهای برجسته در این زمینه,1
45142,noun,a British military decoration for special service in action,یک تزئین نظامی انگلیس برای خدمات ویژه در عمل,1
45146,noun,the decoration of shop windows,دکوراسیون ویترین مغازه ها,1
45145,noun,the act of adding extraneous decorations to something,عمل افزودن تزئینات اضافی به چیزی,1
45149,noun,decorating with a design,تزئین با طرح,1
45148,noun,the act of adorning with mosaic,عمل تزئین با موزاییک,1
45147,noun,"the act of adding decoration; ""the children had to be in bed before it was time for the trimming of the tree""","عمل افزودن دکوراسیون ؛""بچه ها باید قبل از اصلاح زمان درخت در رختخواب باشند""",1
45151,noun,sprucing up; making decorative additions to,صنوبر کردنافزودن تزئینی به,1
45152,noun,the act of making a visible mark on a surface,عمل ایجاد علامت قابل مشاهده بر روی سطح,1
45150,noun,the practice of making a design on the skin by pricking and staining,روش ایجاد طرح روی پوست با خار و لکه گیری,1
45153,noun,a person who specializes in designing architectural interiors and their furnishings,شخصی که در طراحی داخلی معماری و مبلمان آنها تخصص دارد,1
45156,adjective,characterized by dignity and propriety,دارای کرامت و تناسب است,1
45155,adjective,satisfying generally accepted social or esthetic standards,مطابقت با استانداردهای عمومی یا زیبایی شناختی پذیرفته شده,1
45154,noun,United States designer noted for an innovative series of chairs (1907-1978),طراح ایالات متحده به خاطر یک سری صندلی های ابتکاری (1907-1978),1
45158,verb,remove the cortex of (an organ),برداشتن قشر (اندام),1
45157,verb,"remove the outer layer of; ""decorticate a tree branch""","حذف لایه بیرونی؛""شاخه درخت را تزئین کنید""",1
45159,noun,the quality of being becoming,کیفیت بودن,1
45160,verb,lure or entrap with or as if with a decoy,فریب یا به دام انداختن یا انگار با یک طعمه,1
45164,verb,"diminish gradually; ""Interested tapered off""","کم کم کاهش می یابد""علاقه مندان مخفی""",1
45161,noun,a decoy who lures customers into a gambling establishment (especially one with a fixed game),طعمه ای که مشتریان را به یک مرکز قمار سوق می دهد (به خصوص یکی با بازی ثابت),1
45162,noun,a decoy who acts as an enthusiastic customer in order to stimulate the participation of others,طعمه ای که به عنوان یک مشتری مشتاق به منظور تحریک مشارکت دیگران عمل می کند,1
45165,verb,"fall or diminish; ""The number of students in this course dropped off after the first test""","سقوط یا کاهش""تعداد دانشجویان این دوره پس از اولین آزمون کاهش یافت""",1
45163,verb,"decrease in size, range, or extent; ""His earnings shrank""; ""My courage shrivelled when I saw the task before me""","کاهش اندازه ، دامنه یا میزان""درآمد او کوچک شد""؛""وقتی وظیفه پیش روی خودم را دیدم شجاعت من لرزید""",1
45167,verb,become less intense,شدت کمتری پیدا می کنند,1
45168,verb,"become deflated or flaccid, as by losing air; ""The balloons deflated""","مانند از دست دادن هوا ، باد یا شل شود.""بادکنک ها تخلیه شدند""",1
45166,verb,"decrease rapidly and disappear; ""the money vanished in las Vegas""; ""all my stock assets have vaporized""","به سرعت کاهش یابد و ناپدید شود""پول در لاس وگاس ناپدید شد""؛""تمام دارایی های سهام من بخار شده اند""",1
45170,verb,"diminish or abate; ""The pain finally remitted""","کم کردن یا کاهش""درد بالاخره برطرف شد""",1
45169,verb,"become smaller or lose substance; ""Her savings dwindled down""","کوچکتر شدن یا از دست دادن ماده""پس انداز او کاهش یافت""",1
45171,verb,"diminish in size, scope, or intensity; ""The war of words between them de-escalated with time""","از اندازه ، دامنه یا شدت آن کاسته شود.""جنگ کلمات بین آنها با گذشت زمان افزایش یافت""",1
45172,verb,"lose in value; ""The dollar depreciated again""","از دست دادن در ارزش؛""دلار دوباره کاهش یافت""",1
45173,verb,"become short or shorter; ""In winter, the days shorten""","کوتاه یا کوتاه تر شدن""در زمستان روزها کوتاه می شوند""",1
45175,verb,"decrease in phase; ""the moon is waning""","کاهش فاز""ماه کم می شود""",1
45174,verb,"become sparser; ""Towards the end of town, the houses thinned out""","پراکنده تر شدن""به اواخر شهر ، خانه ها نازک شدند""",1
45176,verb,"become smaller; ""Interest in his novels waned""","کوچکتر شدن""علاقه به رمان هایش کم شد""",1
45177,verb,"grow quieter; ""The music decrescendoes here""","ساکت تر شدن""موسیقی در اینجا کاهش می یابد""",1
45179,verb,decrease gradually or bit by bit,به تدریج یا ذره ذره کاهش یابد,1
