ID,POS,Gloss
34285,noun,"the second largest city in Tunisia; located in eastern Tunisia near a phosphate region",
34286,noun,"a port city in eastern Tunisia on the Mediterranean",
34287,noun,"a city in southern Turkey on the Seyhan River",
34288,noun,"a port city in southwestern Turkey on the Gulf of Antalya",
34289,noun,"an ancient Greek city on the southwestern coast of Asia Minor in what is now Turkey; site of the mausoleum at Halicarnassus",
34290,noun,"the largest city and former capital of Turkey; rebuilt on the site of ancient Byzantium by Constantine I in the fourth century; renamed Constantinople by Constantine who made it the capital of the Byzantine Empire; now the seat of the Eastern Orthodox Church",
34291,noun,"a city in northwestern Turkey",
34292,noun,"a port city in western Turkey",
34293,noun,"an ancient Greek city located in the western part of what is now modern Turkey; the technique of preparing sheepskins as parchment was developed here",
34294,noun,"an ancient Greek city located in the western part of what is now modern Turkey; as the capital of Lydia it was the cultural center of Asia Minor; destroyed by Tamerlane in 1402",
34295,noun,"a city in Uganda on the north shore of Lake Victoria",
34296,noun,"a city in northern Uganda",
34297,noun,"port city in the United Arab Emirates on the Persian Gulf",
34298,noun,"the largest city in Alabama; located in northeastern Alabama",
34299,noun,"a city in northern Alabama; center for space research",
34300,noun,"a port in southwestern Alabama on Mobile Bay",
34301,noun,"a city in Arizona just east of Phoenix; originally a suburb of Phoenix",
34302,noun,"a city in southeastern Arizona ringed by mountain ranges; long known as a winter and health resort but the population shift from industrial states to the Sunbelt resulted in rapid growth late in the 20th century",
34303,noun,"a city in southern California (southeast of Los Angeles); site of Disneyland",
34304,noun,"a city in south central California at the southern end of the San Joaquin Valley",
34305,noun,"a city in California on the eastern shore of San Francisco Bay; site of the University of California at Berkeley",
34306,noun,"a city in southwestern California surrounded by Los Angeles; home of many Hollywood actors",
34307,noun,"an industrial city in southern California (south of San Diego) near the Mexican border",
34308,noun,"a city in south central California in the San Joaquin Valley; center of an important agricultural area and gateway to the Sierra Nevada Mountains",
34309,noun,"a city in southern California located on 8.5 miles of Pacific beachfront; was a resort until oil was discovered in 1921",
34310,noun,"a city in southern California; motion picture capital of the world; most populous city of California and second largest in the United States",
34311,noun,"a city in western California on San Francisco Bay opposite San Francisco; primarily and industrial urban center",
34312,noun,"a city in southwestern California east of Los Angeles",
34313,noun,"a city in southern California",
34314,noun,"a city in southern California east of Los Angeles",
34315,noun,"a picturesque city of southern California on San Diego Bay near the Mexican border; site of an important naval base",
34316,noun,"a port in western California near the Golden Gate that is one of the major industrial and transportation centers; it has one of the world's finest harbors; site of the Golden Gate Bridge",
34317,noun,"a city in western California located at the southern end of San Francisco Bay south of San Francisco; a center for computer and electronics industries",
34318,noun,"a city in southern California east of Long Beach",
34319,noun,"a city of west central California; residential area with light industry",
34320,noun,"a city in east central Colorado on the eastern edge of the Rocky Mountains; popular tourist center and site of the United States Air Force Academy",
34321,noun,"a city in Colorado south of Colorado Springs",
34322,noun,"a port in southwestern Connecticut on Long Island Sound",
34323,noun,"a city in southwestern Connecticut; site of Yale University",
34324,noun,"a city in west central Connecticut",
34325,noun,"the largest city in Delaware",
34326,noun,"a city in southeast Florida on the Atlantic coast north of Miami; a favorite place for college students to go on their spring vacations",
34327,noun,"Florida's largest city; a port and important commercial center in northeastern Florida",
34328,noun,"a city and resort in southeastern Florida on Biscayne Bay; the best known city in Florida; a haven for retirees and a refuge for Cubans fleeing Castro",
34329,noun,"a city in southeastern Florida on an island between Biscayne Bay and the Atlantic Ocean; known for fashionable resort hotels",
34330,noun,"a city in central Florida; site of Walt Disney World",
34331,noun,"a resort city in northeastern Florida; the oldest city in the United States",
34332,noun,"a city in western Florida on Tampa Bay; a popular winter resort",
34333,noun,"a resort city in western Florida; located on Tampa Bay on the Gulf of Mexico",
34334,noun,"a city in eastern Georgia north-northwest of Savannah; noted for golf tournaments",
34335,noun,"a city in western Georgia on the Chattahoochee River; industrial center",
34336,noun,"a city in central Georgia southeast of Atlanta",
34337,noun,"a port in eastern Georgia near the mouth of the Savannah river",
34338,noun,"largest city in Illinois; a bustling Great Lakes port that extends 26 miles along the southwestern shoreline of Lake Michigan",
34339,noun,"a city in central Illinois; Abraham Lincoln practiced law here",
34340,noun,"a city in central Illinois on the Illinois River",
34341,noun,"a city in northern Illinois",
34342,noun,"a city in southwestern Indiana on the Ohio River",
34343,noun,"a city in northeastern Indiana",
34344,noun,"a city in northwest Indiana on Lake Michigan; steel production",
34345,noun,"a city in northern Indiana",
34346,noun,"a city in eastern Iowa on the Mississippi River across from Moline and Rock Island",
34347,noun,"a city in eastern Iowa",
34348,noun,"a city in northeastern Iowa where the Big Sioux River joins the Missouri",
34349,noun,"a city of northeast Kansas on the Missouri River adjacent to Kansas City, Missouri",
34350,noun,"the largest city in Kansas; located in southern Kansas on the Arkansas River",
34351,noun,"a city in eastern Kentucky; noted for raising thoroughbred horses",
34352,noun,"the largest city in Kentucky; located in north central Kentucky on the Ohio river; site of the Kentucky Derby",
34353,noun,"a port and largest city in Louisiana; located in southeastern Louisiana near the mouth of the Mississippi river; a major center for offshore drilling for oil in the Gulf of Mexico; jazz originated here among black musicians in the late 19th century; Mardi Gras is celebrated here each year",
34354,noun,"a city in northwest Louisiana on the Red River near the Texas border",
34355,noun,"largest city in Maine in the southwestern corner of the state",
34356,noun,"the largest city in Maryland; a major seaport and industrial center",
34357,noun,"a city in Massachusetts just north of Boston; site of Harvard University and the Massachusetts Institute of Technology",
34358,noun,"a city and manufacturing center in southwestern Massachusetts on the Connecticut River",
34359,noun,"an industrial and university city in central Massachusetts west of Boston",
34360,noun,"a city in northeastern Massachusetts; site of the witchcraft trials in 1692",
34361,noun,"a city in southern Michigan near Detroit; site of the University of Michigan",
34362,noun,"the largest city in Michigan and a major Great Lakes port; center of the United States automobile industry; located in southeastern Michigan on the Detroit river across from Windsor",
34363,noun,"a city in southeast central Michigan near Detroit; automobile manufacturing",
34364,noun,"a city in west central Michigan; noted for manufacturing furniture",
34365,noun,"a city in northeast Minnesota on Lake Superior",
34366,noun,"largest city in Minnesota; located in southeastern Minnesota on the Mississippi river; noted for flour mills; one of the Twin Cities",
34367,noun,"a city in western Missouri; the beginning of the Santa Fe Trail",
34368,noun,"a city in western Missouri situated at the confluence of the Kansas River and the Missouri River; adjacent to Kansas City, Kansas",
34369,noun,"the largest city in Missouri; a busy river port on the Mississippi River near its confluence with the Missouri River; was an important staging area for wagon trains westward in the 19th century",
34370,noun,"a city of southwestern Missouri",
34371,noun,"the largest city in Montana; located in southern Montana on the Yellowstone river",
34372,noun,"largest city in Nebraska; located in eastern Nebraska on the Missouri river; a major transportation center of the Midwest",
34373,noun,"largest city in Nevada; located in southeastern Nevada; originally settled by Mormons but is now famous for entertainment and gambling and general excess",
34374,noun,"a city in western Nevada at the foot of the Sierra Nevada Mountains; known for gambling casinos and easy divorce and remarriage",
34375,noun,"largest city in New Hampshire; located in southeastern New Hampshire on the Merrimack river",
34376,noun,"a city on the Atlantic shore in southeastern New Jersey; a resort and gambling center",
34377,noun,"a city in northeastern New Jersey",
34378,noun,"a city in southwestern New Jersey on the Delaware River near Pittsburgh",
34379,noun,"a city in northeastern New Jersey (opposite Manhattan)",
34380,noun,"the largest city in New Jersey; located in northeastern New Jersey",
34381,noun,"a city of northeastern New Jersey",
34382,noun,"the largest city in New Mexico; located in central New Mexico on the Rio Grande river",
34383,noun,"the largest city in New York State and in the United States; located in southeastern New York at the mouth of the Hudson river; a major financial and cultural center",
34384,noun,"a city in south central New York near the border with Pennsylvania",
34385,noun,"a city in western New York State at the falls of the Niagara river; tourist attraction and honeymoon resort",
34386,noun,"a city in western New York; a center of the photographic equipment industry",
34387,noun,"a city of eastern New York on the Mohawk river; it prospered after the opening of the Erie Canal",
34388,noun,"a city in central New York",
34389,noun,"a city in central New York",
34390,noun,"the largest city in North Carolina; located in south central North Carolina",
34391,noun,"a city of north central North Carolina; site of Duke University",
34392,noun,"a city of north central North Carolina",
34393,noun,"a city of north central North Carolina",
34394,noun,"largest city in North Dakota; located in eastern North Dakota on the Red river",
34395,noun,"a city in northeastern Ohio; the heart of the United States rubber industry",
34396,noun,"the largest city in Ohio; located in northeastern Ohio on Lake Erie; a major Great Lakes port",
34397,noun,"a city in southern Ohio on the Ohio river",
34398,noun,"a city in southwest Ohio; manufacturing center",
34399,noun,"an industrial city in northwestern Ohio on Lake Erie",
34400,noun,"a city in northeast Ohio",
34401,noun,"a major city of northeastern Oklahoma on the Arkansas river; once known as the oil capital of the world and still heavily involved in the oil and gas industries",
34402,noun,"a city in eastern Oregon on the Willamette River; site of a university",
34403,noun,"freshwater port and largest city in Oregon; located in northwestern Oregon on the Willamette River which divides the city into east and west sections; renowned for its beautiful natural setting among the mountains",
34404,noun,"a city in eastern Pennsylvania; an industrial and commercial center",
34405,noun,"a port city on Lake Erie in northwestern Pennsylvania",
34406,noun,"a city of southeastern Pennsylvania on the Delaware river (an industrial suburb of Philadelphia)",
34407,noun,"the largest city in Pennsylvania; located in the southeastern part of the state on the Delaware river; site of Independence Hall where the Declaration of Independence and the Constitution were signed; site of the University of Pennsylvania",
34408,noun,"a city in southwestern Pennsylvania where the confluence of the Allegheny River and Monongahela River forms the Ohio River; long an important urban industrial area; site of Carnegie Mellon University and the University of Pittsburgh",
34409,noun,"an industrial city of northeastern Pennsylvania",
34410,noun,"a resort city in southeastern Rhode Island; known for the summer homes of millionaires; important yachting center",
34411,noun,"a port city in southeastern South Carolina",
34412,noun,"largest city in South Dakota; located in southeastern South Dakota",
34413,noun,"a city in eastern Tennessee",
34414,noun,"a city in eastern Tennessee on the Tennessee River",
34415,noun,"largest city of Tennessee; located in southwestern Tennessee on bluffs overlooking the Mississippi River",
34416,noun,"a city in central Texas",
34417,noun,"a city in the northern panhandle of Texas",
34418,noun,"a city in northern Texas between Dallas and Fort Worth",
34419,noun,"a city of southeastern Texas near Houston",
34420,noun,"a city in southern Texas on the Rio Grande near its mouth into the Gulf of Mexico; has a channel that accommodates oceangoing ships",
34421,noun,"a city in southern Texas on an arm of the Gulf of Mexico",
34422,noun,"a large commercial and industrial city in northeastern Texas located in the heart of the northern Texas oil fields",
34423,noun,"a city in western Texas on the Mexican border; located on the northern bank of the Rio Grande across from the Mexican city of Juarez",
34424,noun,"a city in northeastern Texas (just west of Dallas); a major industrial center",
34425,noun,"a city in northeastern Texas (suburb of Dallas)",
34426,noun,"the largest city in Texas; located in southeastern Texas near the Gulf of Mexico; site of the National Aeronautics and Space Administration",
34427,noun,"a city in southern Texas on the Rio Grande",
34428,noun,"a city in northwest Texas south of Amarillo",
34429,noun,"a city in western Texas",
34430,noun,"a city in northeastern Texas (suburb of Dallas)",
34431,noun,"a city of south central Texas; site of the Alamo; site of several military bases and a popular haven for vacationers",
34432,noun,"a city in east central Texas",
34433,noun,"a city in north central Texas near the Oklahoma border",
34434,noun,"a city in north central Utah settled by Mormons",
34435,noun,"the largest city in Vermont; located in northwestern Vermont on Lake Champlain; site of the University of Vermont",
34436,noun,"a port city in southeastern Virginia at the mouth of the James River off Hampton Roads; large shipyards",
34437,noun,"port city located in southeastern Virginia on the Elizabeth River at the mouth of Chesapeake Bay; headquarters of the Atlantic fleet of the United States Navy",
34438,noun,"a city in central Virginia",
34439,noun,"a port city in southeastern Virginia on the Elizabeth River opposite Norfolk; naval base; shipyards",
34440,noun,"a city in southwestern Virginia",
34441,noun,"the largest city in Virginia; long overshadowed by Norfolk but growing rapidly since 1970; with 28 miles of public beaches tourism is a major factor in the economy; site of three United States Navy bases",
34442,noun,"a major port of entry and the largest city in Washington; located in west central Washington on the protected waters of Puget Sound with the snow-capped peaks of the Cascade Range and Mount Ranier visible to the south and east; an aerospace and computer center; site of the University of Washington",
34443,noun,"a city in eastern Washington near the Idaho border",
34444,noun,"a city in west central Washington on an arm of Puget Sound south of Seattle",
34445,noun,"a city in southern West Virginia",
34446,noun,"a city in northern West Virginia",
34447,noun,"a city of western West Virginia on the Ohio river at the mouth of the Kanawha",
34448,noun,"a city in northern West Virginia on the Monongahela river near the Pennsylvania border; site of the University of West Virginia",
34449,noun,"a city in northwestern West Virginia on the Ohio river",
34450,noun,"a city in the northern panhandle of West Virginia on the Ohio river",
34451,noun,"a city of eastern Wisconsin on an arm of Lake Michigan",
34452,noun,"largest city of Wisconsin; located in southeastern Wisconsin on the western shore of Lake Michigan; a flourishing agricultural center known for its breweries",
34453,noun,"a city in southeastern Wisconsin on Lake Michigan south of Milwaukee",
34454,noun,"a city of east central Wyoming on the North Platte river",
34455,noun,"the capital of the State of the Vatican City",
34456,noun,"a port in eastern Venezuela on the Orinoco river",
34457,noun,"a port city in northeastern Venezuela on the Caribbean Sea; founded in 1523, it is the oldest European settlement in South America",
34458,noun,"a port city in northwestern Venezuela; a major oil center",
34459,noun,"a city in north central Venezuela; cattle center",
34460,noun,"an industrial city in northern Venezuela",
34461,noun,"a city in South Vietnam; formerly (as Saigon) it was the capital of French Indochina",
34462,noun,"a port city in northern Vietnam; industrial center",
34463,noun,"an important port in Yemen on the Red Sea",
34464,noun,"a port in southern Yemen on the Gulf of Aden east of Aden",
34465,noun,"industrial city in southwestern Zimbabwe",
34466,noun,"an area in a city with large modern buildings that is perceived as dangerous and unpleasant",
34467,noun,"the center of a city",
34468,noun,"an incorporated administrative district established by state charter; ""the city raised the tax rate""",
34469,noun,"a district of a town or city",
34470,noun,"the limits of the area occupied by a city or town",
34471,noun,"a residential part of town away from the central commercial district",
34472,noun,"an open area at the meeting of two or more streets",
34473,noun,"people living in a large densely populated municipality; ""the city voted for Republicans in 1994""",
34474,noun,"a city dweller with sophisticated manners and clothing",
34475,noun,"a person with good manners and stylish clothing",
34476,noun,"the social science of municipal affairs",
34477,adjective,"applying to ordinary citizens; ""civil law""; ""civil authorities""",
34478,adjective,"associated with or performed by civilians as contrasted with the military; ""civilian clothing""; ""civilian life""",
34479,adjective,"not rude; marked by satisfactory (or especially minimal) adherence to social usages and sufficient but not noteworthy consideration for others; ""even if he didn't like them he should have been civil""- W.S. Maugham",
34480,noun,"formal or perfunctory politeness",
34481,adjective,"of or in a condition of social order; ""civil peoples""",
34482,noun,"activities organized by civilians for their own protection in time of war or disaster",
34483,noun,"an engineer trained to design and construct and maintain public works (roads or bridges or harbors etc.)",
34484,noun,"a person who uses scientific knowledge to solve practical problems",
34485,noun,"a civil engineer who specializes in the design and construction of roads and highways",
34486,noun,"United States civil engineer noted for designing suspension bridges (including the George Washington Bridge) (1886-1960)",
34487,noun,"a public official who is a member of the civil service",
34488,noun,"the British civil service",
34489,noun,"a war between factions in the same country",
34490,noun,"civil war in England between the Parliamentarians and the Royalists under Charles I; 1644-1648",
34491,noun,"civil war in Spain in which Franco succeeded in overthrowing the republican government; during the war Spain became a battleground for fascists and socialists from all countries; 1936-1939",
34492,adjective,"used of civilians in time of war",
34493,adjective,"lacking civility or good manners; ""want nothing from you but to get away from your uncivil tongue""- Willa Cather",
34494,noun,"the act of showing regard for others",
34495,noun,"a courteous expression (by word or deed) of esteem or regard; ""his deference to her wishes was very flattering""; ""be sure to give my respects to the dean""",
34496,noun,"formal expression of respect",
34497,noun,"a society in an advanced state of social development (e.g., with complex legal and political and religious organizations); ""the people slowly progressed from barbarism to civilization""",
34498,noun,"an extended social group having a distinctive cultural and economic organization",
34499,noun,"the civilization of Muslims collectively which is governed by the Muslim religion; ""Islam is predominant in northern Africa, the Middle East, Pakistan, and Indonesia""",
34500,noun,"the social process whereby societies achieve civilization",
34501,noun,"the prehistoric civilization on the islands in the Aegean sea and the surrounding countries; ""by 800 BC the entire Aegean had adopted this style of pottery""",
34502,noun,"the bronze-age culture of mainland Greece that flourished 2500-1100 BC",
34503,noun,"the bronze-age culture of the Indus valley that flourished from about 2600-1750 BC",
34504,noun,"the bronze-age culture of Crete that flourished 3000-1100 BC",
34505,noun,"the late bronze-age culture of Mycenae that flourished 1400-1100 BC",
34506,noun,"the prehistoric culture of the earliest human inhabitants of North America and South America",
34507,noun,"the modern culture of western Europe and North America; ""when Ghandi was asked what he thought of Western civilization he said he thought it would be a good idea""",
34508,noun,"a social group within a national culture that has distinctive patterns of behavior and beliefs",
34509,noun,"the quality of excellence in thought and manners and taste; ""a man of intellectual refinement""; ""he is remembered for his generosity and civilization""",
34510,noun,"the quality of excelling; possessing good qualities in high degree",
34511,verb,"train to be discriminative in taste or judgment; ""Cultivate your musical taste""; ""Train your tastebuds""; ""She is well schooled in poetry""",
34512,verb,"make less natural or innocent; ""Their manners had sophisticated the young girls""",
34513,verb,"turn into curds; ""curdled milk""",
34514,noun,"raw milk that has soured and thickened",
34515,verb,"make a clucking sounds, characteristic of hens",
34516,noun,"a sharp abrupt noise as if two objects hit together; may be repeated",
34517,noun,"a simple valve with a hinge on one side; allows fluid to flow in only one direction",
34518,adjective,"clothed or adorned with finery",
34519,adjective,"dressed or clothed especially in fine attire; often used in combination; ""the elegantly attired gentleman""; ""neatly dressed workers""; ""monks garbed in hooded robes""; ""went about oddly garmented""; ""professors robed in crimson""; ""tuxedo-attired gentlemen""; ""crimson-robed Harvard professors""",
34520,adjective,"in ceremonial attire and paraphernalia; ""professors arrayed in robes""",
34521,adjective,"dressed in trousers",
34522,adjective,"dressed warmly; ""bundled-up sailors and soldiers""",
34523,adjective,"clothed in finery (especially a horse in ornamental trappings)",
34524,adjective,"dressed in a cassock; ""cassocked monks""",
34525,adjective,"having or dressed in a coat",
34526,adjective,"dressed in clothing characteristic of a period, country, or class",
34527,adjective,"having the head enclosed in a cowl or hood; ""a cowled monk""",
34528,adjective,"dressed in fancy or formal clothing",
34529,adjective,"wearing a gown; ""beautifully gowned women""",
34530,adjective,"dressed in a habit; ""the habited men of the monastery""",
34531,adjective,"wearing a heavy coat; ""heavy-coated policemen astride noble horses""",
34532,adjective,"dressed too elaborately",
34533,adjective,"wearing or furnished with a petticoat; ""petticoated ladies""; ""a petticoated table""",
34534,adjective,"used of British soldiers during the American Revolutionary War because of their red coats",
34535,adjective,"outfitted or supplied with clothing; ""recruits suited in green""",
34536,adjective,"wearing a surplice",
34537,adjective,"dressed especially in smart clothes",
34538,adjective,"dressed well or smartly; ""the girls were well turned out and smart""",
34539,adjective,"dressed in a tuxedo; ""a tuxedoed gentleman""",
34540,adjective,"inadequately or too informally clothed",
34541,adjective,"dressed in a uniform; ""uniformed policemen lined the President's route""",
34542,adjective,"dressed in ceremonial garments especially clerical vestment",
34543,adjective,"having an outer covering especially of thin metal; ""steel-clad""; ""armor-clad""",
34544,adjective,"enclosed in a protective covering; sometimes used in combination; ""his sheathed sword""; ""the cat's sheathed claws""; ""a ship's bottom sheathed in copper""; ""copper-sheathed""",
34545,noun,"a protective covering that protects the outside of a building",
34546,noun,"a facing (usually masonry) that supports an embankment",
34547,verb,"state insincerely; ""He professed innocence but later admitted his guilt""; ""She pretended not to have known the suicide bomber""; ""She pretends to be an expert on wine""",
34548,verb,"maintain or assert; ""He contended that Communism had no future""",
34549,verb,"try to establish; ""She made out that she know nothing about the crime""",
34550,verb,"have the often specious appearance of being, intending, or claiming; ""The letter purports to express people's opinion""",
34551,verb,"practice as a profession, teach, or claim to be knowledgeable about; ""She professes organic chemistry""",
34552,verb,"set up a claim in opposition to a previous claim",
34553,verb,"lay legal claim to",
