ID,POS,Gloss
34554,noun,"a claim sufficient to demand judicial attention; the facts that give rise to right of action",
34555,noun,"the advancing of a claim; ""his pretension to the crown""; ""the town still puts forward pretensions as a famous resort""",
34556,noun,"demand for something as rightful or due; ""they struck in support of their claim for a shorter work day""",
34557,noun,"demand for payment in accordance with an insurance policy",
34558,noun,"an informal right to something; ""his claim on her attentions""; ""his title to fame""",
34559,noun,"an established or recognized right; ""a strong legal claim to the property""; ""he had no documents confirming his title to his father's estate""; ""he staked his claim""",
34560,noun,"a right based in law",
34561,noun,"by title vested in yourself or by virtue of qualifications that you have achieved; ""a peer in his own right""; ""a leading sports figure in his own right""; ""a fine opera in its own right""",
34562,noun,"right granted by law or contract (especially a right to benefits); ""entitlements make up the major part of the federal budget""",
34563,noun,"a claimant to the throne or to the office of ruler (usually without just title)",
34564,noun,"apparent power to perceive things that are not present to the senses",
34565,noun,"phenomena that appear to contradict physical laws and suggest the possibility of causation by mental processes",
34566,noun,"knowledge of an event before it occurs",
34567,adjective,"perceiving things beyond the natural range of the senses",
34568,adjective,"seemingly outside normal sensory channels",
34569,adjective,"foreseeing the future",
34570,noun,"someone who has the power of clairvoyance",
34571,noun,"a person apparently sensitive to things beyond the natural range of perception",
34572,verb,"gather clams, by digging in the sand by the ocean",
34573,verb,"assemble or get together; ""gather some stones""; ""pull your thoughts together""",
34574,noun,"an edible clam with thin oval-shaped shell found in coastal regions of the United States and Europe",
34575,noun,"an edible American clam; the heavy shells were used as money by some American Indians",
34576,noun,"a large edible clam found burrowing deeply in sandy mud along the Pacific coast of North America; weighs up to six pounds; has siphons that can extend to several feet and cannot be withdrawn into the shell",
34577,noun,"marine clam having a long narrow curved thin shell",
34578,noun,"a large clam inhabiting reefs in the southern Pacific and weighing up to 500 pounds",
34579,noun,"wormlike marine bivalve that bores into wooden piers and ships by means of drill-like shells",
34580,noun,"flesh of either hard-shell or soft-shell clams",
34581,noun,"meat of edible aquatic invertebrate with a shell (especially a mollusk or crustacean)",
34582,noun,"Atlantic coast round clams with hard shells; large clams usually used for chowders or other clam dishes",
34583,noun,"a clam that is usually steamed in the shell",
34584,noun,"a cookout at the seashore where clams and fish and other foods are cooked--usually on heated stones covered with seaweed",
34585,verb,"climb awkwardly, as if by scrambling",
34586,verb,"move with difficulty, by grasping",
34587,noun,"an awkward climb; ""reaching the crest was a real clamber""",
34588,adjective,"unpleasantly cool and humid; ""a clammy handshake""; ""clammy weather""; ""a dank cellar""; ""dank rain forests""",
34589,verb,"make loud demands; ""he clamored for justice and tolerance""",
34590,verb,"utter or proclaim insistently and noisily; ""The delegates clamored their disappointment""",
34591,verb,"compel someone to do something by insistent clamoring; ""They clamored the mayor into building a new park""",
34592,verb,"fasten or fix with a clamp; ""clamp the chair together until the glue has hardened""",
34593,verb,"impose or inflict forcefully; ""The military government clamped a curfew onto the capital""",
34594,verb,"impose something unpleasant; ""The principal visited his rage on the students""",
34595,noun,"a device (generally used by carpenters) that holds things firmly together",
34596,noun,"a clamp used to hold work in place on a workbench",
34597,noun,"a clamp in the shape of the letter C",
34598,noun,"a clamp for holding pieces of wood together while they are glued",
34599,noun,"a clamp for holding pipe that is to be cut or threaded",
34600,noun,"clamp to prevent wooden rackets from warping when not in use",
34601,noun,"group of people related by blood or marriage",
34602,noun,"(Yiddish) the entire family network of relatives by blood or marriage (and sometimes close friends); ""she invited the whole mishpocha""",
34603,noun,"your parents; ""he wrote to his folks every day""",
34604,noun,"a clan or tribe identified by their kinship to a common totemic object",
34605,noun,"twelve kin groups of ancient Israel each traditionally descended from one of the twelve sons of Jacob",
34606,noun,"a member of a clan",
34607,noun,"someone who lives in a tribe",
34608,adjective,"conducted with or marked by hidden aims or methods; ""clandestine intelligence operations""; ""cloak-and-dagger activities behind enemy lines""; ""hole-and-corner intrigue""; ""secret missions""; ""a secret agent""; ""secret sales of arms""; ""surreptitious mobilization of troops""; ""an undercover investigation""; ""underground resistance""",
34609,verb,"make a loud noise; ""clanging metal""",
34610,noun,"a loud resonant repeating noise; ""he could hear the clang of distant bells""",
34611,verb,"make a loud resonant noise; ""the alarm clangored throughout the building""",
34612,verb,"make a clank; ""the train clanked through the village""",
34613,adjective,"characteristic of a clan especially in being unified; ""clannish loyalty""",
34614,adjective,"united or combined; ""a joint session of Congress""; ""joint owners""",
34615,adjective,"befitting or characteristic of those who incline to social exclusiveness and who rebuff the advances of people considered inferior",
34616,verb,"put quickly or forcibly; ""The judge clapped him in jail""",
34617,verb,"clap one's hands together; ""The children were clapping to the music""",
34618,verb,"strike with the flat of the hand; usually in a friendly way, as in encouragement or greeting",
34619,verb,"strike together so as to produce a sharp percussive noise; ""clap two boards together""",
34620,noun,"a common venereal disease caused by the bacterium Neisseria gonorrhoeae; symptoms are painful urination and pain around the urethra",
34621,noun,"a communicable infection transmitted by sexual intercourse or genital contact",
34622,verb,"cover with clapboards",
34623,noun,"a long thin board with one edge thicker than the other; used as siding by lapping one board over the board below",
34624,noun,"material applied to the outside of a building to make it weatherproof",
34625,noun,"a mobile mass of muscular tissue covered with mucous membrane and located in the oral cavity",
34626,noun,"the opening through which food is taken in and vocalizations emerge; ""he stuffed his mouth with candy""",
34627,noun,"a movable speech organ",
34628,noun,"an oval sensory end organ on the surface of the tongue",
34629,noun,"the part of a mechanical device that strikes something",
34630,verb,"claw with the nails",
34631,verb,"scratch, scrape, pull, or dig with claws or nails",
34632,noun,"a dark purplish-red color",
34633,noun,"a red color that reflects little light",
34634,noun,"dry red Bordeaux or Bordeaux-like wine",
34635,noun,"any of several red or white wines produced around Bordeaux, France or wines resembling them",
34636,noun,"full-bodied red wine from around the town of Saint Emilion in Bordeaux",
34637,noun,"an interpretation that removes obstacles to understanding; ""the professor's clarification helped her to understand the textbook""",
34638,noun,"clarification that follows from the removal of ambiguity",
34639,noun,"the act of removing solid particles from a liquid",
34640,verb,"make clear and  (more) comprehensible; ""clarify the mystery surrounding her death""",
34641,verb,"make plain and comprehensible; ""He explained the laws of physics to his students""",
34642,verb,"make less mysterious or remove the mystery from; ""let's demystify the event by explaining what it is all about""",
34643,verb,"make free from confusion or ambiguity; make clear; ""Could you clarify these remarks?""; ""Clear up the question of who is at fault""",
34644,verb,"add details, as to an account or idea; clarify the meaning of and discourse in a learned way, usually in writing; ""She elaborated on the main ideas in her dissertation""",
34645,verb,"state unambiguously or remove ambiguities from; ""Can you disambiguate this statement?""",
34646,noun,"a beating-reed instrument with a single reed (as a clarinet or saxophone)",
34647,noun,"a large clarinet whose range is an octave below the B-flat clarinet",
34648,noun,"the ordinary clarinet with a middle range",
34649,adjective,"loud and clear; ""a clarion call""",
34650,verb,"blow the clarion",
34651,verb,"proclaim on, or as if on, a clarion",
34652,verb,"state or announce; ""`I am not a Communist,' he exclaimed""; ""The King will proclaim an amnesty""",
34653,noun,"free from obscurity and easy to understand; the comprehensibility of clear expression",
34654,noun,"the quality of comprehensible language or thought",
34655,noun,"having a single meaning (absence of ambiguity) usually of individual words or phrases",
34656,noun,"maximum clarity or distinctness of an idea; ""the controversy brought clearly into focus an important difference of opinion""",
34657,noun,"clarity as a consequence of precision",
34658,noun,"clarity as a consequence of being perspicuous",
34659,noun,"clarity achieved by the avoidance of ambiguity",
34660,noun,"clarity as a consequence of being explicit",
34661,noun,"the quality of clear water; ""when she awoke the clarity was back in her eyes""",
34662,adjective,"free from cloudiness; allowing light to pass through; ""clear water""; ""clear plastic bags""; ""clear glass""; ""the air is clear and clean""",
34663,noun,"the quality of being clear and transparent",
34664,noun,"the quality of allowing light to pass diffusely",
34665,noun,"capability of providing a clear unobstructed view; ""a windshield with good visibility""",
34666,noun,"the quality of being sharp and clear",
34667,verb,"crash together with violent impact; ""The cars collided""; ""Two meteors clashed""",
34668,verb,"collide or strike violently and suddenly; ""The motorcycle smashed into the guard rail""",
34669,verb,"collide violently",
34670,verb,"undergo damage or destruction on impact; ""the plane crashed into the ocean""; ""The car crashed into the lamp post""",
34671,verb,"be incompatible; be or come into conflict; ""These colors clash""",
34672,verb,"be in conflict; ""The two proposals conflict!""",
34673,verb,"disagree violently; ""We clashed over the new farm policies""",
34674,noun,"a state of conflict between persons",
34675,noun,"a state of opposition between persons or ideas or interests; ""his conflict of interest made him ineligible for the post""; ""a conflict of loyalties""",
34676,noun,"a state of conflict between colors; ""her dress was a disturbing clash of colors""",
34677,verb,"hold firmly",
34678,verb,"grasp firmly; ""The child clasped my hands""",
34679,noun,"the act of grasping; ""he released his clasp on my arm""; ""he has a strong grip for an old man""; ""she kept a firm hold on the railing""",
34680,noun,"the act of gripping something firmly with the hands",
34681,noun,"a restraining hold; someone loops the arm around the neck of another person in a tight grip, usually from behind; ""he grabbed the woman in a chokehold, demanded her cash and jewelry, and then fled""",
34682,noun,"the act of clasping another person in the arms (as in greeting or affection)",
34683,noun,"a hold used in the sport of wrestling",
34684,noun,"a large knife with one or more folding blades",
34685,noun,"a knife with a blade that folds into the handle; suitable for carrying in the pocket",
34686,noun,"the organization of classes within a society",
34687,noun,"people in general; especially a distinctive group of people with some shared interest; ""the Western world""",
34688,noun,"people in the same age range",
34689,noun,"a major social class or order of persons regarded collectively as part of the body politic of the country and formerly possessing distinct political rights",
34690,noun,"a social class comprising those who do manual labor or work for wages; ""there is a shortage of skilled labor in this field""",
34691,noun,"the social class lowest in the social hierarchy",
34692,noun,"class composed of persons lacking noble or knightly or gentle rank",
34693,noun,"the class of peasants",
34694,noun,"a class of woman not considered respectable because of indiscreet or promiscuous behavior",
34695,noun,"the criminal class",
34696,noun,"class of small freeholders who cultivated their own land",
34697,noun,"a class of 14th century Japanese who were trained in martial arts and were hired for espionage and assassinations",
34698,noun,"the most advanced and responsible group in an activity; ""the firing line is where the action is""",
34699,noun,"recent immigrants who are lumped together as a class by their low socioeconomic status in spite of different cultural backgrounds",
34700,noun,"a class of people favoring traditional ideas",
34701,noun,"people who perform a particular kind of skilled work; ""he represented the craft of brewers""; ""as they say in the trade""",
34702,noun,"women as a class; ""it's an insult to American womanhood""; ""woman is the glory of creation""; ""the fair sex gathered on the veranda""",
34703,noun,"students taking a course in biology together",
34704,noun,"students taking a course in chemistry together",
34705,noun,"students taking a course in English together",
34706,noun,"students beginning elementary school",
34707,noun,"a class (especially in music) given to talented students by an expert",
34708,noun,"students taking a course in physics together",
34709,noun,"a class in a Sunday school",
34710,noun,"education imparted in a series of lessons or meetings; ""he took a course in basket weaving""; ""flirting is not unknown in college classes""",
34711,noun,"a course (via lectures or correspondence) for adults who are not otherwise engaged in formal study",
34712,noun,"a class in which you learn to draw or paint",
34713,noun,"a course that teaches pregnant women to use breathing and concentration and exercise techniques to use during labor",
34714,noun,"a course offered (by mail) by a correspondence school",
34715,noun,"a series of lectures dealing with a subject",
34716,noun,"a course that the student can select from among alternatives",
34717,noun,"a course offered as part of an extension service",
34718,noun,"a course of study carried out at home rather than in a classroom",
34719,noun,"a course in the methods of using tools and machinery as taught in secondary schools and technical schools",
34720,noun,"a course introducing a new situation or environment",
34721,noun,"a course that provides an introduction to an art or science (or to more advanced study generally)",
34722,noun,"a course that reviews and updates a topic for those who have not kept abreast of developments",
34723,noun,"a course that all students are required to take",
34724,noun,"a course offered for a small group of advanced students",
34725,noun,"a course of instruction in a trade (as carpentry or electricity); ""I built a birdhouse in shop""",
34726,noun,"a brief intensive course for a small group; emphasizes problem solving",
34727,noun,"work assigned to and done by a student during a course of study; usually it is evaluated as part of the student's grade in the course",
34728,noun,"a unit of instruction; ""he took driving lessons""",
34729,noun,"teaching by giving a discourse on some subject (typically to a class)",
34730,noun,"a regularly scheduled session as part of a course of study",
34731,noun,"the body of students who graduate together this year",
34732,noun,"final grade or class in high school or college",
34733,noun,"penultimate class in high school or college",
34734,noun,"the second class in a four-year college or high school",
34735,noun,"the first class in college or high school",
34736,noun,"a league ranked by quality; ""he played baseball in class D for two years""; ""Princeton is in the NCAA Division 1-AA""",
34737,noun,"elegance in dress or behavior; ""she has a lot of class""",
34738,noun,"animal or plant group having natural relations",
34739,noun,"a former classification",
34740,noun,"photosynthetic bacteria found in fresh and salt water, having chlorophyll a and phycobilins; once thought to be algae: blue-green algae",
34741,noun,"characterized by the formation of pseudopods for locomotion and taking food: Actinopoda; Rhizopoda",
34742,noun,"heliozoans; radiolarians",
34743,noun,"creeping protozoans: amoebas and foraminifers",
34744,noun,"in some recent classifications, coextensive with the Ciliata: minute organisms found in decomposing infusions of organic matter",
34745,noun,"all the yellow-green algae having flagella of unequal length",
34746,noun,"yellow-green algae",
34747,noun,"marine and freshwater eukaryotic algae: diatoms",
34748,noun,"brown algae; mostly marine and littoral eukaryotic algae",
34749,noun,"in more recent classifications superseded by the order Fucales",
34750,noun,"coextensive with the division Euglenophyta",
34751,noun,"algae distinguished chiefly by having flagella and a clear green color, their chlorophyll being masked little if at all by other pigments",
34752,noun,"alternative name for the class Chlorophyceae in some classifications",
34753,noun,"in some classifications: contains only the order Charales",
34754,noun,"coextensive with the Rhodophyta: red algae",
34755,noun,"protozoa having flagella",
34756,noun,"in some classifications considered a phylum of the kingdom Protista; holozoic or saprozoic flagellates",
34757,noun,"plantlike flagellates containing chlorophyll; often considered unicellular algae",
34758,noun,"motile usually brownish-green protozoa-like algae",
34759,noun,"strictly parasitic protozoans that are usually immobile; includes plasmodia and coccidia and piroplasms and malaria parasites",
34760,noun,"parasitic sporozoans that form spores containing one or more infective sporozoites",
34761,noun,"a subclass of Sporozoa",
34762,noun,"single-host parasites of lower vertebrates and invertebrates",
34763,noun,"sometimes classified as an order: sea squirts",
34764,noun,"small class of free-swimming tunicates; sometimes classified as an order",
34765,noun,"superclass of eel-shaped chordates lacking jaws and pelvic fins: lampreys; hagfishes; some extinct forms",
34766,noun,"comprising all vertebrates with upper and lower jaws",
34767,noun,"extinct group of bony-plated fishes with primitive jaws",
34768,noun,"cartilaginous fishes",
34769,noun,"chimaeras and extinct forms",
34770,noun,"sharks; rays; dogfishes; skates",
34771,noun,"primitive reptile-like fossil birds of the Jurassic or early Cretaceous",
34772,noun,"class of cold-blooded air-breathing vertebrates with completely ossified skeleton and a body usually covered with scales or horny plates; once the dominant land animals",
34773,noun,"oldest known reptiles: turtles; extinct Permian forms",
34774,noun,"diapsid reptiles: lizards; snakes; tuataras",
34775,noun,"a large subclass of diapsid reptiles including: crocodiles; alligators; dinosaurs; pterosaurs; plesiosaurs; ichthyosaurs; thecodonts",
34776,noun,"extinct reptiles of the Permian to Jurassic considered ancestral to mammals",
34777,noun,"spiders; scorpions; horseshoe crabs",
34778,noun,"used in some classifications to encompass the millipedes (Diplopoda) and centipedes (Chilopoda); formerly a large taxon including also the Pauropoda and Symphyla; the term Myriapoda now usually used synonymously with Diplopoda and limited to the millipedes",
34779,noun,"an obscure class of minute arthropods with branched antennae and 8 to 10 pairs of legs",
34780,noun,"small class of minute arthropods; unimportant except for the garden centipede",
34781,noun,"in some classifications considered a separate phylum: microscopic arachnid-like invertebrates living in water or damp moss having 4 pairs of legs and instead of a mouth a pair of stylets or needlelike piercing organs connected with the pharynx",
34782,noun,"warm-blooded vertebrates characterized by mammary glands in the female",
34783,noun,"echidnas; platypus",
34784,noun,"generalized extinct mammals widespread during the Jurassic; commonly conceded to be ancestral to marsupial and placental mammals",
34785,noun,"pouched animals",
34786,noun,"all mammals except monotremes and marsupials",
34787,noun,"sponges with siliceous spicules that have six rays; choanocytes are restricted to finger-shaped chambers",
34788,noun,"coelenterates in which the polyp stage is absent or at least inconspicuous: jellyfishes",
34789,noun,"coelenterates typically having alternation of generations; hydroid phase is usually colonial giving rise to the medusoid phase by budding: hydras and jellyfishes",
34790,noun,"ctenophores lacking tentacles; comprises one genus: beroe",
34791,noun,"ctenophores have retractile tentacles",
34792,noun,"free-living flatworms",
34793,noun,"parasitic flatworms (including flukes)",
34794,noun,tapeworms,
34795,noun,"one of two subgroups of Nematoda used in some classification systems",
34796,noun,"one of two subgroups of Nematoda used in some classification systems",
34797,noun,"a class of Annelida",
34798,noun,"marine annelid worms",
34799,noun,"small class of bilaterally symmetrical marine forms comprising the tooth shells",
34800,noun,"snails and slugs and their relatives",
34801,noun,"gastropods having the gills when present posterior to the heart and having no operculum: includes sea slugs; sea butterflies; sea hares",
34802,noun,"a class of Gastropoda",
34803,noun,"small class of marine mollusks comprising the chitons; sometimes considered an order of the subclass Amphineura",
34804,noun,"comprising all living cephalopods except the family Nautilidae: the orders Octopoda (octopuses) and Decapoda (squids and cuttlefish)",
34805,noun,"class of mandibulate arthropods including: lobsters; crabs; shrimps; woodlice; barnacles; decapods; water fleas",
34806,noun,"in some older classifications includes the Branchiopoda and Copepoda and Ostracoda and Cirripedia; no longer in technical use",
34807,noun,"primitive aquatic mainly freshwater crustaceans: fairy shrimps; brine shrimps; tadpole shrimps; can shrimps; water fleas",
34808,noun,"minute planktonic or parasitic crustaceans",
34809,noun,"seed shrimps",
34810,noun,"enigmatic small elongated wormlike terrestrial invertebrates of damp dark habitats in warm regions; distinct from the phylum Annelida; resemble slugs with legs and are sometimes described as the missing link between arthropods and annelids",
34811,noun,"insects; about five-sixths of all known animal species",
34812,noun,"subclass of insects characterized by gradual and usually incomplete metamorphosis",
34813,noun,"sea stars",
34814,noun,"brittle stars and basket stars",
34815,noun,"brittle stars",
34816,noun,"basket stars",
34817,noun,"sea urchins and sand dollars",
34818,noun,"sea lilies",
34819,noun,"class of echinoderms including the sea cucumbers",
34820,noun,"anthropoid apes and human beings",
34821,noun,snakeheads,
34822,noun,"a class of fish having a skeleton composed of bone in addition to cartilage",
34823,noun,"fishes having paired fins resembling limbs and regarded as ancestral to amphibians",
34824,noun,"bony fishes of the southern hemisphere that breathe by a modified air bladder as well as gills; sometimes classified as an order of Crossopterygii",
34825,noun,"large diverse group of bony fishes; includes most living species",
34826,noun,"hornworts: in some classification systems included in the class Hepaticopsida",
34827,noun,"true mosses: bryophytes having leafy rather than thalloid gametophytes: comprises orders Andreaeales; Bryales; Dicranales; Eubryales; Sphagnales",
34828,noun,"liverworts: comprises orders Anthocerotales; Jungermanniales; Marchantiales; Sphaerocarpales",
34829,noun,"plants having naked seeds not enclosed in an ovary; in some systems considered a class (Gymnospermae) and in others a division (Gymnospermophyta); comprises three subdivisions (or classes): Cycadophytina (class Cycadopsida) and Gnetophytina (class Gnetopsida) and Coniferophytina (class Coniferopsida); in some classifications the Coniferophytina are divided into three groups: Pinophytina (class Pinopsida) and Ginkgophytina (class Ginkgopsida) and Taxophytina (class Taxopsida)",
34830,noun,"gymnospermous flowering plants; supposed link between conifers and angiosperms; in some systems classified as a class (Gnetopsida) and in others as a subdivision (Gnetophytina or Gnetophyta)",
34831,noun,"palmlike gymnosperms: includes the surviving order Cycadales and several extinct orders; possibly not a natural group; in some systems considered a class (Cycadopsida) and in others a subdivision (Cycadophytina or Cycadophyta)",
34832,noun,"extinct gymnosperms most of Carboniferous to Jurassic: seed ferns and allies",
34833,noun,"cone-bearing gymnosperms dating from the Carboniferous period; most are substantial trees; includes the classes Pinopsida (subdivision Pinophytina) and Ginkgopsida (subdivision Ginkgophytina) and Taxopsida (subdivision Taxophytina) which in turn include the surviving orders Coniferales and Taxales (yews) and sometimes Ginkgoales as well as extinct orders such as Cordaitales (of the Carboniferous and Permian)",
