ID,POS,Gloss
56666,noun,"(wine tasting) the taste of a wine on the back of the tongue (as it is swallowed); ""the wine has a nutty flavor and a pleasant finish""",
56667,noun,"a small amount (especially of food or wine)",
56668,adjective,"capable of being used up; capable of being exhausted; ""our exhaustible reserves of fossil fuel""",
56669,adjective,"existing or enduring for a limited time only",
56670,adjective,"not unlimited; ""a limited list of choices""",
56671,adjective,"of verbs; relating to forms of the verb that are limited in time by a tense and (usually) show agreement with number and person",
56672,adjective,"having inflections to indicate tense",
56673,noun,"the quality of being finite",
56674,noun,"the official language of Finland; belongs to the Baltic Finnic family of languages",
56675,noun,"a long narrow inlet of the sea between steep cliffs; common in Norway",
56676,noun,"a long narrow inlet of the Norwegian Sea",
56677,noun,"a woodwind with a vertical pipe and 8 finger holes and a whistle mouthpiece",
56678,noun,"any wind instrument other than the brass instruments",
56679,noun,"a small fipple flute with four finger holes and two thumb holes",
56680,noun,"an inexpensive fipple flute",
56681,noun,"true firs",
56682,noun,"any of various true firs having leaves white or silvery white beneath",
56683,noun,"a pyramidal fir of southwestern California having spiny pointed leaves and cone scales with long spines",
56684,verb,"start firing a weapon",
56685,verb,"provide with fuel; ""Oil fires the furnace""",
56686,noun,"an uncontrolled fire that consumes brush and shrubs and bushes",
56687,noun,"a small outdoor fire for warmth or cooking (as at a camp)",
56688,noun,"an uncontrolled fire in a wooded area",
56689,noun,"an uncontrolled fire in a grassy area",
56690,noun,"a fire that burns with thick smoke but no flame; ""the smoulder suddenly became a blaze""",
56691,noun,"a smoky fire to drive away insects",
56692,noun,"a sudden burst of flame",
56693,noun,"the process of initiating combustion or catching fire",
56694,noun,"firing at enemy aircraft",
56695,noun,"fire delivered on a specific target in response to a request from the supported unit",
56696,noun,"fire from two or more weapons directed at a single target or area (as fire by batteries of two or more warships)",
56697,noun,"fire intended to neutralize or destroy enemy weapons",
56698,noun,"intensive prearranged fire delivered when the immanence of enemy attack is discovered",
56699,noun,"fire from two or more points so that the lines of fire cross",
56700,noun,"fire delivered for the sole purpose of destroying material objects",
56701,noun,"fire delivered on a target that is visible to the person aiming it",
56702,noun,"fire dispersed so as to engage effectively an area target",
56703,noun,"fire that injures or kills an ally",
56704,noun,"fire that injures or kills an enemy",
56705,noun,"fire approximately parallel to the ground; the center of the cone of fire does rise above 1 meter from the ground",
56706,noun,"fire designed to disturb the rest of enemy troops and to curtail movement and to lower enemy morale",
56707,noun,"fire delivered on a target that is not itself used as the point of aim for the weapons",
56708,noun,"fire directed to an area to prevent the enemy from using that area",
56709,noun,"fire that is delivered in order to render the target ineffective or unusable",
56710,noun,"fire for which the point of impact (the burst) can be seen by an observer; fire can be adjusted on the basis of the observations",
56711,noun,"fire delivered on a target in preparation for an assault",
56712,noun,"gunfire aimed a target that is being tracked by radar",
56713,noun,"fire delivered to obtain accurate data for subsequent effective engagement of targets",
56714,noun,"prearranged fire delivered at a predetermined time",
56715,noun,"fire distributed in depth by successive changes in the elevation of the gun",
56716,noun,"fire delivered by supporting units to protect or assist a unit in combat",
56717,noun,"fire on or about a weapon system to degrade its performance below what is needed to fulfill its mission objectives",
56718,noun,"fire for which the point of impact (the bursts) cannot be observed",
56719,noun,"a fireplace in which a relatively small fire is burning; ""they sat by the fire and talked""",
56720,noun,"a fire for cooking",
56721,noun,"a severe trial; ""he went through fire and damnation""",
56722,noun,"preparation for the delivery of shellfire on a target",
56723,noun,"any of various large trucks that carry firemen and equipment to the site of a fire",
56724,noun,"a fire engine carrying ladders",
56725,noun,"a stairway (often on the outside of a building) that permits exit in the case of fire or other emergency",
56726,noun,"an opal with flaming orange and yellow and red colors",
56727,noun,"a translucent mineral consisting of hydrated silica of variable color; some varieties are used as gemstones",
56728,noun,"a sale of assets at very low prices typically when the seller faces bankruptcy",
56729,noun,"a sale of merchandise supposedly damaged by fire",
56730,noun,"a portable gun; ""he wore his firearm in a shoulder holster""",
56731,noun,"a firearm that reloads itself",
56732,noun,"a firearm that can fire several rounds without reloading",
56733,noun,"a firearm designed to disperse rioters rather than to inflict serious injury or death",
56734,noun,"firearm that is a double-barreled smoothbore shoulder weapon for firing shot at short ranges",
56735,noun,"a firearm that has no rifling",
56736,noun,"a .22 caliber firearm (pistol or rifle)",
56737,noun,"striker that ignites the charge by striking the primer",
56738,noun,"a mechanism that detonates the charge of a gun",
56739,noun,"an especially luminous meteor (sometimes exploding)",
56740,noun,"a streak of light in the sky at night that results when a meteoroid hits the earth's atmosphere and air friction causes the meteoroid to melt or vaporize or explode",
56741,noun,"an energetic person with unusual initiative",
56742,noun,"the explosion of an atomic bomb",
56743,noun,"the male is bright red with black wings and tail",
56744,noun,"a genus of Thraupidae",
56745,noun,"any of numerous New World woodland birds having brightly colored males",
56746,noun,"eastern subspecies of northern oriole",
56747,noun,"a kind of New World oriole",
56748,noun,"tropical American flycatcher found as far north as southern Texas and Arizona; adult male has bright scarlet and black plumage",
56749,noun,"a genus of Tyrannidae",
56750,noun,"large American birds that characteristically catch insects on the wing",
56751,noun,"a furnace (as on a steam locomotive) in which fuel is burned",
56752,noun,"lining consisting of material with a high melting point; used to line the inside walls of a furnace",
56753,noun,"a mixture of gases (mostly methane) that form in coal mines and become explosive when mixed with air",
56754,noun,"the department of local government responsible for preventing and extinguishing fires",
56755,noun,"the head of a fire department",
56756,noun,"tropical click beetles",
56757,noun,fireflies,
56758,noun,"the luminous larva or wingless grub-like female of a firefly",
56759,noun,"a metal screen before an open fire for protection (especially against flying sparks)",
56760,noun,"protective covering consisting of a metallic netting mounted in a frame and covering windows or doors (especially for protection against insects)",
56761,noun,"the light of a fire (especially in a fireplace)",
56762,noun,"a muzzle loader that had a flintlock type of gunlock",
56763,noun,"an obsolete gunlock that has flint embedded in the hammer; the flint makes a spark that ignites the charge",
56764,noun,"play in which children pretend to put out a fire",
56765,noun,"a laborer who tends fires (as on a coal-fired train or steamship)",
56766,noun,"a pitcher who does not start the game",
56767,noun,"metal fireside implements",
56768,noun,"a stone that forms a hearth",
56769,noun,"water heater consisting of a tank or pipes set at the back of a fireplace or in the firebox of a stove",
56770,noun,"an upright hydrant for drawing water to use in fighting a fire",
56771,noun,"a discharge pipe with a valve and spout at which water may be drawn from the mains of waterworks",
56772,adjective,"impervious to damage by fire",
56773,adjective,"not capable of igniting and burning",
56774,verb,"make resistant to fire",
56775,noun,"a piece of flint that is struck to light a fire",
56776,noun,"a hard kind of stone; a form of silica more opaque than chalcedony",
56777,noun,"a sandstone that withstands intense heat; used to line fireplaces and furnaces and kilns",
56778,noun,"a sedimentary rock consisting of sand consolidated with some cement (clay or quartz etc.)",
56779,noun,"tall North American perennial with creeping rootstocks and narrow leaves and spikes of pinkish-purple flowers occurring in great abundance in burned-over areas or recent clearings; an important honey plant",
56780,noun,"large widely distributed genus of herbs and subshrubs of especially western North America and Arctic areas",
56781,noun,"a plant of the genus Epilobium having pink or yellow flowers and seeds with silky hairs",
56782,noun,"an American weedy plant with small white or greenish flowers",
56783,noun,"coarse herbs with whitish discoid flower heads and silky pappus",
56784,noun,"firewood cut and stacked in cords; wood sold by the cord",
56785,noun,"a joint of pine wood used for fuel",
56786,noun,"a circular firework that spins round and round emitting colored fire",
56787,noun,"a firework that fizzes as it moves",
56788,noun,"an exploding firework used as a warning signal",
56789,noun,"a cylindrical firework that projects a series of colored balls of fire",
56790,noun,"a firework that moves in serpentine manner when ignited",
56791,noun,"sends a firework display high into the sky",
56792,noun,"a firework that burns slowly and throws out a shower of sparks",
56793,noun,"firework consisting of a tube filled with powder (as a broken firecracker) that burns with a fizzing noise",
56794,noun,"a small firework that consists of a percussion cap and some gravel wrapped in paper; explodes when thrown forcefully against a hard surface",
56795,noun,"the line from which soldiers deliver fire",
56796,noun,"a smallest army unit",
56797,noun,"a British unit of capacity equal to 9 imperial gallons",
56798,noun,"an obsolete British unit of capacity equal to 18 Imperial gallons",
56799,noun,"a small wooden keg",
56800,adjective,"marked by firm determination or resolution; not shakable; ""firm convictions""; ""a firm mouth""; ""steadfast resolve""; ""a man of unbendable perseverence""; ""unwavering loyalty""",
56801,adjective,"not soft or yielding to pressure; ""a firm mattress""; ""the snow was firm underfoot""; ""solid ground""",
56802,adjective,"strong and sure; ""a firm grasp""; ""gave a strong pull on the rope""",
56803,adjective,"not subject to revision or change; ""a firm contract""; ""a firm offer""",
56804,adjective,"(of especially a person's physical features) not shaking or trembling; ""his voice was firm and confident""; ""a firm step""",
56805,adjective,"not liable to fluctuate or especially to fall; ""stocks are still firm""",
56806,adjective,"securely established; ""an established reputation""; ""holds a firm position as the country's leading poet""",
56807,adjective,"possessing the tone and resiliency of healthy tissue; ""firm muscles""",
56808,verb,"become taut or tauter; ""Your muscles will firm when you exercise regularly""; ""the rope tautened""",
56809,noun,"a firm of accountants who provide accounting and auditing services for a fee",
56810,noun,"a firm of experts providing professional advice to an organization for a fee",
56811,noun,"a firm in the publishing business",
56812,noun,"a firm of lawyers",
56813,noun,"a firm that conducts auctions",
56814,noun,"the muscle tone of healthy tissue; ""his muscular firmness""",
56815,noun,"the trait of resolutely controlling your own behavior",
56816,noun,"freedom from wavering or indecision; constancy of resolve or conduct; ""He trusted her clear steadiness that she would do what she said""",
56817,noun,"resoluteness evidenced by strength of character; ""sturdiness of moral principle""",
56818,noun,"firm resoluteness in purpose or opinion or action; ""a charming host without any touch of stiffness or pomposity""",
56819,noun,"resolute adherence to your own ideas or desires",
56820,noun,"characterized by one unified purpose",
56821,noun,"resoluteness by virtue of being unyielding and inflexible",
56822,noun,"steadfast resolution",
56823,noun,"the property of being unyielding to the touch",
56824,noun,"the quality of being steady or securely and immovably fixed in place",
56825,noun,"something having the quality of granite (unyielding firmness); ""a man of granite""",
56826,noun,"the quality of being steady and unfailing; ""sureness of hand""",
56827,noun,"the quality or attribute of being firm and steadfast",
56828,adjective,"occurring at the beginning; ""took the initial step toward reconciliation""",
56829,adjective,"preceding all others in time or being as first made or performed; ""the original inhabitants of the Americas""; ""the book still has its original binding""; ""restored the house to its original condition""; ""the original performance of the opera""; ""the original cast""; ""retracted his original statement""",
56830,adjective,"preceding all others in time; ""the premiere showing""",
56831,adjective,"first in rank or degree; ""an architect of premier rank""; ""the prime minister""",
56832,adjective,"used of the first or originating agent; ""prime mover""",
56833,adjective,"indicating the beginning unit in a series",
56834,adjective,"serving to set in motion; ""the magazine's inaugural issue""; ""the initiative phase in the negotiations""; ""an initiatory step toward a treaty""; ""his first (or maiden) speech in Congress""; ""the liner's maiden voyage""",
56835,adjective,"highest in pitch or chief among parts or voices or instruments or orchestra sections; ""first soprano""; ""the first violin section""; ""played first horn""",
56836,adjective,"being the gear producing the lowest drive speed; ""use first gear on steep hills""",
56837,adjective,"of the transmission gear causing forward movement in a motor vehicle; ""in a forward gear""",
56838,noun,"the first or highest in an ordering or series; ""He wanted to be the first""",
56839,noun,"the first of two or the first mentioned of two; ""Tom and Dick were both heroes but only the former is remembered today""",
56840,noun,"the first element in a countable series; ""the first of the month""",
56841,noun,"the number designating place in an ordered sequence",
56842,noun,"the fielding position of the player on a baseball team who is stationed at first of the bases in the infield (counting counterclockwise from home plate)",
56843,noun,"a mechanism for transmitting motion for some specific purpose (as the steering gear of a vehicle)",
56844,noun,"inventory accounting in which the oldest items (those first acquired) are assumed to be the first sold",
56845,noun,"a commissioned officer in the army or air force or marines ranking above a 2nd lieutenant and below a captain",
56846,noun,"pronouns and verbs used to refer to the speaker or writer of the language in which they occur",
56847,noun,"a grammatical category of pronouns and verb forms; ""stop talking about yourself in the third person""",
56848,noun,"the first presentation of a bill in a legislature",
56849,noun,"the act of presenting a proposal",
56850,noun,"a sergeant in the army above the rank of staff sergeant and below master sergeant",
56851,noun,"any of several noncommissioned officer ranks in the army or air force or marines ranking above a corporal",
56852,noun,"the first sergeant of a company; duties formerly included the conveyance of orders",
56853,noun,"the highest quality gems",
56854,adjective,"received directly from a source; ""firsthand information""",
56855,noun,"English linguist who contributed to linguistic semantics and to prosodic phonology and who was noted for his insistence on studying both sound and meaning in context (1890-1960)",
56856,noun,"a specialist in linguistics",
56857,noun,"a firth on the southwestern coast of Scotland emptying into the North Channel",
56858,noun,"a large firth on the east coast of Scotland and the estuary of the Forth River; location of Edinburgh",
56859,noun,"an inlet of the North Sea on the northeast coast of Scotland",
56860,noun,"a large firth on the west coast of Britain between England and Scotland",
56861,verb,"fish with a seine; catch fish with a seine",
56862,verb,"fish for scallops",
56863,verb,"fish with a handline over the rails of a boat; ""They are railing for fresh fish""",
56864,verb,"haul fish aboard with brails",
56865,verb,"fish for shrimp",
56866,verb,"fish with nets",
56867,verb,"hunt shark",
56868,verb,"fish with trawlers",
56869,verb,"fish with the line and bait resting still or stationary in the water",
56870,verb,"fish for prawns",
56871,noun,"a large group of fish; ""a school of small glittering fish swam by""",
56872,noun,"a fish that lives and feeds on the bottom of a body of water",
56873,noun,"a fish that lurks on the bottom of a body of water",
56874,noun,"fishes in which the skeleton may be calcified but not ossified",
56875,noun,"any fish providing sport for the angler",
56876,noun,"any fish used for food by human beings",
56877,noun,"any fish useless for food or sport or even as bait",
56878,noun,"a fish that is young",
56879,noun,"any of various fishes that carry their eggs and their young in their mouths",
56880,noun,"a female fish at spawning time",
56881,noun,"a voracious freshwater fish that is native to northeastern China; can use fin to walk and can survive out of water for three days; a threat to American populations of fish",
56882,noun,"any fish of the class Osteichthyes",
56883,noun,"a small perch of India whose gills are modified to allow it to breathe air; has spiny pectoral fins that enable it to travel on land",
56884,noun,"scale of the kind that covers the bodies of fish",
56885,noun,"any of numerous small food fishes; especially those caught with hook and line and not available on the market",
56886,noun,"fish cured by being split and air-dried without salt",
56887,noun,"highly valued lean flesh of marine or freshwater mullet",
56888,noun,"flesh of young Atlantic cod weighing up to 2 pounds; also young haddock and pollock; often broiled",
56889,noun,"lean white flesh of fish similar to but smaller than cod; usually baked or poached or as fillets sauteed or fried",
56890,noun,"the lean flesh of a fish similar to cod",
56891,noun,"flesh of any of several primarily freshwater game and food fishes",
56892,noun,"flesh of any of various marine or freshwater fish of the family Salmonidae",
56893,noun,"bony flesh of herring-like fish usually caught during their migration to fresh water for spawning; especially of Atlantic coast",
56894,noun,"small cold-water silvery fish; migrate between salt and fresh water",
56895,noun,"the twelfth sign of the zodiac; the sun is in this sign from about February 19 to March 20",
56896,noun,"usually made of flaked salt cod and mashed potatoes",
56897,noun,"a fisherman who use a trawl net",
56898,noun,"large dark brown North American arboreal carnivorous mammal",
56899,noun,"agile slender-bodied arboreal mustelids somewhat larger than weasels",
56900,noun,"a knot for tying a line to a spar or ring",
56901,noun,"a workplace where fish are caught and processed and sold",
56902,noun,"a fishery where they fish for pearl oysters",
56903,noun,"a sharp barbed hook for catching fish",
56904,noun,"metal plate bolted along sides of two rails or beams",
56905,adjective,"capable of undergoing nuclear fission; ""a fissionable nucleous""; ""fissionable material""",
56906,noun,"a nuclear reaction in which a massive nucleus splits into smaller nuclei with the simultaneous release of energy",
56907,noun,"asexual reproduction by multiple fission; characteristic of many sporozoan protozoans",
56908,noun,"a hand with the fingers clenched in the palm (as for hitting)",
56909,noun,"a chronic inflammation of the withers of a horse",
56910,noun,"an abnormal passage leading from a suppurating cavity to the body surface",
56911,adjective,"hollow and tube-shaped like  a reed",
56912,adjective,"(usually followed by `to' or `for') on the point of or strongly disposed; ""in no fit state to continue""; ""fit to drop""; ""laughing fit to burst""; ""she was fit to scream""; ""primed for a fight""; ""we are set to go at any time""",
56913,adjective,"completely prepared or in condition for immediate action or use or progress; ""get ready""; ""she is ready to resign""; ""the bridge is ready to collapse""; ""I am ready to work""; ""ready for action""; ""ready for use""; ""the soup will be ready in a minute""; ""ready to learn to read""",
56914,adjective,"physically fit; ""exercised daily to keep herself in condition""",
56915,verb,"fit together exactly, of identical shapes; ""triangles tesselate""",
56916,verb,"fit as if by joints; ""The boards fit neatly""",
56917,verb,"be what is needed or be good enough for what is required; ""Does this restaurant fit the bill for the celebration?""",
56918,noun,"the way a garment hangs; ""he adjusted the hang of his coat""",
56919,adjective,"occurring in spells and often abruptly; ""fitful bursts of energy""; ""spasmodic rifle fire""",
56920,noun,"any of the items furnishing or equipping a room (especially built-in furniture); ""she liked the kitchen fitments""",
56921,noun,"someone who fits a garment to a particular person",
56922,noun,"a person whose occupation is making and altering garments",
56923,adjective,"in harmony with the spirit of particular persons or occasion; ""We have come to dedicate a portion of that field...It is altogether fitting and proper that we should do this""",
56924,adjective,"being precisely fitting and right; ""it is only meet that she should be seated first""",
56925,noun,"the fitting (pipes or valves or meters) that convey gas from the gas main to the gas fixtures of a building",
56926,noun,"fitting consisting of threaded pieces of pipe for joining pipes together",
56927,noun,"an electrical (or electronic) fitting that is connected to a source of power and equipped to receive an insert",
56928,noun,"putting clothes on to see whether they fit",
56929,noun,"a position on a basketball team",
56930,noun,"a position on a basketball team",
56931,adjective,"having five units or components",
56932,noun,"five dollars worth of a drug; ""a nickel bag of drugs""; ""a nickel deck of heroin""",
56933,verb,"take vengeance on or get even; ""We'll get them!""; ""That'll fix him good!""; ""This time I got him""",
56934,verb,"make a compensation for; ""a favor that cannot be paid back""",
56935,verb,"kill, preserve, and harden (tissue) in order to prepare for microscopic study",
56936,verb,"prepare for social life; ""Children have to be socialized in school""",
56937,verb,"take measures in preparation for; ""provide for the proper care of the passengers on the cruise ship""",
56938,verb,"put into the required condition beforehand",
56939,verb,"fix onto a backing, setting, or support; ""mount slides for macroscopic analysis""",
56940,verb,"get ready for a particular purpose or event; ""set up an experiment""; ""set the table""; ""lay out the tools for the surgery""",
56941,verb,"prepare for winter; ""winterize cars""; ""winterize your houses""",
56942,verb,"prepare for summer; ""summerize your car""; ""summerize a house""",
56943,verb,"insert a primer into (a gun, mine, or charge) preparatory to detonation or firing; ""prime a cannon""; ""prime a mine""",
56944,noun,"an injection into a vein",
56945,noun,"the act of mending a hole in a garment with crossing threads",
56946,noun,"the act of mending a hole in a garment by sewing a patch over it",
56947,noun,"hurried repair",
56948,noun,"the act of restoring something or someone to a satisfactory state",
56949,noun,"the activity of constructing something again",
56950,noun,"the act of restoring something to its original state",
56951,noun,"determining the location of something by measuring the time it takes for an echo to return from it",
56952,verb,"become fixed (on); ""Her eyes fixated on a point on the horizon""",
56953,verb,"stop moving or become immobilized; ""When he saw the police car he froze""",
56954,noun,"an unhealthy and compulsive preoccupation with something or someone",
56955,noun,"an idea that preoccupies the mind and holds the attention",
56956,noun,"(histology) the preservation and hardening of a tissue sample to retain as nearly as possible the same relations they had in the living body",
56957,noun,"the branch of biology that studies the microscopic structure of animal or plant tissues",
56958,noun,"a compound (such as ethanol or formaldehyde) that fixes tissues and cells for microscopic study",
56959,noun,"a varnish dissolved in alcohol and sprayed over pictures to prevent smudging",
56960,noun,"paint that provides a hard glossy transparent coating",
56961,adjective,"fixed and unmoving; ""with eyes set in a fixed glassy stare""; ""his bearded face already has a set hollow look""- Connor Cruise O'Brien; ""a face rigid with pain""",
56962,adjective,"not in motion",
56963,adjective,"not likely to fail or give way; ""the lock was secure""; ""a secure foundation""; ""a secure hold on her wrist""",
56964,adjective,"of or having a geosynchronous orbit such that the position in such an orbit is fixed with respect to the earth; ""a geostationary satellite""",
56965,adjective,"of or having an orbit with a fixed period of 24 hours (although the position in the orbit may not be fixed with respect to the earth)",
