ID,POS,Gloss
56094,noun,"bright blue-green fern widely distributed especially in damp acid woodlands of temperate northern hemisphere",
56095,noun,"yellow-green fern of rocky areas of northern hemisphere",
56096,noun,"tall fern of northern temperate regions having graceful arched fronds and sporophylls resembling ostrich plumes",
56097,noun,"tropical American terrestrial fern with leathery lanceolate fronds; sometimes placed in genus Polybotrya",
56098,noun,"beautiful spreading fern of eastern North America and eastern Asia naturalized in western Europe; pinnately divided fronds show a slight tendency to fold when touched; pinnules enclose groups of sori in beadlike lobes",
56099,noun,"North American evergreen fern having pinnate leaves and dense clusters of lance-shaped fronds",
56100,noun,"any of various ferns of the genus Polystichum having fronds with texture and gloss like holly",
56101,noun,"widely distributed fern of tropical southern hemisphere having leathery pinnatifid fronds",
56102,noun,"Jamaican fern having round buttonlike bulbils",
56103,noun,"fern of tropical Asia having round buttonlike bulbils",
56104,noun,"any fern of the genus Woodsia",
56105,noun,"tropical fern having leathery fronds resembling oleander; found from Asia to Polynesia",
56106,noun,"any of several tropical ferns having more or less sword-shaped fronds including one from which the Boston fern developed",
56107,noun,"any of various small to large terrestrial ferns of the genus Adiantum having delicate palmately branched fronds",
56108,noun,"small short-lived fern of Central and South America",
56109,noun,"any of various terrestrial ferns of the genus Cheilanthes; cosmopolitan in arid and semiarid temperate or tropical regions",
56110,noun,"small tufted fern of northwestern America",
56111,noun,"fast-growing sturdy Japanese fern; cultivated for their attractive broad dark-green pinnate fronds",
56112,noun,"dwarf deciduous lithophytic ferns",
56113,noun,"tropical American fern with coarsely lobed to palmatifid fronds",
56114,noun,"any of several small lithophytic ferns of tropical and warm temperate regions",
56115,noun,"fern of New Zealand and Australia having trailing fronds with dark green buttonlike leaflets",
56116,noun,"fern of southern tropical Africa having fronds with white undersides",
56117,noun,"tropical American fern having fronds with white undersides",
56118,noun,"tropical American fern having fronds with light golden undersides",
56119,noun,"fern of West Indies and South America having fronds with bright golden-yellow undersides",
56120,noun,"cultivated in many varieties as houseplants",
56121,noun,"Asiatic fern introduced in America",
56122,noun,"fern of North Africa and Azores and Canary Islands",
56123,noun,"large Australasian evergreen fern with an edible rhizome sometimes used as a vegetable by indigenous people",
56124,noun,"fern having pinnatifid fronds and growing in wet places; cosmopolitan in north temperate regions",
56125,noun,"any of several tropical ferns of the genus Christella having thin brittle fronds",
56126,noun,"common European mountain fern having fragrant lemon or balsam scented fronds",
56127,noun,"slender shield fern of moist woods of eastern North America; sometimes placed in genus Dryopteris",
56128,noun,"delicate feathery shield fern of the eastern United States; sometimes placed in genus Thelypteris",
56129,noun,"any fern of the genus Phegopteris having deeply cut triangular fronds",
56130,noun,"the asexual spore of ferns that resembles dust; once thought to be seeds and to make the possessor invisible",
56131,adjective,"abounding in or covered with ferns; ""the ferny undergrowth""",
56132,adjective,"abounding with bracken; ""the woods and braky glens""- William Browne",
56133,adjective,"resembling ferns especially in leaf shape; ""the ferny shadows of locust leaves""",
56134,adjective,"marked by extreme and violent energy; ""a ferocious beating""; ""fierce fighting""; ""a furious battle""",
56135,noun,"the property of being wild or turbulent; ""the storm's violence""",
56136,noun,"the property of being untamed and ferocious; ""the coastline is littered with testaments to the savageness of the waters""; ""a craving for barbaric splendor, for savagery and color and the throb of drums""",
56137,verb,"hound or harry relentlessly",
56138,verb,"hunt with ferrets",
56139,noun,"musteline mammal of prairie regions of United States; nearly extinct",
56140,noun,"type genus of the family Mustelidae: minks and weasels",
56141,noun,"domesticated albino variety of the European polecat bred for hunting rats and rabbits",
56142,noun,"dark brown mustelid of woodlands of Eurasia that gives off an unpleasant odor when threatened",
56143,noun,"rotating mechanism consisting of a large upright wheel with suspended seats that remain upright as the wheel turns; provides a ride at an amusement park",
56144,noun,"a solid solution in which alpha iron is the solvent",
56145,noun,"a magnetic allotrope of iron; stable below 906 degrees centigrade",
56146,noun,"salt of ferrocyanic acid usually obtained by a reaction of a cyanide with iron sulphate",
56147,noun,"a cyanide compound that is prepared by the reaction of potassium cyanide with ferrous salts; commonly used by gardeners",
56148,verb,"transport by ferry",
56149,verb,"travel by ferry",
56150,noun,"a ferry that transports motor vehicles",
56151,noun,"transport by boat or aircraft",
56152,adjective,"capable of conceiving",
56153,adjective,"capable of being fertilized",
56154,adjective,"very fertile; producing profuse growth; ""rank earth""",
56155,adjective,"bearing in abundance especially offspring; ""flying foxes are extremely prolific""; ""a prolific pear tree""",
56156,noun,"a fertilizer that is derived from animal or vegetable matter",
56157,noun,"(NaNO3) used especially as a fertilizer and explosive",
56158,noun,"(KNO3) used especially as a fertilizer and explosive",
56159,noun,"used as an explosive and fertilizer and rocket propellant",
56160,noun,"a switch (a stick or cane or flat paddle) used to punish children",
56161,adjective,"extremely hot; ""the fervent heat...merely communicated a genial warmth to their half-torpid systems""- Nathaniel Hawthorne; ""set out...when the fervid heat subsides""- Frances Trollope",
56162,noun,"grass with wide flat leaves cultivated in Europe and America for permanent pasture and hay and for lawns",
56163,noun,"a genus of tufted perennial grasses of the family Gramineae",
56164,noun,"(heraldry) an ordinary consisting of a broad horizontal band across a shield",
56165,adjective,"offering fun and gaiety; ""a festive (or festal) occasion""; ""gay and exciting night life""; ""a merry evening""",
56166,noun,"a sore that has become inflamed and formed pus",
56167,noun,"a day or period of time set aside for feasting and celebration",
56168,noun,"a festival having religious significance",
56169,noun,"any of several annual Welsh festivals involving artistic competitions (especially in singing)",
56170,noun,"a cinematic festival that features films (usually films produced during the past year)",
56171,noun,"a festival that features performances by jazz artists",
56172,noun,"a festival featuring African-American culture; celebrated between Christmas and New Year",
56173,noun,"an autumn festival that involves merrymaking and drinking beer",
56174,noun,"an orgiastic festival in ancient Rome in honor of Saturn",
56175,noun,"a festival held at the time sheep are normally sheared",
56176,noun,"flower chains suspended in loops between points",
56177,noun,"flowers strung together in a chain",
56178,noun,"the act of destroying a fetus",
56179,adjective,"offensively malodorous; ""a foul odor""; ""the kitchen smelled really funky""",
56180,noun,"sexual arousal or gratification resulting from handling a fetish (or a specific part of the body other than the sexual organs)",
56181,noun,"the hoof of a horse",
56182,noun,"a distinctive odor that is offensively unpleasant",
56183,verb,"remove mold marks or sand from (a casting)",
56184,noun,"a state of fitness and good health; ""in fine fettle""",
56185,noun,"(medicine) a grossly malformed and usually nonviable fetus",
56186,noun,"a human fetus whose weight is less than 0.5 kilogram when removed or expelled from the mother's body",
56187,noun,"the social system that developed in Europe in the 8th century; vassals were protected by lords who they had to serve in war",
56188,noun,"the people in a society considered as a system organized by a characteristic pattern of relationships; ""the social organization of England and America is very different""; ""sociologists have studied the changing structure of the family""",
56189,noun,"a rise in the temperature of the body; frequently a symptom of infection",
56190,noun,"extremely high fever (especially in children)",
56191,noun,"greed and the contagious excitement of a gold rush",
56192,noun,"bushy aromatic European perennial herb having clusters of buttonlike white-rayed flower heads; valued traditionally for medicinal uses; sometimes placed in genus Chrysanthemum",
56193,adjective,"having or affected by a fever",
56194,adjective,"a quantifier that can be used with count nouns and is often preceded by `a'; a small but indefinite number; ""a few weeks ago""; ""a few more wagons than usual""; ""an invalid's pleasures are few and far between""; ""few roses were still blooming""; ""few women have led troops in battle""",
56195,noun,"a large number",
56196,adjective,"more than one but indefinitely small in number; ""a few roses""; ""a couple of roses""",
56197,adjective,"very few; ""hardly a man is now alive who remembers that famous date and year""",
56198,noun,"an indefinite but relatively small number; ""they bought a case of beer and drank a few""",
56199,adjective,"slightly insane",
56200,noun,"a kingdom (constitutional monarchy) in northwestern Africa with a largely Muslim population; achieved independence from France in 1956",
56201,verb,"tell a relatively insignificant lie; ""Fibbing is not acceptable, even if you don't call it lying""",
56202,verb,"tell an untruth; pretend with intent to deceive; ""Don't lie to your parents""; ""She lied when she told me she was only 29""",
56203,noun,"a trivial lie; ""he told a fib about eating his spinach""; ""how can I stop my child from telling stories?""",
56204,noun,"an interesting but highly implausible story; often told as an excuse",
56205,noun,"a very thin fiber made of glass that functions as a waveguide for light; used in bundles to transmit images",
56206,noun,"the dried fibrous part of the fruit of a plant of the genus Luffa; used as a washing sponge or strainer",
56207,noun,"hard fiber used in making coarse twine; from Philippine agave plants",
56208,noun,"coarse leaf fiber from palmyra palms used in making brushes and brooms",
56209,noun,"fiber of a raffia palm used as light cordage and in making hats and baskets",
56210,noun,"fine ravellings of cotton or linen fibers",
56211,noun,"created from natural materials or by chemical processes",
56212,noun,"loose hemp or jute fiber obtained by unravelling old ropes; when impregnated with tar it was used to caulk seams and pack joints in wooden ships",
56213,noun,"a bit of fiber that has become separated from woven fabric",
56214,noun,"wallboard composed of wood chips or shavings bonded together with resin and compressed into rigid sheets",
56215,noun,"a type of fiberboard",
56216,noun,"a covering material made of glass fibers in resins",
56217,noun,"a material used by builders to cover surfaces",
56218,noun,"a number in the Fibonacci sequence",
56219,noun,"one of many contractile filaments that make up a striated muscle fiber",
56220,noun,"any of various slender filaments that function as roots in mosses and ferns and fungi etc",
56221,noun,"any of the threadlike filaments forming the mycelium of a fungus",
56222,noun,"a sterile simple or branched filament or hair borne among sporangia; may be pointed or clubbed",
56223,noun,"muscular twitching involving individual muscle fibers acting without coordination",
56224,noun,"fibrillation of the muscles of the atria of the heart",
56225,noun,"fibrillation of heart muscles resulting in interference with rhythmic contractions of the ventricles and possibly leading to cardiac arrest",
56226,noun,"act or process of forming fibrils",
56227,noun,"a white insoluble fibrous protein formed by the action of thrombin on fibrinogen when blood clots; it forms a network that traps red cells and platelets",
56228,noun,"benign tumor containing fibrous tissue (especially in the uterus)",
56229,noun,"nonmalignant tumor of connective tissue",
56230,noun,"development of excess fibrous connective tissue in an organ",
56231,noun,"chronic respiratory disease caused by inhaling metallic or mineral particles",
56232,noun,"the most common congenital disease; the child's lungs and intestines and pancreas become clogged with thick mucus; caused by defect in a single gene; there is no cure",
56233,noun,"fibrosis of the bone marrow",
56234,noun,"the outer and thinner of the two bones of the human leg between the knee and ankle",
56235,adjective,"marked by erratic changeableness in affections or attachments; ""fickle friends""; ""a flirt's volatile affections""",
56236,adjective,"susceptible to being led or directed; ""fictile masses of people ripe for propaganda""",
56237,noun,"a work of fiction describing an imaginary place where life is extremely bad because of deprivation or oppression or terror",
56238,noun,"a extended fictional work in prose; usually in the form of a story",
56239,noun,"a work of fiction describing a utopia",
56240,adjective,"formed or conceived by the imagination; ""a fabricated excuse for his absence""; ""a fancied wrong""; ""a fictional character""; ""used fictitious names""; ""a made-up story""",
56241,verb,"make into fiction; ""The writer fictionalized the lives of his parents in his latest novel""",
56242,verb,"avoid responsibilities and duties, e.g., by pretending to be ill",
56243,verb,"avoid responsibilities and work, be idle",
56244,verb,"play the violin or fiddle",
56245,verb,"play on a violin; ""Zuckerman fiddled that song very nicely""",
56246,verb,"play around with or alter or falsify, usually secretively or dishonestly; ""Someone tampered with the documents on my desk""; ""The reporter fiddle with the facts""",
56247,noun,"bowed stringed instrument that is the highest member of the violin family; this instrument has four strings and a hollow body and an unfretted fingerboard and is played with a bow",
56248,noun,"a violin made by Nicolo Amati or a member of his family",
56249,noun,"a violin made by a member of the Guarneri family",
56250,noun,"a violin made by Antonio Stradivari or a member of his family",
56251,noun,"a rest on which a violinist can place the chin",
56252,noun,"fiddler crabs",
56253,adjective,"not important; ""a relatively unimportant feature of the system""; ""the question seems unimportant""",
56254,verb,"move restlessly; ""The child is always fidgeting in his seat""",
56255,noun,"a restless desire for change and excitement",
56256,adjective,"unable to relax or be still; ""a constant fretful stamping of hooves""; ""itchy for excitement""; ""a restless child""",
56257,adjective,"used as a fixed standard of reference for comparison or measurement; ""a fiducial point""",
56258,adjective,"based on trust",
56259,noun,"(law) a person (usually appointed by a court of law) who liquidates assets or preserves them for the benefit of affected parties",
56260,noun,"a person (or institution) to whom legal title to property is entrusted to use for another's benefit",
56261,verb,"catch or pick up (balls) in baseball or cricket",
56262,verb,"touch, lift, or hold with the hands; ""Don't handle the merchandise""",
56263,noun,"a narrow field that has been cleared to check the spread of a prairie fire or forest fire",
56264,noun,"a field where grain is grown",
56265,noun,"a field of cultivated and mowed grass",
56266,noun,"an irrigated or flooded field where rice is grown",
56267,noun,"somewhere (away from a studio or office or library or laboratory) where practical work is done or data is collected; ""anthropologists do much of their work in the field""",
56268,noun,"the space around a radiating body within which its electromagnetic oscillations can exert force on another similar body not in contact with it",
56269,noun,"a field of force surrounding a charged particle",
56270,noun,"a field of force surrounding a body of finite mass",
56271,noun,"the lines of force surrounding a permanent magnet or a moving charged particle",
56272,noun,"a field that represents the energy lost from the radiator to space",
56273,noun,"the playing field on which football is played",
56274,noun,"a public place in ancient Greece or Rome devoted to the training of wrestlers and other athletes",
56275,noun,"(mathematics) a set of elements such that addition and multiplication are commutative and associative and multiplication is distributive over addition and there are two elements 0 and 1; ""the set of all rational numbers is a field""",
56276,noun,"a field of scalars",
56277,noun,"the entire land, sea, and air area that may become or is directly involved in war operations",
56278,noun,"all of the horses in a particular horse race",
56279,noun,"the sport of racing horses",
56280,noun,"all the competitors in a particular contest or sporting event",
56281,noun,"a region where there is natural gas underground",
56282,noun,"a region rich in petroleum deposits (especially one with producing oil wells)",
56283,noun,"the area that is visible (as through an optical instrument)",
56284,noun,"the areas that is visible through a microscope",
56285,noun,"the area that is open during surgery",
56286,noun,"a track and field competition between two or more teams",
56287,noun,"a competition that involves jumping as high as possible over a horizontal high bar",
56288,noun,"a competition that involves jumping over a high crossbar with the aid of a long pole",
56289,noun,"an athletic competition in which a heavy metal ball is hurled as far as possible",
56290,noun,"an athletic competition in which a heavy metal ball that is attached to a flexible wire is hurled as far as possible",
56291,noun,"an athletic competition in which a javelin is thrown as far as possible",
56292,noun,"a small refracting telescope",
56293,noun,"optical telescope that has a large convex lens that produces an image that is viewed through the eyepiece",
56294,noun,"a building for indoor sports",
56295,noun,"German field marshal and statesman; as president of the Weimar Republic he reluctantly appointed Hitler as chancellor in 1933 (1847-1934)",
56296,noun,"French field marshal who commanded the Allied armies in France during World War II (1852-1931)",
56297,noun,"British field marshal (1850-1916)",
56298,noun,"Russian field marshal who commanded the Russian opposition to Napoleon (1745-1813)",
56299,noun,"German field marshal noted for brilliant generalship in North Africa during World War II (1891-1944)",
56300,noun,"German field marshal in World War II who directed the conquest of Poland and led the Ardennes counteroffensive (1875-1953)",
56301,noun,"British field marshal in North Africa in World War II; he defeated the Italians before being defeated by the Germans (1883-1950)",
56302,noun,"the scene of a duel",
56303,noun,"seed of the field pea plant",
56304,noun,"variety of pea plant native to the Mediterranean region and North Africa and widely grown especially for forage",
56305,noun,"a leguminous plant of the genus Pisum with small white flowers and long green pods containing edible green seeds",
56306,noun,"coarse small-seeded pea often used as food when young and tender",
56307,noun,"seed of a pea plant used for food",
56308,noun,"a test of the performance of some new product under the conditions in which it will be used",
56309,noun,"a member of the baseball team that is in the field instead of at bat",
56310,noun,"a member of the cricket team that is fielding rather than batting",
56311,noun,"a fielder in cricket who is stationed in the outfield",
56312,noun,"medium-sized Eurasian thrush seen chiefly in winter",
56313,noun,"type genus of the Turdidae",
56314,adjective,"marked by extreme intensity of emotions or convictions; inclined to react violently; fervid; ""fierce loyalty""; ""in a tearing rage""; ""vehement dislike""; ""violent passions""",
56315,adjective,"like or suggestive of fire; ""the burning sand""; ""a fiery desert wind""; ""an igneous desert atmosphere""",
56316,adjective,"very intense; ""a fiery temper""; ""flaming passions""",
56317,noun,"a small high-pitched flute similar to a piccolo; has a shrill tone and is used chiefly to accompany drums in a marching band",
56318,noun,"a high-pitched woodwind instrument; a slender tube closed at one end with finger holes on one end and an opening near the closed end across which the breath is blown",
56319,noun,"the cardinal number that is the sum of fourteen and one",
56320,adjective,"coming next after the fourteenth and just before the sixteenth in position",
56321,noun,"position 15 in a countable series of things",
56322,adjective,"coming next after the fourth and just before the sixth in position",
56323,noun,"a quantity of liquor equal to one fifth of a United States gallon",
56324,noun,"position five in a countable series of things; ""he was fifth out of several hundred runners""",
56325,noun,"the musical interval between one note and another five notes away from it",
56326,noun,"the difference in pitch between two notes",
56327,noun,"a subversive group that supports the enemy and engages in espionage or sabotage; an enemy in your midst",
56328,noun,"a member of a clandestine subversive organization who tries to help a potential invader",
56329,adjective,"the ordinal number of fifty in counting order",
56330,noun,"position 50 in a countable series of things",
56331,noun,"the cardinal number that is the product of ten and five",
56332,noun,"a diagram or picture illustrating textual material; ""the area covered can be seen from Figure 2""",
56333,noun,"fleshy sweet pear-shaped yellowish or purple multiple fruit eaten fresh or preserved or dried",
56334,noun,"the fleshy multiple fruit of the fig consisting of an enlarged hollow receptacle containing numerous fruitlets",
56335,noun,"a Libyan terrorist group organized in 1995 and aligned with al-Qaeda; seeks to radicalize the Libyan government; attempted to assassinate Qaddafi",
56336,noun,"a leaf from a fig tree",
56337,noun,"any of several South African plants of the genus Mesembryanthemum cultivated for showy pink or white flowers",
56338,noun,"South African annual or biennial plants having flowers that open only in bright sunlight",
56339,noun,"Old World annual widely naturalized in warm regions having white flowers and fleshy foliage covered with hairs that resemble ice",
56340,verb,"behave awkwardly; have difficulties; ""She is floundering in college""",
56341,noun,"an aggressive willingness to compete; ""the team was full of fight""",
56342,noun,"a fast maneuverable fighter plane designed to intercept enemy aircraft",
56343,noun,"a fighter plane used for suicide missions by Japanese pilots in World War II",
56344,noun,"a fighter that is difficult to detect by radar; is built for precise targeting and uses laser-guided bombs",
56345,noun,"a contrived or fantastic idea; ""a figment of the imagination""",
56346,adjective,"consisting of or forming human or animal figures; ""a figural design""; ""the figurative art of the humanistic tradition""- Herbert Read",
56347,adjective,"expressing one thing in terms normally denoting another; ""a metaphorical expression""; ""metaphoric language""",
56348,adjective,"using the name of one thing for that of another with which it is closely associated; ""to say `he spent the evening reading Shakespeare' is metonymic because it substitutes the author himself for the author's works""",
56349,adjective,"characterized by romantic imagery; ""Turner's vision of the rainbow...was poetic""",
56350,adjective,"using the name of a part for that of the whole or the whole for the part; or the special for the general or the general for the special; or the material for the thing made of it; ""to use `hand' for `worker' or `ten sail' for `ten ships' or `steel' for `sword' is to use a synecdochic figure of speech""",
56351,adjective,"characterized by or of the nature of a trope or tropes; changed from its literal sense",
56352,noun,"representation of something (sometimes on a smaller scale)",
56353,noun,"figure on the bow of some sailing vessels",
56354,noun,"a small carved or molded figure",
56355,noun,"a small figure of a person operated from above with strings by a puppeteer",
56356,noun,"a figure of a person made of packed snow",
56357,noun,"a large hollow wooden figure of a horse (filled with Greek soldiers) left by the Greeks outside Troy during the Trojan War",
56358,noun,"a well-known or notable person; ""they studied all the great names in the history of France""; ""she is an important figure in modern music""",
56359,noun,"a figure formed by a set of straight lines or light rays meeting at a point",
56360,noun,"a three-dimensional shape",
56361,noun,"a superiority in numbers or amount; ""a preponderance of evidence against the defendant""",
56362,noun,"a number beyond counting",
56363,noun,"being or relating to the smaller in number of two parts; ""when the vote was taken they were in the minority""; ""he held a minority position""",
56364,noun,"the quality of being small in number",
56365,noun,"the quality of being round numbers; ""he gave us the results in round numbers, but their roundness didn't affect the point he was making""",
56366,noun,"conventional metaphoric name for something, used especially in Old English and Old Norse poetry",
