ID,POS,Gloss
68766,noun,"a tiny or scarcely detectable amount",
68767,noun,"the 9th letter of the Greek alphabet",
68768,noun,"an informal debt instrument; representing `I owe you'",
68769,noun,"a person of Iranian descent; ""many Farsi emigrated to India near Bombay""",
68770,noun,"king of Persia who sanctioned the practice of Judaism in Jerusalem (?-424 BC)",
68771,noun,"king of Persia who subdued numerous revolutions and made peace with Sparta (?-359 BC)",
68772,noun,"an ancient Iranian language",
68773,noun,"the language of Persia (Iran) in any of its ancient forms",
68774,noun,"an Iranian language spoken in Afghanistan",
68775,noun,"the Iranian language of the Tajik that is closely related to Farsi; spoken in Iran and Tajikistan",
68776,noun,"an Iranian language spoken in Turkey and Iran and Iraq and Syria and Russia",
68777,noun,"the Iranian language of the Zoroastrian literature of the 3rd to 10th centuries",
68778,noun,"an Iranian language spoken in Afghanistan and Pakistan; the official language of Afghanistan",
68779,noun,"a northeastern Iranian language spoken in Russia",
68780,noun,"the Iranian language spoken by the ancient Scythians",
68781,noun,"a general term used by foreign soldiers to refer to the Iraqi people; ""to American soldiers, the hajji are the alien people from whom the enemy emerges""",
68782,noun,"a feeling of resentful anger",
68783,adjective,"conducive to peace; ""irenic without being namby-pamby""; ""an irenic attitude toward former antagonists""",
68784,noun,"the visual property of something having a milky brightness and a play of colors from the surface",
68785,noun,"whiskey made in Ireland chiefly from barley",
68786,noun,"unlawfully distilled Irish whiskey",
68787,noun,"Irish Gaelic up to about 1100",
68788,noun,"Irish Gaelic from 1100 to 1500",
68789,noun,"medium-sized breed with a wiry brown coat; developed in Ireland",
68790,noun,"large breed of hound with a rough thick coat",
68791,adjective,"extremely robust; ""an iron constitution""",
68792,verb,"press and smooth with a heated iron; ""press your shirts""; ""she stood there ironing""",
68793,verb,"press with a mangle; ""mangle the sheets""",
68794,noun,"an allotrope of iron that is the same as alpha iron except that it is nonmagnetic; stable between 768 and 906 degrees centigrade",
68795,noun,"a nonmagnetic allotrope of iron that is the basis of austenite; stable between 906 and 1403 degrees centigrade",
68796,noun,"an allotrope of iron that is stable between 1403 degrees centigrade and the melting point (= 1532 degrees)",
68797,noun,"iron of high purity",
68798,noun,"iron having a low carbon content that is tough and malleable and so can be forged and welded",
68799,noun,"iron that is coated with zinc to protect it from rust",
68800,noun,"iron to be melted again and reworked",
68801,noun,"iron that has been cast or worked in structural shapes",
68802,noun,"an iron with a long shaft and a steep face; for hitting long low shots",
68803,noun,"middle-distance iron",
68804,noun,"iron with a lofted face for hitting high shots to the green",
68805,noun,"long iron with a nearly vertical face",
68806,noun,"an iron with considerable loft",
68807,noun,"the iron normally used on the putting green",
68808,noun,"an iron with a short shaft and pitched face; for hitting short high shots",
68809,noun,"a pressing iron that can emit steam",
68810,noun,"a small lightweight iron that can be carried while traveling",
68811,noun,"(classical mythology) the last and worst age of the world",
68812,noun,"an impenetrable barrier to communication or information especially as imposed by rigid censorship and secrecy; used by Winston Churchill in 1946 to describe the demarcation between democratic and communist countries",
68813,noun,"respirator that produces alternations in air pressure in a chamber surrounding a patient's chest to force air into and out of the lungs thus providing artificial respiration",
68814,noun,"a breathing device for administering long-term artificial respiration",
68815,adjective,"sheathed in iron plates for protection",
68816,noun,"a wooden warship of the 19th century that is plated with iron or steel armor",
68817,noun,"Roman satirist who denounced the vice and folly of Roman society during the reign of the emperor Domitian (60-140)",
68818,noun,"author of satirical attacks on medieval scholasticism (1494-1553)",
68819,noun,"an English satirist born in Ireland (1667-1745)",
68820,noun,"a store selling hardware; ""in England they call a hardware store and ironmongery""",
68821,noun,"handsome East Indian evergreen tree often planted as an ornamental for its fragrant white flowers that yield a perfume; source of very heavy hardwood used for railroad ties",
68822,noun,"genus of tropical Asiatic trees having large solitary flowers",
68823,noun,"exceptionally tough or hard wood of any of a number of ironwood trees",
68824,noun,"a small slow-growing deciduous tree of northern Iran having a low domed shape",
68825,noun,"one species: iron tree",
68826,noun,"medium-sized hop hornbeam of eastern North America",
68827,noun,"deciduous monoecious trees of Europe and Asia and America; sometimes placed in subfamily or family Carpinaceae",
68828,noun,"any of several trees resembling hornbeams with fruiting clusters resembling hops",
68829,noun,"work made of iron (gratings or rails or railings etc); ""the houses had much ornamental ironwork""",
68830,adjective,"not sarcastic",
68831,noun,"admission of your own ignorance and willingness to learn while exposing someone's inconsistencies by close questioning",
68832,noun,"the use of a word in a sense opposite to its normal sense (especially in irony)",
68833,verb,"cast rays of light upon",
68834,verb,"expose to radiation; ""irradiate food""",
68835,noun,"(physiology) the spread of sensory neural impulses in the cortex",
68836,noun,"(medicine) the treatment of disease (especially cancer) by exposure to a radioactive substance",
68837,noun,"the use of strong light to treat acne or hyperbilirubinemia of the newborn",
68838,noun,"the use of radium in radiation therapy",
68839,noun,"the therapeutic use of X rays",
68840,adjective,"not endowed with the capacity to reason; ""a reasonless brute""",
68841,adjective,"not based on reason; ""there is a great deal that is nonrational in modern culture""",
68842,adjective,"showing ignorance or the laws of nature and faith in magic or chance; ""finally realized that the horror he felt was superstitious in origin""",
68843,adjective,"real but not expressible as the quotient of two integers; ""irrational numbers""",
68844,noun,"a real number that cannot be expressed as a rational number",
68845,noun,"root of an algebraic equation with rational coefficients",
68846,adjective,"insusceptible of reform; ""vicious irreclaimable boys""; ""irredeemable sinners""",
68847,adjective,"incapable of being recovered or regained",
68848,adjective,"no longer known; irretrievable; ""a forgotten art""; ""a lost art""; ""lost civilizations""",
68849,adjective,"impossible to recover or recoup or overcome; ""an irretrievable loss""; ""irretrievable errors in judgment""",
68850,adjective,"incapable of being recovered or regained; ""his lost honor""",
68851,noun,"a region that is related ethnically or historically to one country but is controlled politically by another",
68852,adjective,"lacking systematic arrangement or method or organization; ""unsystematic and fragmentary records""; ""he works in an unsystematic manner""",
68853,adjective,"set up or distributed in a deliberately random way",
68854,adjective,"not occurring at expected times",
68855,adjective,"(used of the military) not belonging to or engaged in by regular army forces; ""irregular troops""; ""irregular warfare""",
68856,adjective,"devoted to a cause or party",
68857,adjective,"lacking continuity or regularity; ""an irregular worker""; ""employed on a temporary basis""",
68858,adjective,"involving less than the standard or customary time for an activity; ""part-time employees""; ""a part-time job""",
68859,adjective,"of a surface; not level or flat; ""walking was difficult on the irregular cobblestoned surface""",
68860,adjective,"independent in behavior or thought; ""she led a somewhat irregular private life""; ""maverick politicians""",
68861,noun,"merchandise that has imperfections; usually sold at a reduced price without the brand name",
68862,noun,"the quality of being inhomogeneous",
68863,noun,"the quality of being spasmodic and irregular",
68864,noun,"the quality of lacking any predictable order or plan",
68865,noun,"the quality of being uneven and lacking uniformity",
68866,noun,"the lack of a relation of something to the matter at hand",
68867,noun,"the lack of a connection between things",
68868,noun,"irrelevance by virtue of being inapplicable to the matter at hand",
68869,noun,"complete irrelevance requiring no further consideration",
68870,adjective,"of no legal significance (as having been previously decided)",
68871,adjective,"no longer active or practicing; ""a lapsed Catholic""",
68872,adjective,"failing or refusing to observe religious customs",
68873,adjective,"incapable of being removed or away or dismiss; ""irremovable boulders""; ""irremovable obstacles""",
68874,adjective,"appointed for life and not subject to dismissal except for a grave crime; ""an irremovable officer""; ""a tenured professor""",
68875,adjective,"impossible to replace; ""irreplaceable antiques""",
68876,adjective,"impossible to repress or control; ""an irrepressible chatterbox""; ""uncontrollable laughter""",
68877,noun,"the quality of being overpowering and impossible to resist",
68878,adjective,"impossible to resist; overpowering; ""irresistible (or resistless) impulses""; ""what happens when an irresistible force meets an immovable object?""",
68879,adjective,"so strong as to be irresistible; ""an overpowering need for solitude""; ""the temptation to despair may become overwhelming""; ""an overwhelming majority""",
68880,adjective,"lacking in resolution; ""the accident left others discouraged about going there""",
68881,adjective,"disposed to psychological variability; ""his rather unstable religious convictions""",
68882,adjective,"uncertain in purpose or action",
68883,adjective,"lacking will power or resolution; ""the role of the dissenter is not for the weak-kneed""",
68884,noun,"the trait of being unpredictably irresolute; ""the volatility of the market drove many investors away""",
68885,noun,"the trait of not deserving trust or confidence",
68886,adjective,"characterized by inability or unwillingness to work toward a goal or assume responsibility; ""a do-nothing government""",
68887,adjective,"irresponsible in the use of firearms",
68888,adjective,"free from control or responsibility",
68889,adjective,"lacking a sense of responsibility",
68890,noun,"an attitude of irreverence or contempt for a divinity",
68891,adjective,"incapable of being retracted or revoked; ""firm and irrevocable is my doom""- Shakespeare",
68892,adjective,"determined irrevocably; ""his fate is sealed""",
68893,verb,"supply with a constant flow or sprinkling of some liquid, for the purpose of cooling, cleansing, or disinfecting; ""irrigate the wound""",
68894,noun,"supplying dry land with water by means of ditches etc",
68895,noun,"washing out a hollow organ (especially the stomach) by flushing with water",
68896,noun,"a disposition to exhibit uncontrolled anger; ""his temper was well known to all his employees""",
68897,noun,"the quality of being given to complaining",
68898,adjective,"abnormally sensitive to a stimulus",
68899,verb,"scrape or rub as if to relieve itching; ""Don't scratch your insect bites!""",
68900,verb,"irritate as if by a nip, pinch, or tear; ""smooth surfaces can vellicate the teeth""; ""the pain is as if sharp points pinch your back""",
68901,noun,"the state of being sensitive (as to an antigen)",
68902,noun,"unfriendly behavior that causes anger or resentment",
68903,noun,"the final irritation that stretches you patience beyond the limit",
68904,noun,"aggravation by deriding or mocking or criticizing",
68905,noun,"a sudden sharp increase in the relative numbers of a population",
68906,noun,"(Old Testament) the second patriarch; son of Abraham and Sarah who was offered by Abraham as a sacrifice to God; father of Jacob and Esau",
68907,noun,"(Old Testament) the first of the major Hebrew prophets (8th century BC)",
68908,noun,"brief episode in which the brain gets insufficient blood supply; symptoms depend on the site of the blockage",
68909,noun,"(Old Testament) the son of Abraham who was cast out after the birth of Isaac; considered the forebear of 12 Arabian tribes",
68910,noun,"a pariah who is avoided by others",
68911,noun,"belongs to lowest social and ritual class in India",
68912,noun,"any of various minerals consisting of hydrous silicates of aluminum or potassium etc. that crystallize in forms that allow perfect cleavage into very thin leaves; used as dielectrics because of their resistance to electricity",
68913,noun,"dark brown to black mica found in igneous and metamorphic rock",
68914,noun,"a mineral of the mica group; an important source of lithium",
68915,noun,"a colorless or pale brown mica with potassium",
68916,noun,"a colorless or pale brown mica with sodium",
68917,noun,"a brown form of mica consisting of hydrous silicate of potassium and magnesium and aluminum",
68918,noun,"a mica containing iron and lithium",
68919,noun,"Egyptian goddess of fertility; daughter of Geb; sister and wife of Osiris",
68920,noun,"one of the two main branches of orthodox Islam; mainly in Iran",
68921,noun,"one of the two main branches of orthodox Islam",
68922,noun,"an orthodox Muslim",
68923,noun,"(Islam) a legal opinion or ruling issued by an Islamic scholar; ""bin Laden issued three fatwahs calling upon Muslims to take up arms against the United States""",
68924,noun,"a Shiite tradition of temporary marriage permitted in Iran that allows a couple to specify the terms of their relationship; can last from a few minutes to 99 years; ""sigeh legally wraps premarital sex in an Islamic cloak""",
68925,noun,"belief in a single God",
68926,noun,"belief in the appearance of the Mahdi; devotion to a Mahdi",
68927,noun,"a militant group of extremist Sunnis who believe themselves the only correct interpreters of the Koran and consider moderate Muslims to be infidels; seek to convert all Muslims and to insure that its own fundamentalist version of Islam will dominate the world",
68928,noun,"the branch of Islam that regards Ali as the legitimate successor to Mohammed and rejects the first three caliphs",
68929,noun,"a conservative and intolerant form of Islam that is practiced in Saudi Arabia; ""Osama bin Laden and his followers practice Wahhabism""",
68930,noun,"(Islam) the way of life prescribed as normative for Muslims on the basis of the teachings and practices of Muhammad and interpretations of the Koran",
68931,noun,"(Islam) a black stone building in Mecca that is shaped like a cube and that is the most sacred Muslim pilgrim shrine; believed to have been given by Gabriel to Abraham; Muslims turn in its direction when praying",
68932,noun,"(Islam) a Muslim place of worship",
68933,noun,"(Islam) a niche in the wall of a mosque that indicates the direction of Mecca",
68934,noun,"(Islam) a Muslim place of worship that usually has a minaret",
68935,noun,"(Islam) a form of Iranian musical pageant that is the theatrical expression of religious passion; based on the Battle of Kerbala and performed annually (in Farsi)",
68936,noun,"(Islam) meat from animals that have been slaughtered in the prescribed way according to the shariah",
68937,noun,"(Islam) a messianic leader who (according to popular Muslim belief) will appear before the end of the world and restore justice and religion",
68938,noun,"a fundamentalist Islamic revivalist movement generally characterized by moral conservatism and the literal interpretation of the Koran and the attempt to implement Islamic values in all aspects of life",
68939,noun,"a British colony in the West Indies",
68940,noun,"three small islands belonging to Ireland at the entrance to Galway Bay",
68941,noun,"a British colony in the Caribbean northwest of Jamaica; an international banking center",
68942,noun,"the largest of the islands comprising Antigua and Barbuda",
68943,noun,"an island in Antigua and Barbuda",
68944,noun,"an island in Antigua and Barbuda",
68945,noun,"an island belonging to Norway in the South Atlantic near the Antarctic Circle",
68946,noun,"a volcanic island in the Caribbean; in the West Indies",
68947,noun,"largest of the Cape Verde Islands in the Atlantic Ocean",
68948,noun,"an island in the Indian Ocean off the southeastern coast of India",
68949,noun,"an island in southeastern Asia 100 miles off the coast of mainland China in the South China Sea",
68950,noun,"a Mexican island in the Pacific west of Baja California",
68951,noun,"a group of islands in the Lesser Antilles just north of Venezuela that are administered by The Netherlands",
68952,noun,"a popular island resort in the Netherlands Antilles",
68953,noun,"a popular island resort in the Netherlands Antilles",
68954,noun,"a popular island resort in the Netherlands Antilles",
68955,noun,"a island in the Netherlands Antilles that is the top of an extinct volcano",
68956,noun,"an island in the Netherlands Antilles",
68957,noun,"an island in the western Leeward Islands; administered jointly by France and the Netherlands",
68958,noun,"the largest island in the West Indies",
68959,noun,"an island territory of France located in the eastern West Indies; tourism is the major industry",
68960,noun,"the smallest and easternmost of the Greater Antilles in the Caribbean",
68961,noun,"a small island off the coast of Puerto Rico with miles of beautiful beaches",
68962,noun,"a small island off the coast of Puerto Rico used for target practice by the United States Navy",
68963,noun,"an island in the West Indies south of Cuba and west of Haiti",
68964,noun,"a group of islands in northeastern West Indies (east of Puerto Rico) discovered by Christopher Columbus in 1493; owned by United States and Britain",
68965,noun,"easternmost of the West Indies about 300 miles north of Venezuela",
68966,noun,"island in West Indies",
68967,noun,"island in West Indies",
68968,noun,"an island in the eastern Mediterranean",
68969,noun,"a volcanic island in the Windward Islands that was once a stronghold of the Carib Indians",
68970,noun,"an island in the Gulf of Guinea that is part of Equatorial Guinea",
68971,noun,"islands in the Svalbard archipelago east of northern Greenland; belonging to Norway",
68972,noun,"a group of islands in the Pacific off South America; owned by Ecuador; known for unusual animal life",
68973,noun,"a group of more than 800 islands (100 inhabited) in the southwestern Pacific; larger islands (Viti Levu and Vanua Levu) are of volcanic origin surrounded by coral reefs; smaller islands are coral",
68974,noun,"a volcanic island in the Fijis",
68975,noun,"a volcanic island in the Fijis",
68976,noun,"a group of islands off the west coast of Sicily in the Mediterranean",
68977,noun,"an island (part of Campania) in the Bay of Naples in southern Italy; a tourist attraction noted for beautiful scenery",
68978,noun,"a volcanic island (part of Campania) in the Tyrrhenian Sea at the north end of the Bay of Naples",
68979,noun,"an island in the Mediterranean west of Italy",
68980,noun,"the largest island in the Mediterranean",
68981,noun,"an island off southwestern Canada (off the southwestern coast of British Columbia); the largest island off the west coast of North America",
68982,noun,"an island that forms the northeastern part of Nova Scotia",
68983,noun,"an island off the southeastern coast of Australia",
68984,noun,"an island territory of Australia in the Pacific Ocean off the eastern coast of Australia; formerly a British penal colony",
68985,noun,"the largest island in the Northern Marianas and the administrative center of the commonwealth of the Northern Mariana Islands in union with the United States",
68986,noun,"the largest and southernmost island in the Marianas which is administered as a territory of the United States; it was ceded by Spain to the United States in 1898",
68987,noun,"an island in the western Pacific between Guam and Hawaii",
68988,noun,"a small island in the central Pacific Ocean 2,800 miles southwest of Hawaii; in Micronesia west of the Gilbert Islands",
68989,noun,"3rd largest island in the world; in the western Pacific north of Java; largely covered by dense jungle and rain forest; part of the Malay Archipelago",
68990,noun,"the largest of the Solomon Islands; a province of Papua New Guinea",
68991,noun,"a mountainous island; the largest of the Solomon Islands in the independent state that is a member of the British Commonwealth",
68992,noun,"the largest island in the Bismarck Archipelago; part of Papua New Guinea",
68993,noun,"an island east of Australia and north of New Zealand",
68994,noun,"a Pacific island north of Australia; the 2nd largest island in the world; governed by Australia and Indonesia",
68995,noun,"an island in the Bismarck Archipelago; part of Papua New Guinea",
68996,noun,"an island in the Persian Gulf",
68997,noun,"one of the British Isles in the Irish Sea",
68998,noun,"an island of northwestern Scotland noted for its rugged mountain scenery",
68999,noun,"an island of western Scotland at the southern end of the Inner Hebrides",
69000,noun,"an island in western Scotland in the Inner Hebrides",
69001,noun,"an island in western Scotland in the Inner Hebrides west of Mull; site of Fingal's Cave",
69002,noun,"an island northwest of Wales",
69003,noun,"an island in Indonesia south of Borneo; one of the world's most densely populated regions",
69004,noun,"an island in Indonesia east of Java; striking volcanic scenery; culture is known for elaborate dances and rituals and for handicrafts",
69005,noun,"an island in Indonesia in the Malay Archipelago; the largest and most eastern of the Lesser Sunda Islands",
69006,noun,"a mountainous island in western Indonesia",
69007,noun,"a mountainous island in eastern Indonesia",
69008,noun,"a group of island in eastern Indonesia between Celebes and New Guinea; settled by the Portuguese but taken by the Dutch who made them the center for a spice monopoly, at which time they were known as Spice Islands",
69009,noun,"the second largest of the four main islands of Japan; north of Honshu",
69010,noun,"the central and largest of the four main islands of Japan; between the Sea of Japan and the Pacific Ocean; regarded as the Japanese mainland",
69011,noun,"the southernmost of the four main islands of Japan; contains coal fields",
69012,noun,"the smallest of the four main islands of Japan; south of Honshu and east of Kyushu; separated from Honshu by the Inland Sea; forested and mountainous",
69013,noun,"the largest island of the central Ryukyu Islands",
69014,noun,"the largest of the Volcano Islands of Japan",
69015,noun,"island in Paris on the Seine",
69016,noun,"an island in the Mediterranean; with adjacent islets it constitutes a region of France",
69017,noun,"an island in the eastern Caribbean in the Windward Islands; administered as an overseas region of France",
69018,noun,"an island in the Indian Ocean off the southeastern coast of Africa; the 4th largest island in the world",
69019,noun,"a group of about 1,200 small coral islands (about 220 inhabited) in the Indian ocean",
69020,noun,"a strategically located island south of Sicily in the Mediterranean Sea",
69021,noun,"an island in the southwestern Indian Ocean",
69022,noun,"North Island and South Island and adjacent small islands in the South Pacific",
69023,noun,"the smaller but more populous of two main islands of New Zealand; separated from South Island by Cook Strait",
69024,noun,"the larger but less populous of two main islands of New Zealand; separated from North Island by Cook Strait",
69025,noun,"one of the Visayan islands of the central Philippines; important for its fine harbor",
69026,noun,"the main island of the Philippines",
69027,noun,"the second largest island of the Philippines at the southern end of the archipelago; mountainous and volcanic",
69028,noun,"a mountainous island in the central Philippines",
69029,noun,"group of islands in the central Philippines",
69030,noun,"islands in the Atlantic Ocean belonging to Portugal; ""the Azores are strategically located on transatlantic air and shipping routes""",
69031,noun,"an island in the Atlantic Ocean off the coast of Africa; the largest of the Madeira Islands",
69032,noun,"the largest of the islands comprising Saint Christopher-Nevis",
69033,noun,"one of the islands of Saint Christopher-Nevis",
69034,noun,"one of the islands of Saint Christopher-Nevis",
69035,noun,"a volcanic island in the Windward Isles south of Martinique",
69036,noun,"an island in the center of the Windward Islands; the largest of the islands comprising Saint Vincent and the Grenadines",
69037,noun,"an island in the south Pacific; the most important island in French Polynesia; made famous by Robert Louis Stevenson and Paul Gauguin",
69038,noun,"an island in the Gulf of Guinea that is part of Sao Tome and Principe",
69039,noun,"a group of about 90 islands in the western Indian Ocean north of Madagascar",
69040,noun,"an island south of the Malay Peninsula",
69041,noun,"two islands in the Arctic Ocean belonging to Russia; site of a test center for nuclear warheads",
69042,noun,"the largest of the Balearic Islands",
69043,noun,"a group of mountainous islands in the Atlantic off the northwest coast of Africa forming Spanish provinces",
69044,noun,"an island in the Indian Ocean off the east coast of Africa; part of the United Republic of Tanzania",
69045,noun,"an Alaskan island in the Alexander Archipelago near Juneau",
