ID,POS,Gloss
82146,noun,"a viewpoint toward a city or other heavily populated area; ""the dominant character of the cityscape is it poverty""",
82147,noun,"the spatial property of the position from which something is observed",
82148,noun,"the point of view of a camera",
82149,adjective,"(of an arrow) tapered toward both ends",
82150,adjective,"pointed like bristles",
82151,adjective,"having five points",
82152,adjective,"(used of pens) having a writing point or nib especially of a certain kind; ""a broad-nibbed pen""",
82153,adjective,"resembling a pyramid",
82154,adjective,"having the point made sharp; ""a sharpened pencil""",
82155,adjective,"having six points",
82156,adjective,"having a long sharp point",
82157,adjective,"equipped with long sharp-pointed projections especially along the top of a wall or fence; ""the fence was iron and spiked along the top""",
82158,adjective,"resembling a spike",
82159,adjective,"gradually narrowed toward a point; ""a tall tapering spire""",
82160,noun,"a strong slender smooth-haired dog of Spanish origin having a white coat with brown or black patches; scents out and points game",
82161,noun,"liver or liver-and-white hunting dog developed in Germany; 3/4 pointer and 1/4 bloodhound",
82162,noun,"Hungarian hunting dog resembling the Weimaraner but having a rich deep red coat",
82163,noun,"a school of painters who used a technique of painting with tiny dots of pure colors that would blend in the viewer's eye; developed by Georges Seurat and his followers late in 19th century France",
82164,noun,"a cgs unit of dynamic viscosity equal to one dyne-second per square centimeter; the viscosity of a fluid in which a force of one dyne per square centimeter maintains a velocity of 1 centimeter per second",
82165,noun,"a unit of measurement for viscosity",
82166,noun,"a poisonous substance produced during the metabolism and growth of certain microorganisms and some higher plant and animal species",
82167,noun,"anything that harms or destroys; ""the poison of fascism""",
82168,noun,"the quality of causing destruction",
82169,noun,"a toxic war gas with sulfide based compounds that raises blisters and attacks the eyes and lungs; there is no known antidote",
82170,noun,"dermatitis resulting from contact with the poison ivy plant; ""my poison ivy is drying up""",
82171,noun,"contact dermatitis resulting from contact with plants of the genus Toxicodendron",
82172,noun,"climbing plant common in eastern and central United States with ternate leaves and greenish flowers followed by white berries; yields an irritating oil that causes a rash on contact",
82173,noun,"in some classifications: comprising those members of the genus Rhus having foliage that is poisonous to the touch; of North America and northern South America",
82174,noun,"dermatitis resulting from contact with a poison oak plant",
82175,noun,"dermatitis resulting from contact with a poison sumac plant",
82176,noun,"smooth American swamp shrub with pinnate leaves and greenish flowers followed by greenish white berries; yields an irritating oil",
82177,adjective,"having the qualities or effects of a poison",
82178,noun,"tall coarse perennial American herb having small white flowers followed by blackish-red berries on long drooping racemes; young fleshy stems are edible; berries and root are poisonous",
82179,noun,"a bag for food that a customer did not eat at a restaurant; the transparent pretense is that the food is taken home to feed the customer's dog",
82180,noun,"a sack for holding customer's groceries",
82181,noun,"a paper bag made of strong paper (often with handles); carries goods while shopping",
82182,noun,"fire iron consisting of a metal rod with a handle; used to stir a fire",
82183,noun,"poker in which the high and low hands split the pot",
82184,noun,"poker played for small stakes",
82185,noun,"poker in which each player gets 5 cards face down and bets are made without drawing any further cards",
82186,noun,"poker in which a player's losses are paid by removing an article of clothing",
82187,noun,"poker in which each player receives hole cards and the remainder are dealt face up; bets are placed after each card is dealt",
82188,adjective,"small and remote and insignificant; ""a jerkwater college""; ""passed a series of poky little one-horse towns""",
82189,noun,"a person of Polish descent",
82190,noun,"the capital and largest city of Poland; located in central Poland",
82191,noun,"a European river; flows into the Baltic Sea",
82192,adjective,"having a pair of equal and opposite charges",
82193,adjective,"located or found throughout a polar region",
82194,noun,"an optical device used to measure the rotation of the plane of vibration of polarized light",
82195,adjective,"having a positive electric charge; ""protons are positive""",
82196,noun,"the character of the positive electric pole",
82197,noun,"the phenomenon in which waves of light or other radiation are restricted in direction of vibration",
82198,noun,"a long pole used to propel or guide a barge; ""I wouldn't touch it with a barge pole""",
82199,noun,"a pole with metal points used as an aid in skiing",
82200,noun,"one of two stout poles with foot rests in the middle; used for walking high above the ground; ""he was so tall I thought he was on stilts""",
82201,noun,"one of two points of intersection of the Earth's axis and the celestial sphere",
82202,noun,"the celestial pole above the northern hemisphere; near Polaris",
82203,noun,"the celestial pole above the southern hemisphere",
82204,noun,"the southernmost point of the Earth's axis",
82205,noun,"the terminal of a battery that is connected to the negative plate",
82206,noun,"the terminal of a battery that is connected to the positive plate",
82207,noun,"a long fiberglass sports implement used for pole vaulting",
82208,noun,"the horse having a starting position next to the inside rail in a harness race",
82209,noun,"a battle ax used in the Middle Ages; a long handled ax and a pick",
82210,noun,"American musteline mammal typically ejecting an intensely malodorous fluid when startled; in some classifications put in a separate subfamily Mephitinae",
82211,noun,"large naked-muzzled skunk with white back and tail; of southwestern North America and Mexico",
82212,noun,"small skunk with a marbled black and white coat; of United States and Mexico",
82213,noun,"a station that serves as headquarters for police in a particular district; serves as a place from which policemen are dispatched and to which arrested persons are brought; ""in England they call a police station a police office""",
82214,noun,"a room in a police station where members of the force assemble for roll call and duty assignments",
82215,noun,"the policy of a political group; ""He won in a vote along party lines""",
82216,noun,"any policy that allows no exception; ""a zero-tolerance policy toward pedophile priests""",
82217,noun,"a policy for establishing and developing a national homeland for Jews in Palestine",
82218,noun,"a policy of promoting oneself at the expense of others; used especially of national policy; ""the United States has pursued a beggar-my-neighbor policy""",
82219,noun,"the policy of being moderate or acting with moderation",
82220,noun,"(Roman Catholic Church) the policy that the absolute authority of the church should be vested in the pope",
82221,verb,"polish with wax; ""The motorcycle has been Simonized""",
82222,verb,"make slick or smooth",
82223,noun,"the Slavic language of Poland",
82224,noun,"a parenthesis-free notation for forming mathematical expressions in which each operator precedes its operands",
82225,noun,"a notation for forming mathematical expressions that does not use parentheses to delimit components",
82226,adjective,"skillful in statecraft or management; ""an astute and sagacious statesman""",
82227,noun,"a social scientist specializing in the study of government",
82228,noun,"someone who bolted from the Republican Party during the U.S. presidential election of 1884",
82229,noun,"someone who has announced they are not a candidate; especially a politician who has announced that he or she is not a candidate for some political office",
82230,noun,"a member of a political party who follows strictly the party line",
82231,noun,"a member of the Republican Party",
82232,noun,"a political leader (especially of Tammany Hall)",
82233,noun,"an outstanding leader of a political movement",
82234,noun,"an advocate of technocracy",
82235,noun,"a member of the Whig Party that existed in the United States before the American Civil War",
82236,noun,"British politician (born in the United States) who was the first woman to sit in the British House of Commons (1879-1964)",
82237,noun,"United States politician and lawyer; vice president of the United States (1877-1956)",
82238,noun,"British newspaper publisher and politician (born in Canada); confidant of Winston Churchill (1879-1964)",
82239,noun,"United States politician who was elected the first Black may of Los Angeles (1917-1998)",
82240,noun,"Canadian politician who served as prime minister (1939-)",
82241,noun,"United States politician who as governor of New York supported the project to build the Erie Canal (1769-1828)",
82242,noun,"United States politician who proposed that individual territories be allowed to decide whether they would have slavery; he engaged in a famous series of debates with Abraham Lincoln (1813-1861)",
82243,noun,"United States civil rights leader who led a national campaign against racial discrimination and ran for presidential nomination (born in 1941)",
82244,noun,"French politician who proposed the Maginot Line (1877-1932)",
82245,noun,"United States politician who unscrupulously accused many citizens of being Communists (1908-1957)",
82246,noun,"reclusive Afghanistani politician and leader of the Taliban who imposed a strict interpretation of shariah law on Afghanistan (born in 1960)",
82247,noun,"leader in the women's suffrage movement in Montana; the first woman to serve in the United States House of Representatives (1880-1973)",
82248,noun,"a politician in Wyoming who was the first woman governor in the United States (1876-1977)",
82249,noun,"United States politician who as secretary of state in 1867 arranged for the purchase of Alaska from Russia (known at the time as Seward's Folly) (1801-1872)",
82250,noun,"United States politician and orator (1782-1817)",
82251,noun,"music performed for dancing the polka",
82252,noun,"a Bohemian dance with 3 steps and a hop in fast time",
82253,verb,"vote in an election at a polling station",
82254,noun,"a tree with limbs cut back to promote a more bushy growth of foliage",
82255,noun,"a usually horned animal that as either shed its horns or had them removed",
82256,noun,"the fine spores that contain male gametes and that are borne by an anther in a flowering plant",
82257,noun,"a coherent mass of pollen grains (as in orchids)",
82258,noun,"fertilization by transfer of pollen from the anthers of one flower to the stigma of another",
82259,noun,"fertilization by transfer of pollen from the anthers to the stigma of the same flower",
82260,noun,"waste matter that contaminates the water or air or soil",
82261,noun,"a fluorocarbon with chlorine; formerly used as a refrigerant and as a propellant in aerosol cans; ""the chlorine in CFCs causes depletion of atmospheric ozone""",
82262,noun,"a compound in which the hydrogen atoms of a hydrocarbon have been replaced by bromine and other halogen atoms; very stable; used in fire extinguishers although it is thought to release bromine that depletes the ozone layer",
82263,noun,"a person or organization that causes pollution of the environment",
82264,noun,"pollution that is rendered harmless by natural processes and so causes no permanent harm",
82265,noun,"pollution that accumulates in the environment and may appear in the food chain",
82266,noun,"annoying and potentially harmful environmental noise",
82267,noun,"harm to lakes and rivers resulting from the release of excessive waste heat into them",
82268,noun,"pollution of the water in rivers and lakes",
82269,noun,"the state of being polluted",
82270,noun,"Venetian traveler who explored Asia in the 13th century and served Kublai Khan (1254-1324)",
82271,noun,"a game similar to field hockey but played on horseback using long-handled mallets and a wooden ball",
82272,noun,"abject pusillanimity",
82273,noun,"contemptible fearfulness",
82274,adjective,"having more than one husband at a time",
82275,noun,"having more than one husband at a time",
82276,noun,"a piece of work composed of or decorated in many colors",
82277,noun,"any of numerous synthetic resins; they are light and strong and weather resistant",
82278,noun,"a resin having a polymeric structure; especially a resin in the raw state; used chiefly in plastics",
82279,noun,"a quick-drying resilient synthetic fiber consisting primarily of polyester",
82280,adjective,"having more than one period of estrus per year",
82281,noun,"a lightweight thermoplastic; used especially in packaging and insulation",
82282,noun,"a woman with two or more husbands",
82283,noun,"a man with two or more wives",
82284,adjective,"having more than one wife at a time",
82285,noun,"having more than one wife at a time",
82286,adjective,"having a command of or composed in many languages; ""a polyglot traveler""; ""a polyglot Bible contains versions in different languages""",
82287,noun,"an equiangular polygon",
82288,noun,"a polygon such that no side extended cuts any other side or vertex; it can be cut by a line in at most two points",
82289,noun,"a polygon such that there is a straight line that cuts it in four or more points",
82290,noun,"an eleven-sided polygon",
82291,noun,"a figure on the surface of a sphere bounded by arcs of 3 or more great circles",
82292,noun,"a polyhedron any plane section of which is a convex polygon",
82293,noun,"a polyhedron some of whose plane sections are concave polygons",
82294,noun,"a polyhedron having a polygonal base and triangular sides with a common vertex",
82295,noun,"any polyhedron having four plane faces",
82296,noun,"a polyhedron whose vertices all lie in one or the other of two parallel planes; the faces that lie in those planes are the bases of the prismatoid",
82297,noun,"a polyhedron whose faces are trapeziums",
82298,noun,"small usually parasitic flagellates",
82299,noun,"a polymer consisting of two or more different monomers",
82300,noun,"any of various polymers containing the urethane radical; a wide variety of synthetic forms are made and used as adhesives or plastics or paints or rubber",
82301,noun,"a complex polymer; the chief constituent of wood other than carbohydrates; binds to cellulose fibers to harden and strengthen cell walls of plants",
82302,noun,"any of a large class of siloxanes that are unusually stable over a wide range of temperatures; used in lubricants and adhesives and coatings and synthetic rubber and electrical insulation",
82303,noun,"a polymer (or a molecule of a polymer) consisting of three identical monomers",
82304,noun,"a chemical process that combines several monomers to form a polymer or polymeric compound",
82305,noun,"a native or inhabitant of Polynesia",
82306,noun,"a native or inhabitant of Fiji",
82307,noun,"a native or inhabitant of the Samoan Islands",
82308,noun,"a native or inhabitant of Tahiti",
82309,noun,"a Polynesian native or inhabitant of Tonga",
82310,noun,"the Polynesian language spoken by the Tongan people",
82311,noun,"a stretch of open water surrounded by ice (especially in Arctic seas)",
82312,noun,"a polyp that consists of benign neoplastic tissue derived from glandular epithelium; ""adenomatous polyps are visible protrusions that can develop on the mucosal surface of the colon or rectum""",
82313,noun,"a relatively flat polyp",
82314,noun,"one of two forms that coelenterates take e.g. a hydra or coral: usually sedentary and has a hollow cylindrical body usually with a ring of tentacles around the mouth",
82315,noun,"a genus of ferns belonging to the family Polypodiaceae and having rounded naked sori",
82316,noun,"fern having rootstock of a sweetish flavor",
82317,noun,"fern growing on rocks or tree trunks and having fronds greyish and scurfy below; Americas and South Africa",
82318,noun,"stiff leathery-leaved fern of western North America having ovate fronds parted to the midrib",
82319,noun,"chiefly lithophytic or epiphytic fern of North America and east Asia",
82320,noun,"mat-forming lithophytic or terrestrial fern with creeping rootstocks and large pinnatifid fronds found throughout North America and Europe and Africa and east Asia",
82321,adjective,"having or characterized by words of more than three syllables",
82322,noun,"a word of more than three syllables",
82323,noun,"a word that is hard to pronounce",
82324,noun,"a very long word (a foot and a half long)",
82325,noun,"using several conjunctions in close succession, especially where some might be omitted (as in `he ran and jumped and laughed for joy')",
82326,noun,"a technical school offering instruction in many industrial arts and applied sciences",
82327,noun,"a school teaching mechanical and industrial arts and the applied sciences",
82328,noun,"belief in multiple Gods",
82329,adjective,"using more than one key or tonality simultaneously; ""exciting rhythms and polytonal harmonies""",
82330,adjective,"(of long-chain carbon compounds especially fats) having many unsaturated bonds",
82331,noun,"(toxicology) the state of being capable of counteracting more than one toxin or antigen or kind of microorganism",
82332,noun,"hairdressing consisting of a perfumed oil or ointment",
82333,noun,"a toiletry for the hair",
82334,noun,"a pomade to make the hair manageable and lustrous",
82335,noun,"aromatic acid-tasting pear-shaped fruit used in preserves",
82336,noun,"shrub or small tree native to southwestern Asia having large red many-seeded fruit",
82337,noun,"coextensive with the family Punicaceae",
82338,noun,"large globular fruit having many seeds with juicy red pulp in a tough brownish-red rind",
82339,noun,"breed of very small compact long-haired dogs of the spitz type",
82340,verb,"style women's hair in a pompadour",
82341,noun,"a freshwater pond with fish",
82342,noun,"a pond for watering horses",
82343,noun,"a pond formed by damming a stream to provide a head of water to turn a mill wheel",
82344,noun,"a small body of water (usually in a creek) that is deep enough to use for swimming",
82345,noun,"a natural hole or hollow containing water",
82346,adjective,"labored and dull; ""a ponderous speech""",
82347,noun,"cornbread often made without milk or eggs and baked or fried (southern)",
82348,noun,"United States coloratura soprano (born in France) (1904-1976)",
82349,noun,"a lyric soprano who specializes in coloratura vocal music",
82350,noun,"a band of nerve fibers linking the medulla oblongata and the cerebellum with the midbrain",
82351,noun,"the vestments and other insignia of a pontiff (especially a bishop)",
82352,verb,"talk in a dogmatic and pompous manner; ""The new professor always pontificates""",
82353,noun,"a small native range horse",
82354,noun,"breed of very small pony with long shaggy mane and tail",
82355,noun,"breed of small ponies originally from Wales",
82356,noun,"stocky breed of pony with a fawn-colored nose",
82357,noun,"the breed of very small poodles",
82358,noun,"a breed of small poodles",
82359,noun,"a breed or medium-sized poodles",
82360,noun,"the largest breed of poodle",
82361,verb,"combine into a common fund; ""We pooled resources""",
82362,noun,"a shallow pool for children",
82363,noun,"a group of typists who can work for different persons",
82364,noun,"a small body of standing water (rainwater) or other liquid; ""there were puddles of muddy water in the road after the rain""; ""the body lay in a pool of blood""",
82365,noun,"a stagnant pool of water in the bed of a stream that flows intermittently",
82366,noun,"a puddle of mud; ""the children loved a mud puddle""",
82367,noun,"a form of pool played with 15 red balls and six balls of other colors and a cue ball",
82368,noun,"a shot in billiards made by hitting the cue ball with the cue held nearly vertically; the cue ball spins around another ball before hitting the object ball",
82369,noun,"a room with pool tables where pool is played",
82370,noun,"an exposed partial weather deck on the stern superstructure of a ship",
82371,adjective,"lacking the rights and advantages of other members of society",
82372,adjective,"having no money; ""virtually moneyless rural regions""",
82373,adjective,"without income or means; ""left his family unprovided for""",
82374,adjective,"(of housing or residential areas) indicative of poverty; ""a slummy part of town""; ""slum conditions""",
82375,adjective,"lacking or deficient in natural resources",
82376,verb,"make an explosive sound; ""sputtering engines""",
82377,verb,"cause to make a sharp explosive sound; ""He popped the champagne bottle""",
82378,verb,"put or thrust suddenly and forcefully; ""pop the pizza into the microwave oven""; ""He popped the petit-four into his mouth""",
82379,verb,"release suddenly; ""pop the clutch""",
82380,verb,"inject (drugs) into the skin",
82381,noun,"a sweet drink containing carbonated water and flavoring; ""in New England they call sodas tonics""",
82382,noun,"effervescent beverage artificially charged with carbon dioxide",
82383,noun,"a sharp explosive sound as from a gunshot or drawing a cork",
82384,noun,"music of general appeal to teenagers; a bland watered-down version of rock'n'roll with more rhythm and harmony and an emphasis on romantic love",
82385,adjective,"having bulging eyes",
82386,adjective,"having an eye or eyes or eyelike feature especially as specified; often used in combination; ""a peacock's eyed feathers""; ""red-eyed""",
82387,noun,"soft light-colored nondurable wood of the poplar",
82388,noun,"a genus of trees of the family Salicaceae that is found in the northern hemisphere; poplars",
82389,noun,"a poplar that is widely cultivated in the United States; has white bark and leaves with whitish undersurfaces",
82390,noun,"large rapidly growing poplar with faintly lobed dentate leaves grey on the lower surface; native to Europe but introduced and naturalized elsewhere",
82391,noun,"large European poplar",
82392,noun,"any of several North American trees of the genus Populus having a tuft of cottony hairs on the seed",
82393,noun,"showy annual of California with red flowers",
82394,noun,"annual Old World poppy with orange-red flowers and bristly fruit",
82395,noun,"commonly cultivated Asiatic perennial poppy having stiff heavily haired leaves and bright scarlet or pink to orange flowers",
82396,noun,"southwestern Asian herb with greyish leaves and white or reddish flowers; source of opium",
82397,noun,"perennial herb with branched woody stock and bright yellow flowers",
82398,noun,"of Pacific coast of North America; widely cultivated for its yellow to red flowers",
82399,noun,"native of Mexican highlands grown for its glossy clear yellow flowers and blue-grey finely dissected foliage",
82400,noun,"herb of China and Japan widely cultivated for its plumelike panicles of creamy white flowers",
82401,noun,"Chinese perennial having mauve-pink to bright sky blue flowers in drooping cymes",
82402,noun,"widely cultivated west European plant with showy pale yellow flowers",
82403,noun,"California plant with small pale yellow flowers",
82404,noun,"California wild poppy with bright red flowers",
82405,noun,"perennial here native to woodland of the eastern United States having yellow flowers",
82406,noun,"the quality of being widely admired or accepted or sought after; ""his charm soon won him affection and popularity""; ""the universal popularity of American movies""",
82407,adjective,"selling in great numbers; ""a best-selling novel""",
82408,adjective,"visited by throngs of tourists; ""of the three American Virgin islands St. Thomas is the most touristed""; ""tourists descend in busloads...so the whole place is rather touristy""",
82409,adjective,"regarded with disfavor or lacking general approval; ""unpopular ideas""; ""an unpopular war""",
82410,noun,"the quality of being popular; ""skiing is hot stuff in New Hampshire""",
82411,noun,"too much population",
82412,noun,"a population that is part of a larger population",
82413,adjective,"densely populated",
82414,adjective,"having inhabitants; lived in; ""the inhabited regions of the earth""",
82415,noun,"voracious pointed-nose shark of northern Atlantic and Pacific",
82416,noun,"a genus of Lamnidae",
82417,noun,"fierce pelagic and oceanic sharks",
82418,noun,"a brand of fine English porcelain",
82419,noun,"a porch for the back door",
82420,noun,"a porch for the front door",
82421,noun,"small porch or set of steps at the front entrance of a house",
82422,noun,"terrestrial porcupine",
82423,noun,"arboreal porcupine",
82424,noun,"a stiff hollow protective spine on a porcupine or hedgehog",
82425,noun,"a pore in the outer wall of a spore or pollen grain through which the germ tube or pollen tube makes its exit on germination",
82426,noun,"woody pore fungi; any fungus of the family Polyporaceae or family Boletaceae having the spore-bearing surface within tubes or pores; the fruiting bodies are usually woody at maturity and persistent",
82427,noun,"a woody fungus that forms shelflike sporophores on tree trunks and wood structures",
82428,noun,"a rare fungus having a large (up to 14 inches wide) yellow fruiting body with multiple individual caps and a broad central stalk and a fragrant odor",
82429,noun,"a fungus with a whitish often circular cap and a white pore surface and small pores and a white central stalk; found under conifers; edible but not popular",
82430,noun,"a gilled polypore with a large cap (up to 15 inches in diameter) and a broad stalk; edible when young and tender",
