ID,POS,Gloss
82431,noun,"a woody pore fungus with a dark brown to red brown cap and spore surface and small pores",
82432,noun,"a pore fungus with a whitish cottony soft cap found on conifer logs in forests at high elevation in the western United States and adjacent Canada",
82433,noun,"a fungus with a whitish kidney-shaped cap and elongated pores; causes white rot in dead hardwoods",
82434,noun,"a fungus with a lateral stalk (when there is a stalk) and a scaly cap that becomes nearly black in maturity; widely distributed in the northern hemisphere",
82435,noun,"a popular edible fungus with a cap the color of liver or raw meat; abundant in southeastern United States",
82436,noun,"lean flesh of fish found in warm waters of southern Atlantic coast of the United States",
82437,noun,"porgy of southern Atlantic coastal waters of North America",
82438,noun,"important deep-bodied food and sport fish of warm and tropical coastal waters; found worldwide",
82439,noun,"any of numerous marine percoid fishes especially (but not exclusively) of the family Sparidae",
82440,noun,"food fish of the Mediterranean and Atlantic coasts of Europe and America",
82441,noun,"found in Atlantic coastal waters of North America from South Carolina to Maine; esteemed as a panfish",
82442,noun,"whole young pig suitable for roasting",
82443,noun,"feet or knuckles of hogs used as food; pickled or stewed or jellied",
82444,noun,"meat from a loin of pork",
82445,adjective,"designed to arouse lust; ""pornographic films and magazines""",
82446,adjective,"forming a continuous series of pores; ""a porose hymenium""",
82447,adjective,"full of pores or vessels or holes",
82448,noun,"the porosity of a sponge",
82449,noun,porpoises,
82450,noun,"the common porpoise of the northern Atlantic and Pacific",
82451,noun,"a short porpoise that lives in the Gulf of California; an endangered species",
82452,verb,"transfer data from one computer to another via a cable that links connecting ports",
82453,verb,"put or turn on the left side, of a ship; ""port the helm""",
82454,verb,"bring to port; ""the captain ported the ship at night""",
82455,verb,"turn or go to the port or left side, of a ship; ""The big ship was slowly porting""",
82456,noun,"the port from which a ship originates of where it is registered",
82457,noun,"a port in the United States where customs officials are stationed to oversee the entry and exit of people and merchandise",
82458,noun,"a port in China or Korea or Japan that once was open to foreign trade on the basis of a trading treaty",
82459,noun,"an ancient port on the Mediterranean; the capital and largest city of Algeria",
82460,noun,"port city on Atlantic coast; the capital and largest city of Angola",
82461,noun,"capital and largest city of Argentina; located in eastern Argentina near Uruguay; Argentina's chief port and industrial and cultural center",
82462,noun,"port city on the Gulf of Aden; the capital and largest city of Djibouti",
82463,noun,"a port town in Eritrea on an inlet of the Red Sea",
82464,noun,"the capital and largest city of Finland; located in southern Finland; a major port and commercial and cultural center",
82465,noun,"a town that is the chief port of the Aland islands",
82466,noun,"capital of the Canadian province of British Columbia on Vancouver Island",
82467,noun,"a port and provincial capital of Newfoundland",
82468,noun,"a port and state capital of Tasmania",
82469,noun,"a port and industrial city in northwestern England",
82470,noun,"capital and largest city and major port of the Irish Free State",
82471,noun,"a port in southwestern Scotland",
82472,noun,"a town in northern France on the Strait of Dover that serves as a ferry port to England; in 1347 it was captured by the English king Edward III after a long siege and remained in English hands until it was recaptured by the French king Henry II in 1558",
82473,noun,"a port town in northwestern France on the English Channel; site of a naval base",
82474,noun,"a seaport in northern France on the North Sea; scene of the evacuation of British forces in 1940 during World War II",
82475,noun,"a port city and capital of Gambia",
82476,noun,"port city and the capital and largest city of Guyana; ""the city was called Stabroek by the Dutch but was renamed Georgetown by the British in 1812""",
82477,noun,"capital and chief port of Mauritius; located on the northwestern coast of the island",
82478,noun,"a port on the Gulf of Oman and capital of the sultanate of Oman",
82479,noun,"the capital and chief port of Paraguay",
82480,noun,"capital and largest city and economic and cultural center of Portugal; a major port in western Portugal on Tagus River where it broadens and empties into the Atlantic",
82481,noun,"the capital and chief port of Qatar",
82482,noun,"a port on the island of Saint Lucia; capital and largest city of Saint Lucia",
82483,noun,"the capital and chief port and largest city of Senegal",
82484,noun,"port city and the capital of Seychelles",
82485,noun,"port city and the capital and largest city of Sierra Leone",
82486,noun,"the capital and largest city of Somalia; a port on the Indian Ocean",
82487,noun,"the capital and largest city and major port of Surinam",
82488,noun,"the capital and largest port city of Tanzania on the Indian Ocean",
82489,noun,"the capital and largest city and chief port of Thailand; a leading city in southeastern Asia; noted for Buddhist architecture",
82490,noun,"the capital and principal port of Tunisia",
82491,noun,"a port on Alaska's southern coast from which oil is shipped to markets around the world",
82492,noun,"the capital and largest city of Hawaii; located on a large bay on the island of Oahu",
82493,noun,"a port town in southeastern New Hampshire on the Atlantic Ocean",
82494,noun,"sweet dark-red dessert wine originally from Portugal",
82495,noun,"a town in Arizona on the Mexican border opposite Nogales, Mexico",
82496,noun,"a resort and fishing town on the Gulf of Mexico in northwest Florida",
82497,noun,"a town in southeast Georgia near the Atlantic coast; a port of entry",
82498,noun,"a town in east central Michigan on an arm of Lake Huron",
82499,noun,"a town in western Washington",
82500,noun,"a town in northeastern Washington on a bay near the Canadian border",
82501,noun,"the quality of being light enough to be carried",
82502,adjective,"easily or conveniently transported; ""a portable television set""",
82503,adjective,"portable by one man",
82504,adjective,"(of personal property as opposed to real estate) can be moved from place to place (especially carried by hand)",
82505,noun,"a small light typewriter; usually with a case in which it can be carried",
82506,noun,"overland track between navigable waterways",
82507,noun,"any road or path affording passage especially a rough one",
82508,noun,"a site that the owner positions as an entrance to other sites on the internet; ""a portal typically has search engines and free email and chat rooms etc.""",
82509,noun,"a short vein that carries blood into the liver",
82510,noun,"system of veins that carry blood from the abdominal organs to the liver",
82511,noun,"a porter who helps passengers with their baggage at a railroad station",
82512,noun,"a porter who helps passengers with their baggage at an airport",
82513,noun,"a set of pieces of creative work collected to be shown to potential customers or employers; ""the artist had put together a portfolio of his work""; ""every actor has a portfolio of photographs""",
82514,noun,"a strong shutter over a ship's porthole that is closed in stormy weather",
82515,noun,"a portrait of yourself created by yourself",
82516,noun,"a portrait showing the body from only the waist up",
82517,verb,"portray in words; ""The book portrays the actor as a selfish person""",
82518,noun,"the Romance language spoken in Portugal and Brazil",
82519,noun,"affected manners intended to impress others; ""don't put on airs with me""",
82520,noun,"(Greek mythology) the god of the sea and earthquakes in ancient mythology; brother of Zeus and Hades and Hera; identified with Roman Neptune",
82521,noun,"a person who habitually pretends to be something he is not",
82522,noun,"a woman poseur",
82523,noun,"a particularly difficult or baffling question or problem",
82524,noun,"(statistics) the difficulty of applying Bayes' theorem is that the probabilities of the different causes are seldom known, in which case it may be postulated that they are all equal (sometimes known as postulating the equidistribution of ignorance)",
82525,adjective,"occupying the highest socioeconomic position in a society",
82526,noun,"a position of superiority over opponents or competitors",
82527,noun,"a position attracting much attention and publicity",
82528,noun,"the status of being born of a morganatic marriage",
82529,noun,"the state of being retired from one's business or occupation",
82530,noun,"a position in a hierarchy or organization; ""Bob Dylan occupied the top slot for several weeks""; ""she beat some tough competition for the number one slot""",
82531,noun,"a relatively insignificant position from which future progress might be made; ""American diplomacy provided a toehold on which to proceed toward peace talks""; ""his father gave him a toehold in the oil business""",
82532,noun,"the property of being central",
82533,noun,"the property of being marginal or on the fringes",
82534,noun,"the quality of being in front or (in lower animals) toward the head",
82535,noun,"the quality of being toward the back or toward the rear end",
82536,noun,"the quality or state of being inward or internal; ""the inwardness of the body's organs""",
82537,noun,"the property of being to the north",
82538,noun,"the property of being to the south",
82539,noun,"the quality of being parallel to the horizon; ""houses with a pronounced horizontality""",
82540,noun,"position at right angles to the horizon",
82541,noun,"a position in a grammatical linguistic construction in which a variety of alternative units are interchangeable; ""he developed a version of slot grammar""",
82542,noun,"the fielding position of the player on a baseball team who is stationed near the second of the bases in the infield",
82543,noun,"the fielding position of the player on a baseball team who is stationed between second and third base",
82544,noun,"the fielding position of the player on a baseball team who is stationed near the third of the bases in the infield (counting counterclockwise from home plate); ""he is playing third""",
82545,noun,"the fielding position of the player on a baseball team who is expected to field balls in the left third of the outfield (looking from home plate)",
82546,noun,"the fielding position of the player on a baseball team who is expected to field balls in the central third of the outfield",
82547,noun,"the fielding position of the player on a baseball team who is expected to field balls in the right third of the outfield (looking from home plate)",
82548,noun,"the fielding position in cricket closest to the bowler on the off side",
82549,noun,"the fielding position in cricket closest to the bowler on the on side",
82550,noun,"a situation in golf where an opponent's ball blocks the line between your ball and the hole",
82551,noun,"a firm and uncompromising stance or position; ""the governor took a hard line on drugs""",
82552,noun,"a positional system of numeration that uses octal digits and a radix of eight",
82553,noun,"a positional system of numeration that uses decimal digits and a base of ten",
82554,noun,"a positional system of numeration that uses duodecimal digits and a radix of twelve",
82555,noun,"a positional system of numeration that uses hexadecimal digits and a radix of sixteen",
82556,adjective,"causing to fall into line or into position",
82557,noun,"one trouble leads to another that aggravates the first",
82558,noun,"a quality or state characterized by certainty or acceptance or affirmation and dogmatic assertiveness",
82559,noun,"the quality of being undeniable and not worth arguing about",
82560,noun,"an elementary particle with positive charge; interaction of a positron and an electron results in annihilation",
82561,noun,"the antiparticle of a lepton",
82562,noun,"a valuable possession whose upkeep is excessively expensive",
82563,noun,"a person's financial situation (good or bad); ""he found himself in straitened circumstances""",
82564,noun,"any possession that is highly valued by its owner; ""the children returned from the seashore with their shells and other treasures""",
82565,noun,"a former Portuguese province on the south coast of China and two islands in the South China Sea; reverted to China in 1999",
82566,noun,"more than 40 northeastern Virgin Islands (15 inhabited); a dependent territory of the United Kingdom",
82567,noun,"more than 130 southeastern Virgin Islands; a dependent territory of the United States",
82568,noun,"a former British possession in Micronesia",
82569,noun,"a self-governing colony that is a possession of Denmark in the Faroe Islands",
82570,noun,"a French overseas possession in the South Pacific",
82571,noun,"self-control in a crisis; ability to say or do the right thing in an emergency",
82572,noun,"the state of being achievable",
82573,adjective,"capable of being affirmed or asserted; ""a quality affirmable of every member of the family""",
82574,noun,"either of a pair of strong posts that support a windlass on a ship's deck",
82575,noun,"a square post supporting a structural member at the corner of a building",
82576,noun,"a fixed post with a ring to which a horse can be hitched to prevent it from straying",
82577,noun,"a tall pole to support the wires on which the hop plant is trained",
82578,noun,"a metal post supporting an outdoor lamp (such as a streetlight)",
82579,noun,"vertical tie post in a roof truss",
82580,noun,"a vertical post at the forward edge of a rudder that enables the rudder to pivot",
82581,noun,"any vertical post or rod used as a support",
82582,noun,"an upright pole or beam (especially one used as a support); ""distance was marked by standards every mile""; ""lamps supported on standards provided illumination""",
82583,noun,"tall pole supporting telephone wires",
82584,noun,"a post made of wood",
82585,noun,"post formerly used in public to which offenders are tied to be whipped",
82586,noun,"United States manufacturer of breakfast cereals and Postum (1854-1914)",
82587,noun,"a pole or stake set up to mark something (as the start or end of a race track); ""a pair of posts marked the goal""; ""the corner of the lot was indicated by a stake""",
82588,noun,"a post marking the starting point of a race (especially a horse race)",
82589,noun,"the post at the end of a racecourse",
82590,noun,"the logical fallacy of believing that temporal succession implies a causal relation",
82591,noun,"an independent agency of the federal government responsible for mail delivery (and sometimes telecommunications) between individuals and businesses in the United States",
82592,noun,"a part of the post office that handles mail for persons who call for it",
82593,noun,"a children's game in which kisses are exchanged for pretended letters",
82594,noun,"a road over which mail is carried",
82595,noun,"a postcard that folds so the message is inside",
82596,noun,"a postcard with a picture on one side",
82597,verb,"establish something as being later relative to something else",
82598,noun,"a grant that funds postdoctoral study or research",
82599,noun,"someone who pastes up bills or placards on walls or billboards",
82600,noun,"pigment mixed with water-soluble glutinous materials such as size and egg yolk",
82601,adjective,"situated in or directed toward the part of the body from which the tail arises; ""caudal fins""; ""the caudal end of the body""",
82602,adjective,"at or near or toward the posterior",
82603,noun,"a tooth situated at the back of the mouth",
82604,noun,"all of the offspring of a given progenitor; ""we must secure the benefits of freedom for ourselves and our posterity""",
82605,noun,"a parenthesis-free notation for forming mathematical expressions in which each operator follows its operands",
82606,noun,"a wig that gives the appearance of an Afro hairdo",
82607,noun,"hairpiece consisting of a tress of false hair; used by women to give shape to a coiffure",
82608,noun,"a small hairpiece to cover partial baldness",
82609,noun,"a voluntary played at the end of a religious service",
82610,noun,"composition (often improvised) for a solo instrument (especially solo organ) and not a regular part of a religious service or musical performance",
82611,noun,"a woman postmaster",
82612,adjective,"after noon",
82613,adjective,"after noon",
82614,adjective,"after death or after an event; ""a postmortem examination to determine the cause of death""; ""the postmortem discussion of the President's TV address""",
82615,noun,"chronic secretion of mucus from the rear of the nasal cavity into the nasopharynx",
82616,adjective,"used especially of mail; paid in advance",
82617,noun,"someone who postpones work (especially out of laziness or habitual carelessness)",
82618,noun,"one submitting a request or application especially one seeking admission into a religious order",
82619,verb,"put in a new, usually larger, pot; ""The plant had grown and had to be repotted""",
82620,noun,"iron or earthenware cooking pot; used for stews",
82621,noun,"a large pot especially one with legs used e.g. for cooking soup",
82622,noun,"a pot that holds 2 quarts",
82623,noun,"a cooking pot that has handles on either side and tight fitting lid; used for stewing or boiling",
82624,noun,"a pot used for preparing soup stock",
82625,noun,"pot for brewing tea; usually has a spout and handle",
82626,noun,"a large pot for making coffee or tea",
82627,noun,"the quantity contained in a pot",
82628,noun,"a resistor with three terminals, the third being an adjustable center terminal; used to adjust voltages in radios and TV sets",
82629,noun,"resistors connected in series across a voltage source; used to obtain a desired fraction of the voltage",
82630,noun,"cut from the round; suitable for pot roast",
82631,noun,"thick (often creamy) soup",
82632,noun,"annual native to South America having underground stolons bearing edible starchy tubers; widely cultivated as a garden vegetable; vines are poisonous",
82633,noun,"potato that has been cooked by baking it in an oven",
82634,noun,"strips of potato fried in deep fat",
82635,noun,"sliced pieces of potato fried in a pan until brown and crisp",
82636,noun,"potato that has been peeled and boiled and then mashed",
82637,noun,"similar to the common potato",
82638,noun,"black-and-yellow beetle that feeds in adult and larval stages on potato leaves; originally of eastern Rocky Mountains; now worldwide",
82639,noun,"Colorado potato beetles",
82640,noun,"a bulbous stove in which wood or coal is burned",
82641,noun,"a literary composition of poor quality that was written quickly to make money (to boil the pot)",
82642,noun,"the state of being potent; a male's capacity to have sexual intercourse",
82643,adjective,"having or wielding force or authority; ""providing the ground soldier with increasingly potent weapons""",
82644,adjective,"able to many things; ""multipotent drugs""",
82645,noun,"the difference in electrical charge between two points in a circuit expressed in volts",
82646,noun,"the electrical response of the central nervous system produced by an external stimulus; ""he measured evoked potentials with an electroencephalogram""",
82647,noun,"the potential difference between the two sides of the membrane of a nerve cell when the cell is not conducting an impulse",
82648,noun,"the mechanical energy that a body has by virtue of its position; stored energy",
82649,noun,"potential energy that is stored when a body is deformed (as in a coiled spring)",
82650,noun,"chiefly perennial northern hemisphere herbs and shrubs: cinquefoil",
82651,noun,"a measuring instrument for measuring direct current electromotive forces",
82652,noun,"any of various herbaceous plants whose leaves or stems or flowers are cooked and used for food or seasoning",
82653,noun,"an adjustable pothook set in a fireplace",
82654,noun,"a shot taken at an easy or casual target (as by a pothunter)",
82655,noun,"a stew of vegetables and (sometimes) meat",
82656,noun,"potter's clay that is thinned and used for coating or decorating ceramics",
82657,noun,"a horizontal rotating wheel holding the clay being shaped by a potter; ""the potter's wheel was invented in Asia Minor around 6500 BC""",
82658,noun,"pottery that is veined and mottled to resemble agate",
82659,noun,"a type of pottery made by Josiah Wedgwood and his successors; typically has a classical decoration in white on a blue background",
82660,noun,"a workshop where clayware is made",
82661,noun,"a receptacle for urination or defecation in the bedroom",
82662,noun,"a fur or leather pouch worn at the front of the kilt as part of the traditional dress of Scottish Highlanders",
82663,noun,"a pouch for carrying pipe tobacco",
82664,noun,"a small pouch (usually with a zipper) that attaches to a belt and is worn around the waist",
82665,noun,"flesh of a small fowl bred for roasting",
82666,verb,"descend swiftly, as if on prey; ""The eagle stooped on the mice in the field""",
82667,verb,"strike or drive against with a heavy impact; ""ram the gate with a sledgehammer""; ""pound on the door""",
82668,noun,"8 ounces",
82669,noun,"the basic unit of money in Syria; equal to 100 piasters",
82670,noun,"a fractional monetary unit in Egypt and Lebanon and Sudan and Syria",
82671,noun,"the basic unit of money in the Sudan; equal to 100 piasters",
82672,noun,"the basic unit of money in Lebanon; equal to 100 piasters",
82673,noun,"the basic unit of money in Egypt; equal to 100 piasters",
82674,noun,"a nontechnical unit of force equal to the mass of 1 pound with an acceleration of free fall equal to 32 feet/sec/sec",
82675,noun,"4 ounces",
82676,noun,"trap consisting of an arrangement of nets directing fish into an enclosure",
82677,noun,"weight expressed in pounds",
82678,noun,"(used only in combination) something weighing a given number of pounds; ""the fisherman caught a 10-pounder""; ""their linemen are all 300-pounders""",
82679,verb,"pour out in drops or small quantities or as if in drops or small quantities; ""shed tears""; ""spill blood""; ""God shed His grace on Thee""",
82680,verb,"pour out of one vessel into another",
82681,verb,"be disgorged; ""The crowds spilled out into the streets""",
82682,verb,"pour or rush back; ""The blood regurgitates into the heart ventricle""",
82683,noun,"marine eellike mostly bottom-dwelling fishes of northern seas",
82684,noun,eelpouts,
82685,noun,"an eelpout of northern Europe that is viviparous",
82686,noun,"brightly colored scaleless Arctic eelpout",
82687,noun,"common along northeastern coast of North America",
82688,noun,"catfish common in eastern United States",
82689,noun,"any of several common freshwater catfishes of the United States",
82690,verb,"apply talcum powder to (one's body)",
82691,noun,"a solid substance in the form of tiny loose particles; a solid that has been pulverized",
82692,noun,"a bitter yellow powder used to treat skin diseases",
82693,noun,"powder used to prevent a baby's diaper from chafing",
82694,noun,"a medicinal powder made essentially of ipecac and opium; formerly used to relieve pain and induce perspiration",
82695,noun,"cosmetic powder for the face",
82696,noun,"a fine powder for spreading on the body (as after bathing)",
82697,noun,"keg (usually made of metal) for gunpowder or blasting powder",
82698,noun,"superiority in power or influence; ""the preponderance of good over evil""; ""the preponderance of wealth and power""",
82699,noun,"power to influence or coerce; ""the puissance of the labor vote""",
82700,noun,"the power to induce the taking of a course of action or the embracing of a point of view by means of argument or entreaty; ""the strength of his argument settled the matter""",
82701,noun,"complete power over a person or situation; ""corporations have a stranglehold on the media""; ""the president applied a chokehold to labor disputes that inconvenienced the public""",
82702,noun,"controlling influence",
82703,noun,"the power to repel; ""she knew many repellents to his advances""",
82704,noun,"the power or right to prohibit or reject a proposed or intended act (especially the power of a chief executive to reject a bill passed by the legislature)",
82705,noun,"the power to do work that is latent in a head of water",
82706,noun,"the failure of electric power for a general region",
82707,noun,"a power mower you can ride on",
82708,noun,"a power of attorney document to transfer ownership of a registered security from the owner to another party",
82709,noun,"a power of attorney document given by shareholders of a corporation authorizing a specific vote on their behalf at a corporate meeting",
82710,noun,"a device for converting a power supply to a voltage required by particular equipment",
82711,noun,"a power plant that uses wind turbines to generate electricity",
82712,noun,"a play in which there is a concentration of players in one location on the field of play; ""they used a power play to return the kickoff""",
82713,noun,"automotive steering where engineer power amplifies the torque applied to the steering wheel",
82714,adjective,"driving or forcing; ""compelling ambition""",
82715,adjective,"acting or functioning as a regent or ruler; ""prince-regent""",
82716,adjective,"exercising power or authority",
82717,adjective,"strong enough to knock down or overwhelm; ""a knock-down blow""",
82718,noun,"a team considered to be the best of its class",
82719,adjective,"having little power to do work; ""a low-powered engine""",
82720,adjective,"not having authority, political strength, or governing power; ""a weak president""",
