ID,POS,Gloss
81818,noun,"a vote by the electorate determining public opinion on a question of national importance",
81819,verb,"pledge as a collateral; ""The loan was collateralized by government bonds""",
81820,verb,"pledge without delivery or title of possession",
81821,noun,"one of the stars in the star cluster Pleiades",
81822,noun,"using more words than necessary; ""a tiny little child""",
81823,noun,"the thin serous membrane around the lungs and inner walls of the chest",
81824,noun,"pleura that lines the inner chest walls and covers the diaphragm",
81825,noun,"pleura that covers the lungs",
81826,noun,"inflammation of the pleura of the lungs (especially the parietal layer)",
81827,noun,"a collection of pus in the lung cavity",
81828,noun,"pleurisy and pneumonia",
81829,noun,"respiratory disease characterized by inflammation of the lung parenchyma (excluding the bronchi) with congestion caused by viruses or bacteria or irritants",
81830,noun,"a network of intersecting blood vessels or intersecting nerves or intersecting lymph vessels",
81831,noun,"a plexus of lymph nodes in the lower portion of the abdominal aorta",
81832,noun,"a network of intersecting nerves",
81833,noun,"a vascular plexus of the cerebral ventricles that regulate intraventricular pressure",
81834,noun,"a lymphatic plexus located along the lower portion of the aorta and iliac vessels",
81835,noun,"a plexus of veins draining the region of the pterygoid muscles and draining into the internal maxillary and anterior facial veins",
81836,noun,"the property of being pliant and flexible",
81837,noun,"pliers that can be locked in place",
81838,noun,"small pliers with long thin jaws for fine work",
81839,noun,"a type of pliers",
81840,noun,"a type of pliers",
81841,noun,"pliers with a joint adjustable to two positions in order to increase the opening of the jaws",
81842,noun,"a dangerous or distressing predicament; ""his views on race got him into political hot water""",
81843,noun,"a canvas shoe with a pliable rubber sole",
81844,noun,"the act of walking with a slow heavy gait; ""I could recognize his plod anywhere""",
81845,noun,"the plot of a book or play or film",
81846,noun,"a schemer who tries to gain advantage in an organization in sly or underhanded ways",
81847,noun,"a farm tool having one or more heavy blades to break the soil and cut a furrow prior to sowing",
81848,noun,"a heavy plow with a single wide blade; used chiefly in cotton fields",
81849,noun,"a sharp steel wedge that cuts loose the top layer of soil",
81850,noun,"plover family",
81851,noun,"small plover of eastern North America",
81852,noun,"plovers of Europe and America having the backs marked with golden-yellow spots",
81853,noun,"migratory shorebirds of the plover family that turn over stones in searching for food",
81854,verb,"pluck with tweezers; ""tweeze facial hair""",
81855,noun,"the trait of showing courage and determination in spite of possible loss or injury",
81856,noun,"the act of pulling and releasing a taut cord",
81857,verb,"close or secure with or as if with a stopper; ""She stoppered the wine bottle""; ""The mothers stoppered their babies' mouths with pacifiers""",
81858,verb,"plug with a tampon",
81859,noun,"a removable plug for holding water in a tub or basin",
81860,noun,"a wooden plug forming a flue pipe (as the mouthpiece of a recorder)",
81861,noun,"plug for the muzzle of a gun to keep out dust and moisture",
81862,noun,"plug of cotton or other absorbent material; inserted into wound or body cavity to absorb exuded fluids (especially blood)",
81863,noun,"an electrical device with two or three pins that is inserted in a socket to make an electrical connection",
81864,noun,"a plug for connecting a telephone",
81865,noun,"any of several trees producing edible oval fruit having a smooth skin and a single hard stone",
81866,noun,"an uncultivated plum tree or shrub",
81867,noun,"any of various widely distributed plums grown in the cooler temperate areas",
81868,noun,"small wild or half-domesticated Eurasian plum bearing small ovoid fruit in clusters",
81869,noun,"small tree of southwestern United States having purplish-red fruit sometimes cultivated as an ornamental for its large leaves",
81870,noun,"small tree native to northeastern North America having oblong orange-red fruit",
81871,noun,"small Asiatic tree bearing edible red or yellow fruit; used in Europe as budding stock",
81872,noun,"small tree of China and Japan bearing large yellow to red plums usually somewhat inferior to European plums in flavor",
81873,noun,"shrub of the Pacific coast of the United States bearing small red insipid fruit",
81874,noun,"small dark purple fruit used especially in jams and pies",
81875,noun,"small sour dark purple fruit of especially the Allegheny plum bush",
81876,noun,"a rich steamed or boiled pudding that resembles cake",
81877,noun,"shrubs and herbs and woody vines of warm regions: leadwort",
81878,noun,"utility consisting of the pipes and fixtures for the distribution of water or gas in a building and for the disposal of sewage",
81879,noun,"a feathered plume on a helmet",
81880,adjective,"resembling a plume; ""the dog's plumy tail""",
81881,adjective,"having or covered with or abounding in plumes; ""the plumed serpent""; ""white-plumed egrets""",
81882,verb,"plunder (a town) after capture; ""the barbarians sacked Rome""",
81883,noun,"a hollow twanging sound",
81884,noun,"(usually plural) mutual dealings or connections among persons or groups; ""international relations""",
81885,noun,"rites performed in connection with a death or burial",
81886,noun,"(Greek mythology) the extremely dirty stables that were finally cleaned by Hercules who diverted two rivers through them",
81887,noun,"a preparation that softens or scents a bath",
81888,noun,"small and tight-fitting underpants; worn by women",
81889,noun,"an outdoor grandstand without a roof; patrons are exposed to the sun as linens are when they are bleached",
81890,noun,"the stage of a theater; ""most actors love to stride the boards""",
81891,noun,"short tight-fitting underpants (trade name Jockey shorts)",
81892,noun,"civilian garb as opposed to a military uniform",
81893,noun,"shop where dry cleaning is done",
81894,noun,"underpants worn by men",
81895,noun,"a dress uniform for formal occasions",
81896,noun,"tongs for taking hold of burning coals",
81897,noun,"skin-tight very short pants worn by young women as an outer garment",
81898,noun,"tongs for lifting blocks of ice",
81899,noun,"the workplace where iron is smelted or where iron goods are made",
81900,noun,"chloral hydrate in combination with alcohol; usually administered surreptitiously to make the drinker unconscious",
81901,noun,"shears with strong blades used for light pruning of woody plants",
81902,noun,"punch consisting of pliers for perforating paper or leather",
81903,noun,"an indoor TV antenna; consists of two extendible rods that form a V",
81904,noun,"gymnastic apparatus consisting of a pair of heavy metal circles (usually covered with leather) suspended by ropes; used for gymnastic exercises; ""the rings require a strong upper body""",
81905,noun,"(plural) hand shears for cutting sheet metal",
81906,noun,"scissors for cropping and holding the snuff of a candlewick",
81907,noun,"soap that has been cut into flakes to make suds faster",
81908,noun,"a former instrument of punishment consisting of a heavy timber frame with holes in which the feet (and sometimes the hands) of an offender could be locked",
81909,noun,"miscellaneous objects too numerous or too small to be specified",
81910,noun,"spectacles that are darkened or polarized to protect the eyes from the glare of the sun; ""he was wearing a pair of mirrored shades""",
81911,noun,"shears with one serrate blade; used for thinning hair",
81912,noun,"(usually plural) weather deck; the part of a ship's hull that is above the waterline",
81913,noun,"waterproof hip boots (sometimes extending to the chest) worn by anglers",
81914,noun,"workplace where water is stored and purified and distributed for a community",
81915,noun,"control of your emotions; ""this kind of tension is not good for my nerves""",
81916,noun,"the rights conceded to the states by the United States constitution",
81917,noun,"(often plural) the branch of electrical engineering concerned with the technology of electronic communication at a distance",
81918,noun,"(usually plural) written material introduced into a movie or TV show to give credits or represent dialogue or explain an action; ""the titles go by faster than I can read""",
81919,noun,"(plural) the lay members of a male religious order",
81920,noun,"(plural) Arab guerrillas who operate mainly against Israel",
81921,noun,"a situation of being uncomfortably close to someone or something",
81922,noun,"a relic that has been excavated from the soil",
81923,noun,"(usually plural) valuables taken by violence (especially in war); ""to the victor belong the spoils of the enemy""",
81924,noun,"money that you currently expect to receive from notes or accounts",
81925,noun,"a source of substantial wealth (usually plural); ""a patron of the arts should have deep pockets""",
81926,noun,"capital held back from investment in order to meet probable or possible demands",
81927,noun,"a creditor's accounts of money owed to him; normally arise from the sale of products or services",
81928,noun,"a social organization in which diversity of racial or religious or ethnic or cultural groups is tolerated",
81929,noun,"the state of being plural; ""to mark plurality, one language may add an extra syllable to the word whereas another may simply change the vowel in the existing final syllable""",
81930,noun,"a sign indicating the operation of addition",
81931,noun,"a small planet and the farthest known planet from the sun; has the most elliptical orbit of all the planets; ""Pluto was discovered by Clyde Tombaugh in 1930""",
81932,noun,"a political system governed by the wealthy people",
81933,noun,"a highly fissionable isotope of plutonium that is used in atomic weapons and as a reactor fuel; produced by irradiating uranium 238 with slow electrons",
81934,noun,"fifth month of the Revolutionary calendar (January and February); the rainy month",
81935,noun,"one of the strands twisted together to make yarn or rope or thread; often used in combination; ""three-ply cord""; ""four-ply yarn""",
81936,noun,"pneumonia characterized by acute inflammation of the walls of the bronchioles",
81937,noun,"pneumonia affecting one or more lobes of the lung; commonly due to streptococcal infection",
81938,noun,"pneumonia caused by bacteria of the genus pneumococcus",
81939,noun,"pneumonia occurring in infants or in persons with impaired immune systems (as AIDS victims)",
81940,noun,"pneumonia caused by a virus",
81941,noun,"someone who hunts or fishes illegally on the property of another",
81942,noun,"a cooking vessel designed to poach food (such as fish or eggs)",
81943,noun,"small slender fish (to 8 inches) with body covered by bony plates; chiefly of deeper northern Pacific waters",
81944,noun,poachers,
81945,noun,"northern Atlantic sea poacher",
81946,noun,"small very elongate sea poachers",
81947,noun,"a pustule in an eruptive disease",
81948,noun,"a highly contagious viral disease characterized by fever and weakness and skin eruption with pustules that form scabs that slough off leaving scars",
81949,verb,"put in one's pocket; ""He pocketed the change""",
81950,noun,"a flat pocket sewn to the outside of a garment",
81951,noun,"a pocket in a garment (usually below the waist) to which access is provided by a vertical or diagonal slit in the outside of the garment",
81952,noun,"a supply of money; ""they dipped into the taxpayers' pockets""",
81953,noun,"thick-walled muscular pouch below the crop in many birds and reptiles for grinding food",
81954,noun,"a small pouch into which the semicircular canals open",
81955,noun,"a small conical pouch projecting from the upper anterior part of each atrium of the heart",
81956,noun,"a pouch projecting from the top front of each atrium of the heart",
81957,noun,"a membranous pouch inside the mouth of many rodents (as a gopher)",
81958,noun,"the external pouch that contains the testes",
81959,noun,"a pocket at the corner of a billiard table",
81960,noun,"a pocket on the side of a billiard table",
81961,noun,"indirect veto of legislation by refusing to sign it",
81962,noun,"your personal financial means; ""that car is too expensive for my pocketbook""",
81963,noun,"the quantity a pocket will hold",
81964,noun,"a pocketknife with a blade that springs open at the press of a button",
81965,verb,"take something out of its shell or pod; ""pod peas or beans""",
81966,verb,"remove from its shell or outer covering; ""shell the legumes""; ""shell mussels""",
81967,noun,"spirally twisted sweet pod of screwbean mesquite that is used for fodder or ground into meal for feed",
81968,noun,"pods constricted between seeds and breaking apart when ripe into one-seed segments",
81969,noun,"aquatic carnivorous mammal having a streamlined body specialized for swimming with limbs modified as flippers",
81970,noun,"a poem having lines beginning with letters of the alphabet in regular order",
81971,noun,"verse in the meter used in Greek and Latin poetry consisting of strophes of 4 tetrametric lines; reputedly invented by Alcaeus",
81972,noun,"an epigrammatic Japanese verse form of three short lines",
81973,noun,"a French verse form of 10 or 13 lines running on two rhymes; the opening phrase is repeated as the refrain of the second and third stanzas",
81974,noun,"a form of Japanese poetry; the 1st and 3rd lines have five syllables and the 2nd, 4th, and 5th have seven syllables",
81975,noun,"a verse form with a rhyme scheme: aba bcb cdc, etc.",
81976,noun,"a short verse said or sung by a priest or minister in public worship and followed by a response from the congregation",
81977,noun,"poetry celebrating the deeds of some hero",
81978,adjective,"(poetic) still or calm; ""in the stilly night""",
81979,adjective,"of or relating to a category of poetry that expresses emotion (often in a songlike way); ""lyric poetry""",
81980,verb,"write new lyrics for (a song)",
81981,verb,"supply (blank verse or prose) with rhymes",
81982,verb,"compose in poetic meter; ""The bard metrified his poems very precisely""",
81983,verb,"make spondaic; ""spondaize verses""",
81984,verb,"compose a sonnet",
81985,verb,"praise in a sonnet",
81986,noun,"the author of a mournful poem lamenting the dead",
81987,noun,"a poet who writes odes",
81988,noun,"a woman poet",
81989,noun,"a poet who is unofficially regarded as holding an honorary position in a particular group or region; ""she is the poet laureate of all lyricists""; ""he is the poet laureate of Arkansas""",
81990,noun,"a poet who writes sonnets",
81991,noun,"French poet; precursor of surrealism (1880-1918)",
81992,noun,"English poet and literary critic (1822-1888)",
81993,noun,"United States poet (born in England) (1907-1973)",
81994,noun,"a French poet noted for macabre imagery and evocative language (1821-1867)",
81995,noun,"United States poet; brother of William Rose Benet (1898-1943)",
81996,noun,"Russian poet (1880-1921)",
81997,noun,"Italian poet (born in France) (1313-1375)",
81998,noun,"poet in colonial America (born in England) (1612-1672)",
81999,noun,"English lyric poet (1887-1915)",
82000,noun,"English poet best remembered for love sonnets written to her husband Robert Browning (1806-1861)",
82001,noun,"English poet and husband of Elizabeth Barrett Browning noted for his dramatic monologues (1812-1889)",
82002,noun,"celebrated Scottish poet (1759-1796)",
82003,noun,"English romantic poet notorious for his rebellious and unconventional lifestyle (1788-1824)",
82004,noun,"Italian poet considered the national poet of modern Italy (1835-1907)",
82005,noun,"Englishman and Cavalier poet whose lyric poetry was favored by Charles I (1595-1639)",
82006,noun,"Roman lyric poet remembered for his love poems to an aristocratic Roman woman (84-54 BC)",
82007,noun,"English poet remembered as author of the Canterbury Tales (1340-1400)",
82008,noun,"United States poet and critic (1916-1986)",
82009,noun,"English romantic poet (1772-1834)",
82010,noun,"English poet who wrote hymns and poetry about nature (1731-1800)",
82011,noun,"Anglo-Saxon poet (circa 9th century)",
82012,noun,"an Italian poet famous for writing the Divine Comedy that describes a journey through hell and purgatory and paradise guided by Virgil and his idealized Beatrice (1265-1321)",
82013,noun,"English poet remembered for his verse for children (1873-1956)",
82014,noun,"United States poet noted for her mystical and unrhymed poems (1830-1886)",
82015,noun,"United States poet of the beat generation (1926-1997)",
82016,noun,"a Spanish poet whose work was characterized by an affected elegance of style (1561-1627)",
82017,noun,"English lyric poet (1591-1674)",
82018,noun,"Greek poet whose existing works describe rural life and the genealogies of the gods and the beginning of the world (eighth century BC)",
82019,noun,"German poet who wrote libretti for operas by Richard Strauss (1874-1929)",
82020,noun,"Scottish writer of rustic verse (1770-1835)",
82021,noun,"English poet (1844-1889)",
82022,noun,"Roman lyric poet said to have influenced English poetry (65-8 BC)",
82023,noun,"English poet (1859-1936)",
82024,noun,"English poet (born in 1930)",
82025,noun,"United States poet (1914-1965)",
82026,noun,"United States poet who wrote about California (1887-1962)",
82027,noun,"Spanish lyric poet (1881-1958)",
82028,noun,"Swedish poet whose works incorporate Swedish customs and folklore (1864-1931)",
82029,noun,"Englishman and romantic poet (1795-1821)",
82030,noun,"German poet (1724-1803)",
82031,noun,"United States poet who traveled the country trading his poems for room and board (1879-1931)",
82032,noun,"Chinese lyric poet (700-762)",
82033,noun,"United States poet remembered for his long narrative poems (1807-1882)",
82034,noun,"English poet (1618-1857)",
82035,noun,"United States poet (1874-1925)",
82036,noun,"United States poet (1917-1977)",
82037,noun,"United States poet (1892-1982)",
82038,noun,"French symbolist poet noted for his free verse (1842-1898)",
82039,noun,"Russian poet who died in a prison camp (1891-1938)",
82040,noun,"Italian poet (1569-1625)",
82041,noun,"Cuban poet and revolutionary who fought for Cuban independence from Spain (1853-1895)",
82042,noun,"English poet (1621-1678)",
82043,noun,"English poet (1878-1967)",
82044,noun,"United States poet (1869-1950)",
82045,noun,"Soviet poet; leader of Russian futurism (1893-1930)",
82046,noun,"English poet; remembered primarily as the author of an epic poem describing humanity's fall from grace (1608-1674)",
82047,noun,"United States poet noted for irony and wit (1887-1872)",
82048,noun,"Irish poet who wrote nostalgic and patriotic verse (1779-1852)",
82049,noun,"Chilean poet (1904-1973)",
82050,noun,"English poet (1880-1958)",
82051,noun,"English poet (1824-1897)",
82052,noun,"an Italian poet famous for love lyrics (1304-1374)",
82053,noun,"Greek lyric poet remembered for his odes (518?-438? BC)",
82054,noun,"English poet and satirist (1688-1744)",
82055,noun,"Russian poet (1799-1837)",
82056,noun,"United States poet (1849-1916)",
82057,noun,"German poet (born in Austria) whose imagery and mystic lyricism influenced 20th-century German literature (1875-1926)",
82058,noun,"French poet whose work influenced the surrealists (1854-1891)",
82059,noun,"United States poet; author of narrative verse (1869-1935)",
82060,noun,"United States poet killed in World War I (1888-1916)",
82061,noun,"United States poet (1928-1974)",
82062,noun,"Englishman and romantic poet (1792-1822)",
82063,noun,"Ukranian poet (1814-1861)",
82064,noun,"English poet (1554-1586)",
82065,noun,"English poet (1887-1964)",
82066,noun,"English poet and friend of Wordsworth and Coleridge (1774-1843)",
82067,noun,"English poet and critic (1909-1995)",
82068,noun,"English poet who wrote an allegorical romance celebrating Elizabeth I in the Spenserian stanza (1552-1599)",
82069,noun,"United States poet (1879-1955)",
82070,noun,"English poet (1837-1909)",
82071,noun,"English poet (1865-1945)",
82072,noun,"Italian poet who wrote an epic poem about the capture of Jerusalem during the First Crusade (1544-1595)",
82073,noun,"United States poet (1884-1933)",
82074,noun,"Englishman and Victorian poet (1809-1892)",
82075,noun,"Greek poet who is said to have originated Greek tragedy (sixth century BC)",
82076,noun,"Welsh poet (1914-1953)",
82077,noun,"American satirical poet (1750-1831)",
82078,noun,"French poet (born in Romania) who was one of the cofounders of the dada movement (1896-1963)",
82079,noun,"German romantic poet (1787-1862)",
82080,noun,"French symbolist poet (1844-1896)",
82081,noun,"French poet (flourished around 1460)",
82082,noun,"a Roman poet; author of the epic poem `Aeneid' (70-19 BC)",
82083,noun,"Russian poet (born in 1933)",
82084,noun,"English poet and theologian (1674-1748)",
82085,noun,"American poet (born in Africa) who was the first recognized Black writer in America (1753-1784)",
82086,noun,"United States poet who celebrated the greatness of America (1819-1892)",
82087,noun,"United States poet best known for his nostalgic poems about New England (1807-1892)",
82088,noun,"United States poet (1883-1963)",
82089,noun,"a romantic English poet whose work was inspired by the Lake District where he spent most of his life (1770-1850)",
82090,noun,"English poet who introduced the sonnet form to English literature (1503-1542)",
82091,noun,"United States poet (1885-1928)",
82092,noun,"Russian poet who expressed the feelings of the post-Stalinist generation (born in 1933)",
82093,noun,"English poet (1683-1765)",
82094,noun,"United States poet (1892-1950)",
82095,adjective,"characteristic of or befitting poetry; ""poetic diction""",
82096,noun,"study of poetic works",
82097,noun,"any communication resembling poetry in beauty or the evocation of feeling",
82098,noun,"a state of deeply felt distress or sorrow; ""a moment of extraordinary poignancy""",
82099,adjective,"arousing affect; ""the homecoming of the released hostages was an affecting scene""; ""poignant grief cannot endure forever""; ""his gratitude was simple and touching""",
82100,noun,"a point one third of the way along a line drawn from the hip to the umbilicus; the point of maximum sensitivity in acute appendicitis",
82101,noun,"a point of congestion or blockage; ""the bridge is always a chokepoint at rush hour""",
82102,noun,"the point of detonation (or above or below) of a nuclear weapon",
82103,noun,"a point of relatively intense heat or radiation",
82104,noun,"some point in the air; above ground level; ""the planes collided in midair""",
82105,noun,"the appropriate or customary location; ""the cars were in position""",
82106,noun,"the point beyond which something disappears or ceases to exist",
82107,noun,"the decisive point",
82108,noun,"a point or principle on which scattered or opposing groups can come together",
82109,noun,"an especially persuasive point helping to support an argument or discussion",
82110,noun,"the time at which a public conveyance is scheduled to arrive at a given destination",
82111,noun,"middle of an academic term or a political term in office",
82112,noun,"the time at which a (software or multimedia) program is run",
82113,noun,"the point in time at which an entertainment (a movie or television show etc.) is scheduled to begin",
82114,noun,"that time; that moment; ""we will arrive before then""; ""we were friends from then on""",
82115,noun,"a style in speech or writing that arrests attention and has a penetrating or convincing quality or effect",
82116,noun,"a very hard small point made from a diamond",
82117,noun,"the compass point that is one point east (clockwise) of due north",
82118,noun,"the compass point that is midway between north and northeast",
82119,noun,"the compass point that is one point north of northeast",
82120,noun,"the compass point that is one point east of northeast",
82121,noun,"the compass point midway between northeast and east",
82122,noun,"the compass point that is one point north of due east",
82123,noun,"the compass point that is one point south of due east",
82124,noun,"the compass point midway between east and southeast",
82125,noun,"the compass point that is one point east of southeast",
82126,noun,"the compass point midway between south and east; at 135 degrees",
82127,noun,"the compass point that is one point south of southeast",
82128,noun,"the compass point midway between south and southeast",
82129,noun,"the compass point that is one point east of due south",
82130,noun,"the compass point that is one point west of due south",
82131,noun,"the compass point midway between south and southwest",
82132,noun,"the compass point that is one point south of southwest",
82133,noun,"the compass point midway between south and west; at 225 degrees",
82134,noun,"the compass point that is one point west of southwest",
82135,noun,"the compass point midway between west and southwest",
82136,noun,"the compass point that is one point south of due west",
82137,noun,"the compass point that is one point north of due west",
82138,noun,"the compass point midway between west and northwest",
82139,noun,"the compass point that is one point west of northwest",
82140,noun,"the compass point that is one point north of northwest",
82141,noun,"the compass point that is midway between north and northwest",
82142,noun,"the compass point that is one point west of due north",
82143,noun,"the property of a shape that tapers to a sharp tip",
82144,noun,"the property possessed by a shape that narrows toward a point (as a wedge or cone)",
82145,noun,"a characteristic of something that is up for sale that makes it attractive to potential customers",
