ID,POS,Gloss
81263,noun,"a genus of thorny herbs or shrubs of the family Rosaceae",
81264,noun,"leaves sometimes used for salad",
81265,noun,"chiefly Old World herbs",
81266,noun,"herb with scarlet or white or purple blossoms that close at approach of rainy weather",
81267,noun,"small creeping European herb having delicate pink flowers",
81268,adjective,"(of complexion) blemished by imperfections of the skin",
81269,verb,"drive a skewer through; ""skewer the meat for the BBQ""",
81270,noun,"small pin usually worn in groups of two or more",
81271,noun,"a decorative pin that is worn in a necktie",
81272,noun,"a pin used to hold the tie in place",
81273,noun,"cylindrical tumblers consisting of two parts that are held in place by springs; when they are aligned with a key the bolt can be thrown",
81274,noun,"a pin through the bitthead to keep the mooring lines from slipping off",
81275,noun,"a long sturdy pin used by women to secure a hat to their hair",
81276,noun,"a pin in the form of a clasp; has a guard so the point of the pin will not stick the user",
81277,noun,"a long pin for holding meat in position while it is being roasted",
81278,noun,"pin consisting of a short straight stiff piece of wire with a pointed end; used to fasten pieces of cloth or paper together",
81279,noun,"pin joining a piston to a connecting rod",
81280,noun,"a bowling pin that is thin by comparison with a tenpin",
81281,noun,"a bowling pin that is short and squat by comparison with a tenpin",
81282,noun,"one of the bottle-shaped pins used in bowling",
81283,noun,"a wrench that has a projecting pin that fits into a socket on the object to be turned",
81284,noun,"a hand tool for holding consisting of a compound lever for grasping",
81285,noun,"metal tweezers used by marijuana smokers to hold a roach",
81286,verb,"remove the stalk of fruits or berries",
81287,noun,"a squeeze with the fingers",
81288,noun,"type genus of the Pinaceae: large genus of true pines",
81289,noun,"any of several low-growing pines of western North America",
81290,noun,"large two-needled pine of southeastern United States with light soft wood",
81291,noun,"large two-needled timber pine of southeastern Europe",
81292,noun,"large three-needled pine of the eastern United States and southeastern Canada; closely related to the pond pine",
81293,noun,"large three-needled pine of sandy swamps of southeastern United States; needles longer than those of the northern pitch pine",
81294,noun,"medium-sized two-needled pine of southern Europe having a spreading crown; widely cultivated for its sweet seeds that resemble almonds",
81295,noun,"large five-needled European pine; yields cembra nuts and a resinous exudate",
81296,noun,"low shrubby pine of central Europe with short bright green needles in bunches of two",
81297,noun,"small slow-growing pine of western United States similar to the bristlecone pine; chocolate brown bark in plates and short needles in bunches of 5; crown conic but becoming rough and twisted; oldest plant in the world growing to 5000 years in cold semidesert mountain tops",
81298,noun,"any of several five-needled pines with white wood and smooth usually light grey bark when young; especially the eastern white pine",
81299,noun,"tall symmetrical pine of western North America having long blue-green needles in bunches of 3 and elongated cones on spreading somewhat pendulous branches; sometimes classified as a variety of ponderosa pine",
81300,noun,"shrubby two-needled pine of coastal northwestern United States; red to yellow-brown bark fissured into small squares",
81301,noun,"tall subspecies of lodgepole pine",
81302,noun,"tall spreading three-needled pine of southeastern United States having reddish-brown fissured bark and a full bushy upper head",
81303,noun,"slender medium-sized two-needled pine of eastern North America; with yellow-green needles and scaly grey to red-brown fissured bark",
81304,noun,"any of several pines that prefer or endure moist situations such as loblolly pine or longleaf pine",
81305,noun,"pine of eastern North America having long needles in bunches of two and reddish bark",
81306,noun,"medium large two-needled pine of northern Europe and Asia having flaking red-brown bark",
81307,noun,"common small shrubby pine of the eastern United States having straggling often twisted or branches and short needles in bunches of 2",
81308,noun,"tall California pine with long needles in bunches of 3, a dense crown, and dark brown deeply fissured bark",
81309,noun,"small slow-growing upland pine of western United States (Rocky Mountains) having dense branches with fissured rust-brown bark and short needles in bunches of 5 and thorn-tipped cone scales; among the oldest living things some over 4500 years old",
81310,noun,"a small two-needled upland pine of the eastern United States (Appalachians) having dark brown flaking bark and thorn-tipped cone scales",
81311,noun,"medium-sized three-needled pine of the Pacific coast of the United States having a prominent knob on each scale of the cone",
81312,noun,"pine native to Japan and Korea having a wide-spreading irregular crown when mature; grown as an ornamental",
81313,noun,"large Japanese ornamental having long needles in bunches of 2; widely planted in United States because of its resistance to salt and smog",
81314,noun,"medium-sized five-needled pine of southwestern California having long cylindrical cones",
81315,noun,"straight-grained durable and often resinous white to yellowish timber of any of numerous trees of the genus Pinus",
81316,noun,"pine lumber with many knots; used especially for paneling and furniture",
81317,noun,"soft white wood of white pine trees",
81318,noun,"hard yellowish wood of a yellow pine",
81319,adjective,"having the form of a pine cone",
81320,noun,"a genus of tropical American plants have sword-shaped leaves and a fleshy compound fruits composed of the fruits of several flowers (such as pineapples)",
81321,noun,"large sweet fleshy tropical fruit with a terminal tuft of stiff leaves; widely cultivated",
81322,noun,"a river in western Thailand; a major tributary of the Chao Phraya",
81323,noun,"a country of southeastern Asia that extends southward along the Isthmus of Kra to the Malay peninsula; ""Thailand is the official name of the former Siam""",
81324,noun,"a sharp high-pitched resonant sound (as of a sonar echo or a bullet striking metal)",
81325,noun,"a small pinion having cylindrical bars instead of teeth, used chiefly in inexpensive clocks",
81326,noun,"one of the main flight feathers projecting along the outer edge of a bird's wing",
81327,noun,"feather growing from the tail (uropygium) of a bird",
81328,noun,"the quality of being pink",
81329,noun,"a dusty pink color",
81330,noun,"a pink dye that was discovered in 1859, the year a battle was fought at Solferino",
81331,noun,"Eurasian pink widely cultivated for its flat-topped dense clusters of varicolored flowers",
81332,noun,"Chinese pink with deeply toothed rose-lilac flowers with a purplish eye; usually raised as an annual",
81333,noun,"low-growing loosely mat-forming Eurasian pink with a single pale pink flower with a crimson center",
81334,noun,"mat-forming perennial of central Europe with large fragrant pink or red flowers",
81335,noun,"much-branched pink with flowers in clusters; closely related to sweet William",
81336,noun,"European pink cultivated for its very fragrant pink or rosy flowers",
81337,noun,"Eurasian perennial pink having fragrant lilac or rose flowers with deeply fringed margins",
81338,verb,"surmount with a pinnacle; ""pinnacle a pediment""",
81339,noun,"any of several pinons bearing edible nutlike seeds",
81340,noun,"two-needled or three-needled pinon mostly of northwestern California coast",
81341,noun,"very small tree similar to Rocky mountain pinon but having a single needle per fascicle; similar to Parry's pinyon in range",
81342,noun,"five-needled pinon of southern California and northern Baja California having (sometimes three-needled or four-needled showing hybridization from Pinus californiarum)",
81343,adjective,"meticulously precise; ""pinpoint accuracy""",
81344,noun,"the sharp point of a pin",
81345,noun,"small puncture (as if made by a pin)",
81346,noun,"a sharp tingling sensation from lack of circulation",
81347,noun,"a somatic sensation as from many tiny prickles",
81348,noun,"a suit made from a fabric with very thin stripes",
81349,noun,"a United States dry unit equal to 0.5 quart or 33.6 cubic inches",
81350,noun,"perennial subshrub of Tenerife having leaves in rosettes resembling pinwheels",
81351,noun,"a genus of plants of the family Crassulaceae",
81352,noun,"a wheel that has numerous pins that are set at right angles to its rim; ""he spun the pinwheel and it stopped with the pointer on `Go'""",
81353,noun,"a toy consisting of vanes of colored paper or plastic that is pinned to a stick and spins when it is pointed into the wind",
81354,noun,"small threadlike worm infesting human intestines and rectum especially in children",
81355,noun,pinworms,
81356,noun,"a dweller in the Australian bush country",
81357,noun,"United States pioneer and hero of the Texas revolt against Mexico; he shared command of the garrison that resisted the Mexican attack on the Alamo where he died (1796-1836)",
81358,adjective,"disposed to pray or appearing to pray",
81359,verb,"shoot one by one",
81360,noun,"a disease of poultry",
81361,noun,"a small hard seed found in some fruits",
81362,noun,"a short earthenware pipe on the top of a chimney to increase the draft",
81363,noun,"a series of tube (joined by screwed collars) that connects a drilling platform to the drilling bit; rotates the bit and supplies drilling mud",
81364,noun,"a pipe that carries gasoline from a tank to a gasoline engine; ""the car wouldn't start because dirt clogged the gas line""",
81365,noun,"a vertical pipe in a building",
81366,noun,"a horizontal pipe having fine holes drilled throughout its length so as to deliver a spray of water",
81367,noun,"a vertical pipe",
81368,noun,"a pipe conducting steam",
81369,noun,"fig tree of India noted for great size and longevity; lacks the prop roots of the banyan; regarded as sacred by Buddhists",
81370,verb,"transport by pipeline; ""pipe oil, water, and gas into the desert""",
81371,noun,"a pipe for smoking; has a curved stem and a large bowl made from a calabash gourd",
81372,noun,"the tube of a tobacco pipe",
81373,noun,"a small pipe sounding a tone of standard frequency; used to establish the starting pitch for unaccompanied singing",
81374,noun,"organ pipe with a vibrating reed",
81375,noun,"cleaning implement consisting of a flexible tufted wire that is used to clean a pipe stem",
81376,noun,"a hand tool for cutting pipe",
81377,noun,"pipefitting that joins two pipes of different diameter",
81378,noun,"adjustable wrench for gripping and turning a pipe; has two serrated jaws that are adjusted to grip the pipe",
81379,noun,"a large pipe wrench with L-shaped adjustable jaws that tighten as pressure on the handle is increased",
81380,noun,"the quantity of tobacco that can be smoked in a pipe at one time",
81381,noun,"tropical woody vines and herbaceous plants having aromatic herbage and minute flowers in spikelets",
81382,noun,"slender tropical climber of the eastern Himalayas",
81383,noun,"Asian pepper plant whose dried leaves are chewed with betel nut (seed of the betel palm) by southeast Asians",
81384,noun,"playing a pipe or the bagpipes",
81385,noun,"the act of playing a musical instrument",
81386,noun,"small genus of evergreen herbs with long creeping rootstocks and shining leaves; North America; Europe; east Asia",
81387,noun,"Eurasian herb with white or pinkish flowers in a terminal corymb",
81388,noun,"the quality of being agreeably stimulating or mentally exciting",
81389,adjective,"having an agreeably pungent taste",
81390,adjective,"engagingly stimulating or provocative; ""a piquant wit""; ""salty language""",
81391,adjective,"rousing or quickening activity or the senses; ""a stimulating discussion""",
81392,noun,"hijacking on the high seas or in similar contexts; taking a ship or plane away from the control of those who are legally entitled to it; ""air piracy""",
81393,noun,"robbery of a traveller or vehicle in transit or seizing control of a vehicle by the use of force",
81394,noun,"the act of plagiarizing; taking someone's words or ideas as if they were your own",
81395,noun,"someone who uses another person's words or ideas as if they were his own",
81396,verb,"do a pirouette, usually as part of a dance",
81397,verb,"turn on a pivot",
81398,noun,"small tree of southern Europe and Asia Minor bearing small hard-shelled nuts",
81399,noun,"nut of Mediterranean trees having an edible green kernel",
81400,noun,"consists of one carpel",
81401,noun,"consists of two or more fused carpels",
81402,noun,"a sterile vestigial pistil remaining in a staminate flower",
81403,noun,"a .45-caliber pistol",
81404,noun,"a large pistol (usually in a holster) formerly carried by horsemen",
81405,noun,"the pistol of a law officer in the old West",
81406,noun,"a cheap handgun that is easily obtained",
81407,noun,"a pistol that is a semiautomatic firearm capable of loading and firing continuously",
81408,noun,"a pistol for firing Very-light flares",
81409,noun,"a crude homemade pistol",
81410,noun,"someone armed with a pistol (especially a soldier so armed)",
81411,noun,"mechanical device that has a plunging or thrusting motion",
81412,noun,"seal consisting of a split metal ring that seals the gap between a piston and the cylinder wall",
81413,noun,"connecting rod that moves or is moved by a piston",
81414,verb,"remove the pits from; ""pit plums and cherries""",
81415,noun,"a trap in the form of a concealed hole",
81416,noun,"a quarry for chalk",
81417,noun,"a quarry for gravel",
81418,noun,"a sloping pit with a stake in the middle used as an obstacle to the enemy",
81419,verb,"set to a certain pitch; ""He pitched his voice very low""",
81420,verb,"lead (a card) and establish the trump suit",
81421,noun,"the pitch used to tune instruments for concert performances; usually assigns 440 Hz to the A above middle C",
81422,noun,"the pitch range of the highest female voice",
81423,noun,"the pitch range of the highest male voice",
81424,noun,"the property of producing accurately a note of a given pitch; ""he cannot sing in tune""; ""the clarinet was out of tune""",
81425,noun,"promotion by means of an argument and demonstration",
81426,noun,"the action or manner of throwing something; ""his pitch fell short and his hat landed on the floor""",
81427,noun,"a mineral consisting of uranium oxide and trace amounts of radium and thorium and polonium and lead and helium; uraninite in massive form is called pitchblende which is the chief uranium ore",
81428,noun,"a battle in northern France in which English longbowmen under Henry V decisively defeated a much larger French army in 1415",
81429,noun,"a decisive battle during the Napoleonic campaigns (1805); the French under Napoleon defeated the Russian armies of Czar Alexander I and the Austrian armies of Emperor Francis II",
81430,noun,"a battle in which the Scots under Robert the Bruce defeated the English and assured the independence of Scotland",
81431,noun,"a battle in 680 in which the grandson of Mohammed and his followers were killed; ""the Battle of Kerbala is the basis for the Ta'ziyehs that are performed annually""",
81432,noun,"a battle during World War II; in December 1944 von Rundstedt launched a powerful counteroffensive in the forest at Ardennes and caught the Allies by surprise",
81433,noun,"a World War I battle in northwestern France where the Allies defeated the Germans in 1918",
81434,noun,"Napoleon defeated the Russians in 1812 in a pitched battle at a village in western Russia west of Moscow, but irreparably weakened his army",
81435,noun,"the battle that ended the Wars of the Roses (1485); Richard III was killed and Henry Tudor was crowned as Henry VII",
81436,noun,"in 1214 the French under Philip Augustus defeated a coalition formed against him in one of the greatest battles of the middle ages",
81437,noun,"a battle in the War of the Grand Alliance in Ireland in 1690; William III defeated the deposed James II and so ended the Catholicism that had been reintroduced in England by the Stuarts",
81438,noun,"a battle in 937 when Athelstan defeated the Scots",
81439,noun,"a pitched battle in the Mexican War in 1847; United States forces under Zachary Taylor defeated the Mexican forces under Santa Anna at a locality in northern Mexico",
81440,noun,"either of two battles during the American Civil War (1861 and 1862); Confederate forces defeated the Federal army in both battles",
81441,noun,"the first important battle of the American War of Independence (1775) which was fought at Breed's Hill; the British defeated the colonial forces",
81442,noun,"ancient city is southeastern Italy where Hannibal defeated the Romans in 216 BC",
81443,noun,"battle of World War I (1917); Italians were defeated by the Austrian and German forces",
81444,noun,"a battle in the Apennines in 321 BC in which the Samnites defeated the Romans",
81445,noun,"the battle in which Attila the Hun was defeated by the Romans and Visigoths in 451",
81446,noun,"a major battle in the American Civil War (1863); the Confederates under Robert E. Lee defeated the Union forces under Joseph Hooker",
81447,noun,"a pitched battle in the Mexican War that resulted in a major victory for American forces over Mexican forces at a locality south of Mexico City (1847)",
81448,noun,"in the American Civil War (1863) the Union armies of Hooker, Thomas, and Sherman under the command of Ulysses S. Grant won a decisive victory over the Confederate Army under Braxton Bragg",
81449,noun,"a Confederate victory in the American Civil War (1863); Confederate forces under Braxton Bragg defeated Union forces",
81450,noun,"battle in the American Revolution; Americans under Daniel Morgan defeated the British",
81451,noun,"the first decisive battle of the Hundred Years' War; in 1346 the English under Edward III defeated the French under Philip of Valois",
81452,noun,"the battle that ended the second Macedonian War (197 BC); the Romans defeated Philip V who lost his control of Greece",
81453,noun,"a battle in 1745 in which the French army under Marshal Saxe defeated the English army and their allies under the duke of Cumberland",
81454,noun,"a pitched battle in which American revolutionary troops captured Fort Ticonderoga from the British in 1775",
81455,noun,"an important battle in the American Civil War (1862); the Union's army under A. E. Burnside was defeated by the Confederate army under Robert E. Lee",
81456,noun,"a battle in World War II in the Pacific (1942-1943); the island was occupied by the Japanese and later recaptured by American forces",
81457,noun,"a battle during the Napoleonic Wars (1800); the French defeated the Austrians",
81458,noun,"a battle (1590) in which the Huguenots under Henry IV defeated the Catholics under the duke of Mayenne",
81459,noun,"battle of the American Civil War (1864); Union forces under William Tecumseh Sherman were repulsed by Confederate troops under Joseph Eggleston Johnston",
81460,noun,"a battle in 217 BC in which Hannibal ambushed a Roman army led by Flaminius",
81461,noun,"(1568) Catholic forces supporting Mary Queen of Scots were routed by Protestants",
81462,noun,"the principal battle of the Balkan Wars (1912); Bulgarian forces defeated the Turks",
81463,noun,"a battle in 1859 in which the French and Sardinian forces under Napoleon III defeated the Austrians under Francis Joseph I",
81464,noun,"a battle in 1800 in which the French under Napoleon Bonaparte won a great victory over the Austrians",
81465,noun,"a battle during the second Punic War (207 BC); Hannibal's brother Hasdrubal was defeated by the Romans which ended Hannibal's hopes for success in Italy",
81466,noun,"a battle (1898) in which an English and Egyptian army under Kitchener defeated the Sudanese",
81467,noun,"Octavian and Mark Antony defeated Brutus and Cassius in 42 BC",
81468,noun,"a defeat of the Persian army by the Greeks at Plataea in 479 BC",
81469,noun,"the battle in 1356 in which the English under the Black Prince defeated the French",
81470,noun,"a battle in which Mexican forces defeated the French in 1862",
81471,noun,"a major victory by the Romans over the Macedonians in 168 BC; resulted in the downfall of the ancient Macedonian kingdom",
81472,noun,"a battle between the French and an alliance of Spaniards and Swiss and Venetians in 1512",
81473,noun,"a battle in the Thirty Years' War (1643); the French defeated the Spanish invaders",
81474,noun,"a battle in the Meuse-Argonne operation in World War I (1918); the battle in which American troops launched their first offensive in France",
81475,noun,"a battle during the American Revolution (1777); the British under Burgoyne were defeated",
81476,noun,"the Swiss Confederation escaped Hapsburg domination by their victory in 1386",
81477,noun,"the second great battle of the American Civil War (1862); the battle ended with the withdrawal of Confederate troops but it was not a Union victory",
81478,noun,"a battle in World War I (May 1918); the Germans tried to attack before the American numbers were too great to defeat; the tactical success of the Germans proved to be a strategic failure",
81479,noun,"an indecisive battle in 1859 between the French and Sardinians under Napoleon III and the Austrians under Francis Joseph I",
81480,noun,"battle in World War I (1916)",
81481,noun,"battle of World War II (1944)",
81482,noun,"a battle between the armies of Grant and Lee during the Wilderness Campaign",
81483,noun,"a battle in World War I (1914); decisive German victory over the Russians",
81484,noun,"a battle in France in 687 among the descendants of Clovis",
81485,noun,"a battle in central Italy where Hannibal defeated the Romans under Flaminius in 217 BC",
81486,noun,"the French defeated the Austrian and Prussian troops in 1792 (with a famous cannonade from the French artillery)",
81487,noun,"a battle in World War I (1916); in some of the bloodiest fighting in World War I the German offensive was stopped",
81488,noun,"a battle in the Napoleonic campaigns (1809); Napoleon defeated the Austrians",
81489,noun,"the battle on 18 June 1815 in which Prussian and British forces under Blucher and the Duke of Wellington routed the French forces under Napoleon",
81490,noun,"a battle in the Korean War (November 1950); when UN troops advanced north to the Yalu River 200,000 Chinese troops crossed the river and drove them back",
81491,noun,"battle in World War I (1914); heavy but indecisive fighting as the Allies and the Germans both tried to break through the lines of the others",
81492,noun,"battle in World War I (1915); Germans wanted to try chlorine (a toxic yellow gas) as a weapon and succeeded in taking considerable territory from the Allied salient",
81493,noun,"battle in World War I (1917); an Allied offensive which eventually failed because tanks bogged down in the waterlogged soil of Flanders; Germans introduced mustard gas which interfered with the Allied artillery",
81494,noun,"the battle in 202 BC in which Scipio decisively defeated Hannibal at the end of the second Punic War",
81495,noun,"the quantity contained in a pitcher",
81496,noun,"a long-handled hand tool with sharp widely spaced prongs for lifting and pitching hay",
81497,verb,"remove the pith from (a plant)",
81498,adjective,"having abnormal size with overgrown extremities resulting from abnormal pituitary secretion; ""a protruding acromegalic jaw""; ""a pituitary dwarf""",
81499,noun,"the funnel-shaped stalk connecting the pituitary gland to the hypothalamus",
81500,noun,"the act of turning on (or as if on) a pivot; ""the golfer went to the driving range to practice his pivot""",
81501,noun,"one species: pyxie; the eastern United States",
81502,noun,"tomato and cheese pizza with sausage",
81503,noun,"tomato and cheese pizza with pepperoni",
81504,noun,"pizza with lots of cheese",
81505,noun,"tomato and cheese pizza with anchovies",
81506,noun,"pizza made with a thick crust",
81507,adjective,"(of instruments in the violin family) to be plucked with the finger",
81508,adjective,"capable of being pacified",
81509,verb,"post in a public place",
81510,adjective,"tending or intended to pacify by acceding to demands or granting concessions; ""the appeasing concessions to the Nazis at Munich""; ""placating (or placative) gestures""; ""an astonishingly placatory speech""",
81511,adjective,"intended or likely to overcome animosity or hostility; ""spoke in a conciliating tone""; ""a conciliatory visit""",
81512,verb,"take a place in a competition; often followed by an ordinal; ""Jerry came in third in the Marathon""",
81513,verb,"finish second or better in a horse or dog race; ""he bet $2 on number six to place""",
81514,verb,"sing a note with the correct pitch",
81515,noun,"a place where voters go to cast their votes in an election",
81516,noun,"a small unpretentious out-of-the-way place; ""his office was a hole-in-the-wall""",
81517,noun,"a place suitable for nesting",
81518,noun,"a place where people meet; ""he was waiting for them at the rendezvous""",
81519,noun,"a place that is scoured (especially by running water)",
81520,noun,"place on a highway providing garage services and eating and toilet facilities",
81521,noun,"a place that is frequently exhibited and visited for its historical interest or natural beauty",
81522,noun,"a solitary place",
81523,noun,"the location of the target that is to be hit",
81524,noun,"something resembling a pool of liquid; ""he stood in a pool of light""; ""his chair sat in a puddle of books and magazines""",
81525,noun,"a cooler darker spot appearing periodically on the sun's photosphere; associated with a strong magnetic field",
