ID,POS,Gloss
89191,noun,"a sorter for sorting mail according to the address",
89192,noun,"an internationally recognized distress signal in radio code",
89193,noun,"the branch of Christian theology that deals with salvation as the effect of a divine agency",
89194,noun,"a minor female role as a pert flirtatious lady's maid in a comedy",
89195,noun,"a fine quality of black tea native to China",
89196,noun,"puffy dish of cheese and eggs (whites beaten separately) and white sauce",
89197,noun,"a fellow Black man",
89198,adjective,"full of or expressing deep emotion; ""soulful eyes""; ""soulful music""",
89199,adjective,"firm and dependable; subject to little fluctuation; ""the economy is stable""",
89200,adjective,"logically valid; ""a sound argument""",
89201,verb,"make a cackling sound; ""The fire cackled cozily""",
89202,verb,"be dissonant or harsh; ""The violins in this piece dissonated disturbingly""",
89203,verb,"make a characteristic or natural sound; ""The drums spoke""",
89204,verb,"cause to sound with a twang; ""He twanged the guitar string""",
89205,verb,"cause to make a ting",
89206,verb,"sound the strings of (a string instrument); ""strum a guitar""",
89207,noun,"characterized by loud and constant noise",
89208,noun,"the distinctive quality or pitch or condition of a person's speech; ""A shrill voice sounded behind us""",
89209,noun,"mechanical vibrations transmitted by an elastic medium; ""falling trees make a sound in the forest even when no one is there to hear them""",
89210,noun,"very high frequency sound; used in ultrasonography",
89211,noun,"a short high tone produced as a signal or warning",
89212,noun,"a succession of clicks",
89213,noun,"sound of strumming; ""the strum of a guitar""",
89214,noun,"the indistinct sound of people whispering; ""a soft susurrus of conversation""",
89215,noun,"a brushing or rustling sound",
89216,noun,"the sound of light blow or knock; ""he heard the tapping of the man's cane""",
89217,noun,"a sound with a strong rhythmic beat; ""the throbbing of the engines""",
89218,noun,"a thrumming sound; ""he could hear the thrum of a banjo""",
89219,noun,"a dull hollow sound; ""the basketball made a thunk as it hit the rim""",
89220,noun,"a metallic tapping sound; ""he counted the ticks of the clock""",
89221,noun,"a light clear metallic sound as of a small bell",
89222,noun,"a blast of a horn",
89223,noun,"the sound of casual playing on a musical instrument; ""he enjoyed hearing the tootles of their horns as the musicians warmed up""",
89224,noun,"the sound of heavy treading or stomping; ""he heard the trample of many feet""",
89225,noun,"a sharp vibrating sound (as of a plucked string)",
89226,noun,"a sound suggestive of a vocal utterance; ""the noisy voice of the waterfall""; ""the incessant voices of the artillery""",
89227,noun,"the roaring sound made by a motor that is running at high speed",
89228,noun,"the sound made by a sharp swift blow",
89229,noun,"the sound made by something moving rapidly or by steam coming out of a small aperture",
89230,noun,"a buzzing or hissing sound as of something traveling rapidly through the air; ""he heard the whiz of bullets near his head""",
89231,noun,"a brief high-pitched buzzing or humming sound; ""the zing of the passing bullet""",
89232,noun,"a tidal strait separating Manhattan and the Bronx from Queens and Brooklyn",
89233,noun,"a strait connecting the Bering Sea to the Arctic Ocean",
89234,noun,"a strait connecting the Mediterranean and the Black Sea; separates the European and Asian parts of Turkey; an important shipping route",
89235,noun,"a narrow strait separating the North Island and South Island in New Zealand",
89236,noun,"a strait in western California that connects the San Francisco Bay with the Pacific Ocean; discovered in 1579 by Sir Francis Drake",
89237,noun,"a strait of the North Sea between Jutland and Sweden; connects with the North Sea through the Skagerrak",
89238,noun,"a strait between Korea and Japan; connects the East China Sea and the Sea of Japan",
89239,noun,"a strait in northern Wales between Anglesey Island and the mainland",
89240,noun,"a strait between Northern Ireland and Scotland that connects the Atlantic Ocean and the Irish Sea",
89241,noun,"a broad strait of the North Sea between Jutland and Norway",
89242,noun,"a strait of the English Channel between the coast of Hampshire and the Isle of Wight",
89243,noun,"the strait separating Vancouver Island from the Canadian mainland",
89244,noun,"the strait between Spain and Africa",
89245,noun,"a strategically important strait linking the Persian Gulf and the Gulf of Oman",
89246,noun,"the strait separating South America from Tierra del Fuego and other islands south of the continent; discovered by Ferdinand Magellan in 1520; an important route around South America before the Panama Canal was built",
89247,noun,"the strait separating Sicily from the tip of Italy",
89248,noun,"the strait between the English Channel and the North Sea; shortest distance between England and the European continent",
89249,noun,"a strait between northeastern Australia and southern New Guinea that connects the Coral Sea with the Arafura Sea",
89250,noun,"a large ocean inlet or deep bay; ""the main body of the sound ran parallel to the coast""",
89251,noun,"an inlet of the Pacific Ocean off the coast of British Columbia",
89252,noun,"a movie camera that records sounds in synchrony with the visual images",
89253,noun,"a sound wave that is transmitted via air",
89254,noun,"a research rocket used to obtain information about the atmosphere at various altitudes",
89255,noun,"the soup that a restaurant is featuring on a given day",
89256,noun,"soup that contains small noodles in the shape of letters of the alphabet",
89257,noun,"a thick cream soup made from shellfish",
89258,noun,"soup made from chicken broth",
89259,noun,"soup made from chicken boiled with leeks",
89260,noun,"a soup made with chopped tomatoes and onions and cucumbers and peppers and herbs; served cold",
89261,noun,"soup cooked in a large pot",
89262,noun,"soup made from a calf's head or other meat in imitation of green turtle soup",
89263,noun,"a soup made from the skinned tail of an ox",
89264,noun,"a thick soup made of dried peas (usually made into a puree)",
89265,noun,"a soup made with vegetables and tripe and seasoned with peppercorns; often contains dumplings",
89266,noun,"soup usually made of the flesh of green turtles",
89267,noun,"made by stirring beaten eggs into a simmering broth",
89268,noun,"a soup with won ton dumplings",
89269,noun,"made of stock and split peas with onions carrots and celery",
89270,noun,"made of fresh green peas and stock with shredded lettuce onion and celery",
89271,noun,"made of stock and lentils with onions carrots and celery",
89272,noun,"a thick soup made from beef or mutton with vegetables and pearl barley",
89273,noun,"a creamy potato soup flavored with leeks and onions; usually served cold",
89274,adjective,"having the consistency and appearance of soup; ""a soupy fog""",
89275,adjective,"tasting sour like a lemon",
89276,adjective,"slightly sour to the taste",
89277,adjective,"one of the four basic taste sensations; like the taste of vinegar or lemons",
89278,noun,"a sour made with whiskey",
89279,noun,"any of several cultivated sour cherry trees bearing pale red fruit with colorless juice",
89280,noun,"any of several cultivated sour cherry trees bearing fruit with dark skin and juice",
89281,noun,"Dalmatian bitter wild cherry tree bearing fruit whose juice is made into maraschino liqueur",
89282,noun,"Australian tree with sour red fruit",
89283,noun,"tropical trees and shrubs with aromatic leaves and often valuable hard wood",
89284,noun,"pale red sour cherry with colorless or nearly colorless juice",
89285,noun,"cultivated sour cherry with dark-colored skin and juice",
89286,noun,"columnar tree of eastern North America having horizontal limbs and small leaves that emerge late in spring and have brilliant color in early fall",
89287,noun,"any whiskey distilled from sour mash",
89288,verb,"obtain goods or services from an outside supplier; to contract work out; ""Many companies outsource and hire consultants rather in order to maintain a flexible workforce""",
89289,noun,"publications from which information is obtained",
89290,noun,"a source of great wealth (especially a mine)",
89291,noun,"a good source of something that is desired",
89292,noun,"a language whose statements resemble terminology of the user",
89293,noun,"small tropical American tree bearing large succulent slightly acid fruit",
89294,noun,"large spiny tropical fruit with tart pulp related to custard apples",
89295,noun,"a bass horn (brass wind instrument) that is the tenor of the tuba family",
89296,noun,"the act of making something completely wet; ""he gave it a good drenching""",
89297,adjective,"moving toward the south; ""a southbound train""",
89298,adjective,"situated in the southern part of a centrally located area in some geographical region; ""south-central London""",
89299,adjective,"from the south; used especially of wind; ""a hot southerly wind""; ""southern breezes""; ""the winds are southerly""",
89300,adjective,"situated in or oriented toward the south; ""a southern exposure""; ""took a southerly course""",
89301,adjective,"situated farthest south; ""Key West is the southernmost city in the United States""",
89302,adjective,"situated in or oriented toward the southeast",
89303,adjective,"coming from the southeast; ""southeasterly breezes""",
89304,adjective,"toward the southeast",
89305,adjective,"situated in or oriented toward the southwest",
89306,adjective,"coming from the southwest; ""the winds are southwesterly""",
89307,adjective,"toward the southwest",
89308,noun,"the South of the United States before the American Civil War",
89309,noun,"the coastal plain of the South: eastern parts of Virginia and North Carolina and South Carolina and Georgia",
89310,noun,"the area of the states of North Carolina and South Carolina",
89311,noun,"a strong wind from the southeast",
89312,noun,"a wind from the south",
89313,adjective,"being in or of a region of the United States including the states of the lower Mississippi valley and east of the Rio Grande",
89314,noun,"a white male Southerner with an unpretentious convivial manner and conservative or intolerant attitudes and a strong sense of fellowship with and loyalty to other members of his peer group",
89315,noun,"a strong wind from the southwest",
89316,adjective,"of a region of the United States generally including New Mexico; Arizona; Texas; California; and sometimes Nevada; Utah; Colorado",
89317,noun,"a dialect of Middle English",
89318,noun,"government free from external control",
89319,noun,"an adult female hog",
89320,noun,"Old World genus of isopod crustaceans",
89321,noun,"type genus of the Oniscidae; woodlice that cannot roll into a ball",
89322,noun,"salt pork from the belly of a hog carcass",
89323,noun,"genus of Asiatic erect or sprawling herbs: soya bean",
89324,noun,"seeds used as livestock feed",
89325,noun,"a pump house at a spa where medicinal waters are pumped and where patrons gather",
89326,noun,"a place of business with equipment and facilities for exercising and improving physical fitness",
89327,noun,"a health spa that specializes in helping people lose weight",
89328,noun,"the small potential space between the parietal and visceral layers of the pleura",
89329,noun,"a space in the meninges beneath the arachnoid membrane and above the pia mater that contains the cerebrospinal fluid",
89330,noun,"the space created by the swing of a scythe or the cut of a mowing machine",
89331,noun,"an empty area or space; ""the huge desert voids""; ""the emptiness of outer space""; ""without their support he'll be ruling in a vacuum""",
89332,noun,"a space where automobiles are not allowed to park",
89333,noun,"a space where an automobile can be parked",
89334,noun,"level space where heavy guns can be mounted behind the parapet at the top of a rampart",
89335,noun,"space allocated for your work (as in an office)",
89336,noun,"either of two Soviet space stations launched in the 1970s",
89337,noun,"United States space station; in orbit from 1973 to 1979",
89338,noun,"a space vehicle that is designed to land on the moon or another planet",
89339,noun,"a spacecraft that carries astronauts from the command module to the surface of the moon and back",
89340,noun,"a reusable spacecraft with wings for a controlled descent through the Earth's atmosphere",
89341,noun,"a spacecraft designed to carry a crew into interstellar space (especially in science fiction)",
89342,noun,"without obstructions to passage or view; ""the openness of the prairies""",
89343,noun,"a sturdy hand shovel that can be pushed into the earth with the foot",
89344,noun,"a spade with a long handle for digging narrow ditches",
89345,noun,"a spade used by gardeners",
89346,noun,"dull or routine preliminary work preparing for an undertaking",
89347,noun,"spaghetti served with a tomato sauce",
89348,noun,"pasta in the form of long strings",
89349,noun,"a region in southern Spain on the Atlantic and the Mediterranean; formerly a center of Moorish civilization",
89350,noun,"the capital and largest city situated centrally in Spain; home of an outstanding art museum",
89351,noun,"a region (and former kingdom) in northwestern Spain on the Atlantic and the Bay of Biscay",
89352,noun,"ancient region and Roman province on the Iberian Peninsula; corresponds roughly to modern Portugal and parts of Spain",
89353,noun,"the burning to death of heretics (as during the Spanish Inquisition)",
89354,noun,"a terrorist organization organized in 1959 by student activists who were dissatisfied with the moderate nationalism of the traditional Basque party; want to create on independent homeland in Spain's western Pyrenees; ""in 1968 ETA launched a campaign of political assassinations of government officials""",
89355,noun,"an armed wing of the (illegal) Communist Party of Spain; seeks to overthrow the Spanish government and replace it with a Marxist-Leninist regime; ""GRAPO is vehemently opposed to the United States""",
89356,noun,"a Spanish American of pure European stock (usually Spanish); ""Mexico is a country of mestizos, criollos, and indigenes""",
89357,noun,"any successful womanizer (after the legendary profligate Spanish nobleman)",
89358,noun,"the length of time you can concentrate on some idea or activity",
89359,noun,"a unit of length based on the width of the expanded human hand (usually taken as 9 inches)",
89360,noun,"a native or inhabitant of Castile",
89361,noun,"a native or inhabitant of Catalonia",
89362,noun,"tall active short-tailed French breed of bird dog having a usually smooth orange- or liver-and-white coat",
89363,noun,"a thickset spaniel with longish silky hair",
89364,noun,"large usually black hunting and retrieving spaniel with a dense flat or slightly wavy coat; cross between cocker and Sussex spaniel",
89365,noun,"a large spaniel with wavy silky coat usually black or liver and white",
89366,noun,"an English breed with short legs and a golden liver-colored coat",
89367,noun,"the Spanish language as spoken in Castile",
89368,noun,"the Spanish dialect spoken by Sephardic Jews but written in the Hebrew script",
89369,noun,"the dialect of Spanish spoken in Mexico",
89370,noun,"a Spanish title or form of address for a man; similar to the English `Mr' or `sir'",
89371,noun,"a wrench for Allen screws",
89372,noun,"a wrench with a v-shaped jaw and serrations on one side (resembles the open jaws of an alligator)",
89373,noun,"a wrench shaped like a brace (has a handle shaped like a crank) and a socket head",
89374,noun,"a wrench designed to provide a firm grip on something",
89375,noun,"a wrench designed for use with carriage bolts",
89376,noun,"a wrench with a handle shaped like a crank",
89377,noun,"a wrench with a hook that fits over a nut or bolt head",
89378,noun,"a wrench having parallel jaws at fixed separation (often on both ends of the handle)",
89379,noun,"a wrench for turning a screw",
89380,noun,"a wrench for removing or tightening spark plugs into the cylinder head of an internal combustion engine",
89381,noun,"a wrench for turning a tap to create an internal screw thread",
89382,noun,"a wrench that has a gauge that indicates the amount of torque being applied",
89383,noun,"participation in the sport of matching gamecocks in a cockfight",
89384,noun,"a spar projecting from the bow of a vessel",
89385,noun,"a light spar that crosses a fore-and-aft sail diagonally",
89386,adjective,"kept in reserve especially for emergency use; ""a reserve supply of food""; ""a spare tire""; ""spare parts""",
89387,noun,"an extra car wheel and tire for a four-wheel vehicle",
89388,noun,"cut of pork from the rib section with most of the meat trimmed off",
89389,noun,"the act of sprinkling or splashing water; ""baptized with a sprinkling of holy water""; ""a sparge of warm water over the malt""",
89390,noun,"wetting with water; ""the lawn needs a great deal of watering""",
89391,noun,"electrical device to reduce sparking when electrical contacts are opened or closed",
89392,noun,"type genus of the Osmeridae",
89393,noun,"small brownish European songbird",
89394,noun,"small sparrow-like songbird of mountainous regions of Eurasia",
89395,noun,"a spasm of the cardiac sphincter (between the esophagus and the stomach); if the cardiac sphincter does not relax during swallowing the passage of food into the stomach is obstructed",
89396,noun,"laryngeal spasm caused by the sudden contraction of laryngeal muscles",
89397,noun,"the quality of moving or acting in spasms",
89398,verb,"spawn; ""oysters spat""",
89399,noun,"the property of being directional or maintaining a direction; ""the directionality of written English is from left to right""",
89400,noun,"the property of being neither parallel nor perpendicular, but at a slanting angle",
89401,noun,"cooking utensil having a flat flexible part and a long handle; used for turning or serving food",
89402,noun,"a spatula used to mix or apply putty",
89403,noun,"a swelling of the hock joint of a horse; resulting in lameness",
89404,noun,"spavin caused by distension of the veins",
89405,noun,"spavin caused by collection of fluids",
89406,noun,"spavin caused by a bony growth",
89407,verb,"speak in a condescending manner, as if to a child; ""He talks down to her""",
89408,verb,"speak at great length (about something)",
89409,verb,"discuss frankly, often in a business context",
89410,adjective,"capable of being uttered in words or sentences",
89411,noun,"someone who speaks with a drawl",
89412,noun,"someone whose talk is trivial drivel",
89413,noun,"a speaker who utters a sudden exclamation",
89414,noun,"a speaker who lisps",
89415,noun,"someone who talks incessantly; ""I wish that motormouth would shut up""",
89416,noun,"a speaker of a particular language who has spoken that language since earliest childhood; ""native speakers of French""",
89417,noun,"someone who speaks with involuntary pauses and repetitions",
89418,noun,"a speaker with an unusually loud voice",
89419,noun,"a talker on television who talks directly into the cameras and whose upper body is all that is shown on the screen",
89420,noun,"a speaker who expresses or gives vent to a personal opinion or grievance",
89421,noun,"a loud and vehement speaker (usually in protest)",
89422,noun,"a speaker who voices an opinion",
89423,noun,"a mourner who utters long loud high-pitched cries",
89424,noun,"one who speaks in a whisper",
89425,noun,"the presiding officer of a deliberative assembly; ""the leader of the majority party is the Speaker of the House of Representatives""",
89426,noun,"a tube for conveying the sound of a voice from one room to another",
89427,adjective,"adapted to or reserved for a particular purpose; ""a special kind of paint""; ""a special medication for arthritis""",
89428,adjective,"developed or designed for a special activity or function; ""a specialized tool""",
89429,noun,"a television production that features a particular person or work or topic; ""the last of a series of BBC specials on Iran is being shown tonight""",
89430,noun,"a specialist in wine making",
89431,noun,"a specialist in crystallography",
89432,noun,"a specialist in identifying fingerprints",
89433,noun,"a specialist in the history of the Teutonic people or language (especially with respect to the Teutonic influence on the history of England)",
89434,noun,"a specialist in treating damaged trees",
89435,noun,"a specialist in cardiology; a specialist in the structure and function and disorders of the heart",
89436,noun,"medical specialist whose competence has been certified by a diploma granted by an appropriate professional group",
89437,noun,"a physician who specializes in the ear and its diseases",
89438,noun,"a physician who specializes in embryology",
89439,noun,"physician who specializes in the diagnosis and treatment of conditions affecting the endocrine system",
89440,noun,"a specialist in the disorders of the ear or nose or throat",
89441,noun,"a doctor who specializes in diseases of the blood and blood-forming organs",
89442,noun,"a specialist in oncology",
89443,noun,"a specialist in orthoptics",
89444,noun,"a doctor specializing in diseases of the rectum and anus",
89445,noun,"a person who makes radiographs",
89446,noun,"a physician specializing in rheumatic diseases",
89447,noun,"a specialist in urology",
89448,noun,"the act of specializing; making something suitable for a special purpose",
89449,verb,"devote oneself to a special area of work; ""She specializes in honey bees""; ""This plumber specialized in jacuzzis""",
89450,noun,"a species of bacteria",
89451,noun,"a species whose numbers are so small that the species is at risk of extinction",
89452,adjective,"directed toward a specific object; ""particularized thinking as distinct from stereotyped sloganeering""",
89453,adjective,"(followed by `to') applying exclusively to a given category or condition or locality; ""a species unique to Australia""",
89454,adjective,"stated explicitly or in detail; ""needed a specific amount""",
89455,noun,"specification of design principles (including data formats and procedures) for creating a network configuration of data processors",
89456,noun,"naming explicitly",
89457,noun,"eyeglasses having two focal lengths",
89458,noun,"spectacles clipped to the nose by a spring",
89459,noun,"a Spanish or Portuguese or Latin American spectacle; a matador baits and (usually) kills a bull in an arena before many spectators",
89460,noun,"a naval spectacle; a mock sea battle put on by the ancient Romans",
89461,noun,"spectrogram of speech; speech displayed spectrographically",
89462,noun,"spectroscope for obtaining a mass spectrum by deflecting ions into a thin slit and measuring the ion current with an electrometer",
89463,noun,"a mass spectrometer that produces a graphical representation of the mass spectrum",
89464,noun,"the use of spectroscopy to determine the masses of small electrically charged particles",
89465,noun,"the use of spectroscopy to study atomic or molecular resonances in the microwave spectrum",
89466,noun,"a spectroscope by which spectra can be photographed",
89467,noun,"the spectrum of electromagnetic radiation that has passed through a medium that absorbed radiation of certain wavelengths",
89468,noun,"the efficiency with which electromagnetic radiation produces a photochemical reaction plotted as a function of the wavelength of the radiation",
89469,noun,"spectrum of electromagnetic radiation emitted by a self-luminous source",
89470,noun,"a spectrum in which energy is concentrated at particular wavelengths; produced by excited atoms and ions as they fall back to a lower energy level",
89471,noun,"a distribution of ions as shown by a mass spectrograph or a mass spectrometer",
89472,noun,"the part of the electromagnetic spectrum corresponding to microwaves",
89473,noun,"the distribution of energy as a function of frequency for a particular sound source",
89474,noun,"the spectrum of ultraviolet radiation",
89475,noun,"the distribution of colors produced when light is dispersed by a prism",
89476,noun,"someone who makes conjectures without knowing the facts",
89477,noun,"someone who counterbalances one transaction (as a bet) against another in order to protect against loss",
89478,noun,"someone who buys something and resells it at a price far above the initial cost; ""he got theater tickets through a scalper""",
89479,noun,"a speculator who makes money available for innovative projects (especially in high technology)",
89480,noun,"a medical instrument for dilating a bodily passage or cavity in order to examine the interior",
89481,noun,"something spoken; ""he could hear them uttering merry speeches""",
89482,noun,"the exchange of spoken words; ""they were perfectly comfortable together without speech""",
89483,noun,"the utterance of intelligible speech",
89484,noun,"words spoken in a casual way with conscious under-emphasis",
89485,noun,"the minimum velocity needed to escape a gravitational field",
89486,noun,"the speed of an aircraft relative to the ground",
89487,noun,"excessive velocity; ""the meteorites struck the earth with hypervelocity impacts""",
89488,noun,"the velocity of a projectile as it leaves the muzzle of a gun",
89489,noun,"velocity with respect to the local standard of rest",
89490,noun,"velocity along the line of sight toward or away from the observer",
89491,noun,"the constant maximum velocity reached by a body falling through the atmosphere under the attraction of gravity",
89492,noun,"speedometer for measuring the speed of an aircraft relative to the speed of sound",
89493,noun,"widespread genus of herbs with pink or white or blue or purple flowers: speedwell",
89494,noun,"European plant with minute axillary blue flowers on long stalks; widely naturalized in America",
