ID,POS,Gloss
90366,noun,"using the abbreviated style of headline writers",
90367,noun,"a style that uses the abstruse technical vocabulary of the law",
90368,noun,"the style of writing characteristic of some government officials: formal and obscure",
90369,noun,"the expression of one's individuality (usually through creative activities)",
90370,noun,"using long words",
90371,noun,"a distinctive style or manner; ""he continued in this vein for several minutes""",
90372,noun,"a style of women's clothing created by Christian Dior in 1947; involved a tight bodice and narrow waist and a flowing pleated skirt",
90373,noun,"an enlargement at the base of the style in some Umbelliferae",
90374,noun,"a pointed tool for writing or drawing or engraving; ""he drew the design on the stencil with a steel stylus""",
90375,noun,"small needlelike appendage; especially the feeding organ of a tardigrade",
90376,noun,"an arthropod of the division Tardigrada",
90377,noun,"deciduous or evergreen shrubs and small trees",
90378,noun,"small tree native to Japan",
90379,noun,"shrubby tree of China and Japan",
90380,noun,"styrax of southwestern United States; a threatened species",
90381,noun,"the lowest molding of an architectural base or of a baseboard",
90382,noun,"working as a substitute for someone who is ill or on leave of absence",
90383,adjective,"just below the level of consciousness",
90384,verb,"work under a subcontract; engage in a subcontract",
90385,noun,"suburbanites considered as a cultural class or subculture",
90386,noun,"the subculture of users of psychedelic drugs",
90387,adjective,"unfit for human beings; ""subhuman conditions of life""",
90388,adjective,"lying nearby but lower; ""hills and subjacent valleys""",
90389,adjective,"located beneath or below",
90390,adjective,"not exempt from tax; ""the gift will be subject to taxation""",
90391,verb,"expose to the effects of vitriol or injure with vitriol",
90392,verb,"make accountable for; ""He did not want to subject himself to the judgments of his superiors""",
90393,verb,"yield to the control of another",
90394,noun,"the subject of a dispute; ""the real bone of contention, as you know, is money""",
90395,adjective,"emanating from a person's emotions and prejudices",
90396,adjective,"(of e.g. evidence) not objective or easily verified",
90397,noun,"multicellular organisms having less-specialized cells than in the Metazoa; comprises the single phylum Porifera",
90398,adjective,"beneath the surface of the sea",
90399,adjective,"beneath the surface; ""subsurface materials of the moon""",
90400,noun,"navigable deep diving vessel for underwater exploration",
90401,noun,"spherical deep diving apparatus (lowered by a cable) for underwater exploration",
90402,noun,"diving apparatus for underwater work; has an open bottom and is supplied with compressed air",
90403,noun,"submersible vessel for one or two persons; for naval operations or underwater exploration",
90404,noun,"a legal document summarizing an agreement between parties in a dispute to abide by the decision of an arbiter",
90405,adjective,"showing an excessively deferential manner",
90406,adjective,"totally submissive",
90407,adjective,"harassed by persistent nagging",
90408,adjective,"lower in rank, power, or authority; ""an under secretary""",
90409,adjective,"owing feudal allegiance to or being subject to a sovereign; ""it remained feudatory to India until 1365""",
90410,adjective,"subject to a ruling authority; ""the ruled mass""",
90411,adjective,"compliant and obedient to authority; ""editors and journalists who express opinions in print that are opposed to the interests of the rich are dismissed and replaced by subservient ones""-G. B. Shaw",
90412,noun,"a person of low status",
90413,noun,"a word that is more specific than a given word",
90414,noun,"the semantic relation of being subordinate or belonging to a lower rank or class",
90415,noun,"a relation between meanings",
90416,noun,"the grammatical relation of a modifying word or phrase to its head",
90417,noun,"the quality of obedient submissiveness",
90418,noun,"following in time",
90419,noun,"quality of coming late or later in time",
90420,noun,"in a subservient state",
90421,noun,"either of two Australian plants of the genus Swainsona that are poisonous to sheep",
90422,noun,"subshrubs of southeastern United States forming slow-growing clumps and having blue flowers in short terminal cymes",
90423,noun,"common perennial herb having aromatic roots used as a substitute for sarsaparilla; central and eastern North America",
90424,noun,"unarmed woody rhizomatous perennial plant distinguished from wild sarsaparilla by more aromatic roots and panicled umbels; southeastern North America to Mexico",
90425,noun,"bristly herb of eastern and central North America having black fruit and medicinal bark",
90426,noun,"any plant of the genus Iresine having colored foliage",
90427,noun,"perennial of southwestern United States having leathery blue-green pinnatifid leaves and thick plumelike spikes of yellow flowers; sometimes placed in genus Cleome",
90428,noun,"tall branching subshrub of California and Mexico often cultivated for its silvery-blue foliage and large fragrant white flowers",
90429,noun,"any of several erect biennial herbs of temperate Eurasia having stout taproots and producing burs",
90430,noun,"any of several low composite herbs of the genera Artemisia or Seriphidium",
90431,noun,"much-branched subshrub with silvery leaves and small white flowers of Texas and northern Mexico; cultivated as a source of rubber",
90432,noun,"stout perennial herb of the eastern United States with whitish flowers; leaves traditionally used by Catawba Indians to treat burns",
90433,noun,"weedy plant having short dry chafflike leaves",
90434,noun,"any of numerous sun-loving low-growing evergreens of the genus Armeria having round heads of pink or white flowers",
90435,noun,"any of various plants of the genus Corchorus having large leaves and cymose clusters of yellow flowers; a source of jute",
90436,noun,"any boreal low-growing evergreen plant of the genus Diapensia",
90437,noun,"any of numerous herbs and subshrubs of the genus Lythrum",
90438,noun,"any of several plants of the genus Rhexia usually having pink-purple to magenta flowers; eastern North America",
90439,noun,"any of numerous plants of the genus Hypericum having yellow flowers and transparently dotted leaves; traditionally gathered on St John's eve to ward off evil",
90440,noun,"North American decumbent evergreen heathlike plant with yellow flowers",
90441,noun,"small heathlike plant covered with white down growing on beaches in northeastern North America",
90442,noun,"tropical American plant having leaflets somewhat sensitive to the touch; sometimes placed in genus Cassia",
90443,noun,"cosmopolitan tropical herb or subshrub with yellow flowers and slender curved pods; a weed; sometimes placed in genus Cassia",
90444,noun,"any of various tropical and subtropical plants having trifoliate leaves and rough sticky pod sections or loments",
90445,noun,"perennial of western United States having racemes of pink to purple flowers followed by flat pods that separate into nearly orbicular joints",
90446,noun,"perennial of southern Europe cultivated for forage and for its nectar-rich pink flowers that make it an important honey crop",
90447,noun,"European woody perennial with yellow umbellate flowers followed by flattened pods that separate into horseshoe-shaped joints",
90448,noun,"North American annual with red or rose-colored flowers",
90449,noun,"low-growing much-branched perennial of Canary Islands having orange-red to scarlet or purple flowers; naturalized in United States",
90450,noun,"stout perennial of eastern and central North America having palmate leaves and showy racemose blue flowers",
90451,noun,"European woody plant having pink flowers and unifoliate leaves and long tough roots; spreads by underground runners",
90452,noun,"Eurasian plant having loose racemes of pink or purple flowers and spiny stems and tough roots",
90453,noun,"annual with broadly ovate leaves and slender drooping spikes of crimson flowers; southeastern Asia and Australia; naturalized in North America",
90454,noun,"any plant of the genus Eriogonum with small clustered flowers",
90455,noun,"creeping evergreen shrub with large white flowers; widely distributed in northern portions of Eurasia and North America",
90456,noun,"dwarf ornamental shrub of western United States having large black to red and yellow sweet edible fruit",
90457,noun,"any plant of the genus Asperula",
90458,noun,"creeping evergreen subshrub of the northern parts of Europe and Asia with delicate fragrant tubular bell-shaped usually pink flowers borne in pairs",
90459,noun,"tropical annual procumbent poisonous subshrub having fruit that splits into five spiny nutlets; serious pasture weed",
90460,noun,"any plant of the genus Pachysandra; low-growing evergreen herbs or subshrubs having dentate leaves and used as ground cover",
90461,noun,"any of various plants of the genus Phlomis; grown primarily for their dense whorls of lipped flowers and attractive foliage",
90462,noun,"a spreading subshrub of Mediterranean regions cultivated for dense axillary whorls of purple or yellow flowers",
90463,noun,"any of several plants of the genus Trichostema having whorls of small blue flowers",
90464,noun,"a gradual sinking to a lower level",
90465,verb,"support through subsidies; ""The arts in Europe are heavily subsidized""",
90466,noun,"grant of financial aid as from a government to an educational institution",
90467,noun,"a space that is contained within another space",
90468,noun,"the necessary means (especially financial means)",
90469,adjective,"(of words) interchangeable in a given context without changing the import of the expression",
90470,noun,"a surface on which an organism grows or is attached; ""the gardener talked about the proper substrate for acid-loving plants""",
90471,noun,"an indigenous language that contributes features to the language of an invading people who impose their language on the indigenous population; ""the Celtic languages of Britain are a substrate for English""",
90472,adjective,"being or operating under the surface of the earth; ""subterranean passages""; ""a subsurface flow of water""",
90473,noun,"regions adjacent to the tropics",
90474,noun,"a community where many commuters live",
90475,noun,"a suburb of London and the headquarters of the club where annual international tennis championships are played on grass courts",
90476,noun,"a residential suburb of Phoenix",
90477,noun,"an underground tunnel or passage enabling pedestrians to cross a road or railway",
90478,noun,"the leading woman in an art or profession",
90479,noun,"succeeding with great difficulty; ""winning is not everything""",
90480,adjective,"victorious; ""undefeated in battle""; ""an undefeated team""",
90481,adjective,"resoundingly successful and popular; ""for years he was a boffo box office certainty""",
90482,adjective,"having achieved success or recognition by your own efforts; ""a self-made millionaire""",
90483,adjective,"certain to be successful; ""a sure-fire way to get rich""",
90484,adjective,"of a horse that has won the Kentucky Derby and the Belmont Stakes and the Preakness races",
90485,adjective,"having won; ""the victorious entry""; ""the winning team""",
90486,adjective,"bringing success; ""the winning run""",
90487,noun,"a juicy appetizingness",
90488,noun,"low-growing South African succulent plant having a capsular fruit containing edible pulp",
90489,noun,"low-growing showy succulent annual of South Africa having white or pink or red or orange flowers and spatulate leaves covered in papillae that resemble small crystals",
90490,noun,"any plant of the genus Lithops native to Africa having solitary yellow or white flowers and thick leaves that resemble stones",
90491,noun,"highly succulent stemless clump-forming plants with grey-green leaves similar in texture to lumps of granite; South Africa",
90492,noun,"succulent plants having rosettes of leaves usually with fiber like hemp and spikes of showy flowers; found chiefly in Africa",
90493,noun,"a drinker who sucks (as at a nipple or through a straw)",
90494,noun,"flesh of any of numerous North American food fishes with toothless jaws",
90495,noun,"mostly North American freshwater fishes with a thick-lipped mouth for feeding by suction; related to carps",
90496,noun,"suckers; closely related to the family Cyprinidae",
90497,noun,"a cypriniform fish of the family Catostomidae",
90498,noun,"any of several large suckers of the Mississippi valley",
90499,noun,"widely distributed in warm clear shallow streams",
90500,noun,"North American sucker with reddish fins",
90501,noun,"a young mammal that has not been weaned",
90502,noun,"a complex carbohydrate found in many plants and used as a sweetening agent",
90503,noun,"a simple sugar found in lactose",
90504,verb,"remove or draw away by the force of suction; ""the doctors had to suction the water from the patient's lungs""",
90505,adjective,"happening or coming quickly and without warning; ""a sudden unexpected development""",
90506,noun,"a synthetic suede cloth",
90507,noun,"a suitor who fulfills the dreams of his beloved",
90508,noun,"hard fat around the kidneys and loins in beef and mutton",
90509,verb,"be uncomfortably hot",
90510,noun,"a person suffering from anorexia nervosa",
90511,noun,"a person suffering from bulimia",
90512,noun,"a person afflicted with manic-depressive illness",
90513,noun,"a person suffering from monomania",
90514,noun,"a person who has narcolepsy",
90515,noun,"a person suffering a nervous breakdown",
90516,noun,"a person suffering from syphilis",
90517,noun,"weak or sickly person especially one morbidly concerned with his or her health",
90518,noun,"a person who vomits",
90519,noun,"sufficient resources to provide comfort and meet obligations; ""her father questioned the young suitor's sufficiency""",
90520,noun,"formation of a word by means of a suffix",
90521,noun,"suffrage for all adults who are not disqualified by the laws of the country",
90522,noun,"United States suffragist (1820-1906)",
90523,noun,"United States suffragist (1820-1905)",
90524,noun,"United States advocate of women's suffrage; in 1872 she was the first woman to run for the United States presidency (1838-1927)",
90525,noun,"refined sugar molded into rectangular shapes convenient as single servings",
90526,noun,"a large conical loaf of concentrated refined sugar",
90527,noun,"sugar in the form of small grains",
90528,noun,"sugar from sugar beets used as sweetening agent",
90529,noun,"dextrose used as sweetening agent",
90530,noun,"tall tropical southeast Asian grass having stout fibrous jointed stalks; sap is a chief source of sugar",
90531,noun,"tall perennial reedlike grass originally of southeastern Asia: sugarcane",
90532,noun,"sugarcanes representing the highest development of the species; characterized by large juicy stalks with soft rinds and high sugar content",
90533,adjective,"(used of wines) having a high residual sugar content; ""sweet dessert wines""",
90534,adjective,"with honey added",
90535,adjective,"resembling honey",
90536,adjective,"with sweetening added",
90537,adjective,"susceptible or responsive to suggestion; ""suggestible young minds""",
90538,noun,"a suggestion that is made to a person who is hypnotized that specifies an action he will perform (usually in response to a cue) after he has awakened",
90539,noun,"the sequential mental process in which one thought leads to another by association",
90540,adjective,"dangerous to yourself or your interests; ""suicidal impulses""; ""a suicidal corporate takeover strategy""; ""a kamikaze pilot""",
90541,noun,"suicide of a terminally ill person that involves an assistant who serves to make dying as painless and dignified as possible",
90542,noun,"an act of deliberate self destruction",
90543,noun,"the act of a Hindu widow willingly cremating herself on the funeral pyre of her dead husband",
90544,noun,"a suit of clothes traditionally worn by businessmen",
90545,noun,"a suit with a double-breasted jacket",
90546,noun,"a suit having a single-breasted jacket",
90547,noun,"a flashy suit of extreme cut",
90548,noun,"(bridge or whist) the suit that has been declared to rank above all other suits for the duration of the hand; ""clubs were declared trumps""; ""a trump can take a trick even when a card of a different suit is led""",
90549,noun,"(music) an instrumental suite common in the 18th century",
90550,noun,"a suite of furniture for the bedroom",
90551,noun,"a suite of furniture for the dining room",
90552,noun,"a suite of furniture for the living room",
90553,noun,"a copper salt made by the action of sulfuric acid on copper oxide",
90554,noun,"a salt of magnesium",
90555,noun,"a solid white bitter salt used in manufacturing glass and paper and dyes and pharmaceuticals",
90556,noun,"a colorless water-soluble powder; used as a mordant or to preserve wood or for the electrodeposition of zinc",
90557,noun,"a sulfide having the unpleasant smell of rotten eggs",
90558,noun,"a compound containing two atoms of sulfur combined with iron",
90559,noun,"a yellow sulfide used chiefly as a pigment",
90560,noun,"dilute sulfuric acid used in storage batteries",
90561,noun,"a light two-wheeled vehicle for one person; drawn by one horse",
90562,noun,"sultan of Syria and Egypt; reconquered Jerusalem from the Christians in 1187 but was defeated by Richard Coeur de Lion in 1191 (1137-1193)",
90563,noun,"pale yellow seedless grape used for raisins and wine",
90564,noun,"a sultanate in northwestern Borneo; became independent of Great Britain in 1984",
90565,noun,"the basic unit of money in Uzbekistan",
90566,noun,"a member of a people who inhabited ancient Sumer",
90567,adjective,"with highest honor; with the highest academic distinction; ""a summa cum laude graduate""",
90568,noun,"a summary of the scoring in a game (usually in tabular form)",
90569,noun,"a general summary of a subject; ""the treasurer gave a brief overview of the financial consequences""",
90570,noun,"a summary list; as in e.g. ""a news roundup""",
90571,noun,"a country house (usually located in the country) that provides a cool place to live in the summer",
90572,adjective,"of plants that bloom during the summer",
90573,noun,"a well or other hole in which water has collected",
90574,noun,"a suction pump for removing liquid from a sump",
90575,noun,"a sudden emergence of the sun from behind clouds",
90576,noun,"first day of the week; observed as a day of rest and worship by most Christians",
90577,adjective,"baked or hardened by exposure to sunlight; not burned; ""sunbaked adobe bricks""",
90578,noun,"redness of the skin caused by exposure to the rays of the sun",
90579,noun,"abnormal redness of the skin resulting from dilation of blood vessels (as in sunburn or inflammation)",
90580,noun,"ice cream served with a topping",
90581,noun,"genus of tall erect or branched American annual or perennial herbs with showy flowers: sunflowers",
90582,noun,"sunflower of eastern North America having narrow leaves and found in bogs",
90583,noun,"annual sunflower grown for silage and for its seeds which are a source of oil; common throughout United States and much of North America",
90584,noun,"very tall American perennial of central and the eastern United States to Canada having edible tuberous roots",
90585,noun,"tall rough-leaved perennial with a few large flower heads; central United States",
90586,noun,"tall perennial of central United States to Canada having golden-yellow flowers",
90587,noun,"similar to the common sunflower with slender usually branching stems common in central United States",
90588,adjective,"under water; e.g. at the bottom of a body of water; ""sunken treasure""; ""a sunken ship""",
90589,adjective,"dead by drowning; ""poor drowned sailors""",
90590,adjective,"sunk by being filled with water; ""a swamped boat""",
90591,noun,"atmospheric phenomena accompanying the daily appearance of the sun",
90592,noun,"the daily event of the sun rising above the horizon",
90593,noun,"atmospheric phenomena accompanying the daily disappearance of the sun",
90594,noun,"the daily event of the sun sinking below the horizon",
90595,noun,"sudden prostration due to exposure to the sun or excessive heat",
90596,adjective,"capable of being surmounted or excelled",
90597,adjective,"capable of being surmounted or overcome; ""situations of measurable and surmountable danger""",
90598,noun,"the property of being out of date and not current",
90599,noun,"the disappearance of electrical resistance at very low temperatures",
90600,adjective,"appearing to be as specified; usually used as combining forms; ""left their clothes dirty looking""; ""a most disagreeable looking character""; ""angry-looking""; ""liquid-looking""; ""severe-looking policemen on noble horses""; ""fine-sounding phrases""; ""taken in by high-sounding talk""",
90601,noun,"a kind of fluent easy superficiality; ""the glibness of a high-pressure salesman""",
90602,noun,"shallowness in terms of affecting only surface layers of something; ""he ignored the wound because of its superficiality""",
90603,noun,"outer surface of an area or a body",
90604,adjective,"lying or resting on and exerting pressure on something else; ""superincumbent layers of dead plants cut off the air and arrested decomposition""",
90605,adjective,"of the highest quality or value; ""gilt-edged securities""; ""gilt-edged credentials""",
90606,adjective,"modified to give superior performance; ""a high-performance car""",
90607,adjective,"highest in excellence or achievement; ""supreme among musicians""; ""a supreme endxxeavor""; ""supreme courage""",
90608,adjective,"exceeding or surpassing usual limits especially in excellence",
90609,adjective,"of a quality adequate for use in weapons (especially in weapons of mass destruction); ""weapons-grade plutonium""; ""weapons-grade anthrax""",
90610,adjective,"skillfully constructed",
90611,adjective,"at an elevated level in rank or importance; ""a high-level official""; ""a high-level corporate briefing""; ""upper-level management""",
90612,adjective,"of higher rank or status or value",
90613,adjective,"superior in rank or accomplishment; ""the upper half of the class""",
90614,adjective,"(often followed by `to') above being affected or influenced by; ""he is superior to fear""; ""an ignited firework proceeds superior to circumstances until its blazing vitality fades""",
90615,noun,"a town in northwest Wisconsin on Lake Superior across from Duluth",
90616,noun,"a midwestern state in north central United States",
90617,noun,"the quality of being very good indeed; ""the inn is distinguished by the fineness of its cuisine""",
90618,noun,"the highest rank in a classification",
90619,noun,"a favorable position in a competition; ""the boss's son had the inside track for that job""",
90620,noun,"position of advantage and control",
90621,adjective,"placed on or over something else; ""an overlying image""",
90622,adjective,"(superlative of `few' used with count nouns and usually preceded by `the') quantifier meaning the smallest in number; ""the fewest birds in recent memory""",
90623,adverb,"(superlative of `near' or `close') within the shortest distance; ""that was the time he came nearest to death""",
90624,adjective,"suggesting the operation of supernatural influences; ""an eldritch screech""; ""the three weird sisters""; ""stumps...had uncanny shapes as of monstrous creatures""- John Galsworthy; ""an unearthly light""; ""he could hear the unearthly scream of some curlew piercing the din""- Henry Kingsley",
90625,adjective,"given to or produced by or used in the art of conjuring up the dead; ""a necromantic sorcerer""; ""necromantic delusions""; ""necromantic powders and other weird objects""",
90626,adjective,"possessing or believed to possess magic power especially protective power; ""a talismanic amulet""",
90627,adjective,"existing or extending beyond the physical world; ""whatever of transmundane...insight...we may carry""- William James",
90628,adjective,"being or having the character of witchcraft",
90629,noun,"the quality of being attributed to power that seems to violate or go beyond natural forces",
90630,noun,"a remnant of a supernova detected first in 1054 AD",
90631,noun,"a word that is more generic than a given word",
90632,verb,"write on the top or outside; ""superscribe one's name and address""",
90633,verb,"write on the outside or upper part of; ""superscribe an envelope""",
90634,noun,"a superstructure on the upper deck of a ship",
90635,noun,"the supervisor of bellboys in a hotel",
90636,noun,"someone who plays the role of a den mother; ""he serves as den mother to all the freshmen in this dormitory""; ""she's the den mother to new secretaries""",
90637,noun,"a Japanese supervisor",
90638,noun,"a supervisor in a research center",
90639,noun,"a person in charge of managing and maintaining a computer system of telecommunication system (as for a business or institution)",
90640,noun,"the person responsible for driving a herd of cattle",
90641,verb,"turn (the hand or forearm) so that the back is downward or backward, or turn out (the leg)",
90642,noun,"a social gathering where a light evening meal is served; ""her suppers often included celebrities""",
90643,noun,"one who illegally occupies property to which another has a legal claim",
90644,verb,"add vitamins as a supplement; ""vitaminized processed foods""",
90645,adjective,"humbly entreating; ""a suppliant sinner seeking forgiveness""",
90646,noun,"offering goods and services for sale",
90647,verb,"lend moral support to",
90648,verb,"support financially through a period of time; ""The scholarship saw me through college""; ""This money will see me through next month""",
90649,noun,"a support for the arch of the foot",
