ID,POS,Gloss
15857,noun,"catalysis in which the catalyst is one of the products of the reaction",
15858,noun,"acceleration of a chemical reaction induced the presence of material that is chemically unchanged at the end of the reaction; ""of the top 50 commodity chemicals, 30 are created directly by catalysis and another 6 are made from raw materials that are catalytically produced""",
15859,adjective,"originating where it is found; ""the autochthonal fauna of Australia includes the kangaroo""; ""autochthonous rocks and people and folktales""; ""endemic folkways""; ""the Ainu are indigenous to the northernmost islands of Japan""",
15860,adjective,"characteristic of or existing by virtue of geographic  origin; ""the native North American sugar maple""; ""many native artists studied abroad""",
15861,verb,"subject to the action of an autoclave",
15862,verb,"make free from bacteria",
15863,noun,"a device for heating substances above their boiling point; used to manufacture chemicals or to sterilize surgical instruments",
15864,noun,"an object used as a container (especially for liquids)",
15865,noun,"autoclave consisting of a vessel in which plant or animal materials are digested",
15866,noun,"autoclave for cooking at temperatures above the boiling point of water",
15867,noun,"a political theory favoring unlimited authority by a single individual",
15868,noun,"the political doctrine of Machiavelli: any means (however unscrupulous) can be used by a ruler in order to create and maintain his autocratic government",
15869,noun,"a cruel and oppressive dictator",
15870,noun,"a ruler who is unconstrained by law",
15871,noun,"a person having great power",
15872,adjective,"offensively self-assured or given to exercising usually unwarranted power; ""an autocratic person""; ""autocratic behavior""; ""a bossy way of ordering others around""; ""a rather aggressive and dominating character""; ""managed the employees in an aloof magisterial way""; ""a swaggering peremptory manner""",
15873,noun,"a person who has taught himself",
15874,adjective,"sexually satisfying yourself (as by masturbation)",
15875,adjective,"marked by or tending to arouse sexual desire or interest; ""feeling sexy""; ""sexy clothes""; ""sexy poses""; ""a sexy book""; ""sexy jokes""",
15876,noun,"using you own body as a sexual object",
15877,noun,"manual stimulation of the genital organs (of yourself or another) for sexual pleasure",
15878,adjective,"characterized by or fit for autogamy",
15879,adjective,"fertilized by its own pollen",
15880,noun,"self-fertilization in plants",
15881,noun,"fertilization by the union of male and female gametes from the same individual",
15882,adjective,"originating within the body",
15883,adjective,"originating from the self",
15884,adjective,"brought about by yourself; ""self-induced vomiting""",
15885,noun,"an aircraft that is supported in flight by unpowered rotating horizontal wings (or blades); forward propulsion is provided by a conventional propeller",
15886,verb,"mark with one's signature; ""The author autographed his book""",
15887,verb,"be engaged by a written agreement; ""He signed to play the casino on Dec. 18""; ""The soprano signed to sing the new opera""",
15888,noun,"something written by one's own hand",
15889,noun,"handwritten book or document",
15890,noun,"a person's own signature",
15891,noun,"your name written in your own handwriting",
15892,adjective,"(of firearms) capable of automatic loading and firing continuously; ""an autoloading rifle""",
15893,adjective,"operating with minimal human intervention; independent of external control; ""automatic transmission""; ""a budget deficit that caused automatic spending cuts""",
15894,noun,"lysis of plant or animal tissue by an internal process",
15895,noun,"(biochemistry) dissolution or destruction of cells such as blood cells or bacteria",
15896,noun,"a vending machine from which you can get food",
15897,noun,"a slot machine for selling goods",
15898,noun,"a cafeteria where food is served from machines",
15899,noun,"a restaurant where you serve yourself and pay a cashier",
15900,verb,"make semiautomatic; ""Can we semi-automatize the semantic tagging process?""",
15901,adjective,"using (or as if using) mechanisms or tools or devices; ""a mechanical process""; ""his smile was very mechanical""; ""a mechanical toy""",
15902,adjective,"operated by automation; ""an automated stoker""",
15903,adjective,"designed to activate or move or regulate itself; ""a self-activating sprinkler system""",
15904,adjective,"locking automatically when closed",
15905,adjective,"designed so that manual winding is unnecessary; ""a self-winding watch""",
15906,adjective,"partially automatic",
15907,adjective,"capable of independent and apparently intelligent action; ""smart weapons""",
15908,adjective,"like the unthinking functioning of a machine; ""an automatic `thank you'""; ""machinelike efficiency""",
15909,adjective,"without volition or conscious control; ""the automatic shrinking of the pupils of the eye in strong light""; ""a reflex knee jerk""; ""sneezing is reflexive""",
15910,adjective,"controlled by the autonomic nervous system; without conscious control; ""involuntary muscles""; ""gave an involuntary start""",
15911,noun,"light machine gun",
15912,noun,"a firearm that reloads itself and keeps firing until the trigger is released",
15913,noun,"a rapidly firing automatic gun (often mounted)",
15914,noun,"a portable .30 caliber automatic rifle operated by gas pressure and fed by cartridges from a magazine; used by United States troops in World War I and in World War II and in the Korean War",
15915,noun,"a pistol that will keep firing until the ammunition is gone or the trigger is released",
15916,noun,"a firearm that is held and fired with one hand",
15917,noun,"a cognitive state in which you act without self-awareness; ""she went about her chores on automatic pilot""; ""too much of the writing seems to have been done on automatic pilot""; ""she talked and he dozed and my mind went on autopilot""",
15918,noun,"a state lacking normal awareness of the self or environment",
15919,noun,"a navigational device that automatically keeps ships or planes or spacecraft on a steady course",
15920,noun,"a system to control a plane or spacecraft; uses inertial forces",
15921,noun,"the act of implementing the control of equipment with advanced technology; usually involving electronic hardware; ""automation replaces human workers by machines""",
15922,noun,"highly advanced technological development (especially in electronics)",
15923,noun,"the control of processes by computer",
15924,noun,"the condition of being automatically operated or controlled; ""automation increases productivity""",
15925,noun,"equipment used to achieve automatic control or operation; ""this factory floor is a showcase for automation and robotic equipment""",
15926,noun,"any reaction that occurs automatically without conscious thought or reflection (especially the undirected behavior seen in psychomotor epilepsy)",
15927,noun,"a mechanism that can move automatically",
15928,noun,"an automaton that resembles a human being",
15929,verb,"travel in an automobile",
15930,noun,"the act of controlling and steering the movement of a vehicle or animal",
15931,adjective,"containing within itself the means of propulsion or movement; ""a self-propelled vehicle""",
15932,adjective,"relating to or controlled by the autonomic nervous system; ""autonomic reflexes""",
15933,noun,"the part of the nervous system of vertebrates that controls involuntary actions of the smooth muscles and heart and glands",
15934,noun,"the sensory and control apparatus consisting of a network of nerve cells",
15935,noun,"a structure that is part of the nervous system",
15936,noun,"any of the ganglia of the autonomic system whose unmyelinated fibers innervate the internal organs",
15937,noun,"originates in the thoracic regions of the spinal cord; opposes physiological effects of the parasympathetic: reduces digestive secretions; speeds the heart; contracts blood vessels",
15938,noun,"originates in the brain stem and lower part of the spinal cord; opposes physiological effects of the sympathetic nervous system: stimulates digestive secretions; slows the heart; constricts the pupils; dilates blood vessels",
15939,adjective,"(of political bodies) not controlled by outside forces; ""an autonomous judiciary""; ""a sovereign state""",
15940,adjective,"existing as an independent entity; ""the partitioning of India created two separate and autonomous jute economies""",
15941,adjective,"(of persons) free from external control and constraint in e.g. action and judgment",
15942,noun,"immunity from arbitrary exercise of authority: political independence",
15943,noun,"government of a political unit by its own people",
15944,noun,"personal independence",
15945,verb,"perform an autopsy on a dead body; do a post-mortem",
15946,noun,"an examination and dissection of a dead body to determine cause of death or the changes produced by disease",
15947,noun,"(especially of domestic fowl) breeding to reveal differential sex characteristics at hatching",
15948,noun,"the production of animals or plants by inbreeding or hybridization",
15949,noun,"any chromosome that is not a sex chromosome; appear in pairs in body cells but as single chromosomes in spermatozoa",
15950,noun,"a threadlike body in the cell nucleus that carries the genes in a linear order",
15951,noun,"hypnosis induced by yourself",
15952,noun,"a state that resembles sleep but that is induced by suggestion",
15953,verb,"cause a body part to undergo autotomy",
15954,noun,"spontaneous removal or casting off of a body part (as the tail of a lizard or claw or a lobster) especially when the organism is injured or under attack",
15955,noun,"plant capable of synthesizing its own food from simple organic substances",
15956,noun,"process for producing permanent prints in a carbon pigment",
15957,noun,"the process of producing images of objects on photosensitive surfaces",
15958,noun,"an exact copy or reproduction",
15959,noun,"a secondary representation of an original; ""she made a copy of the designer dress""",
15960,noun,"the season when the leaves fall from the trees; ""in the fall of 1973""",
15961,noun,"one of the natural periods into which the year is divided by the equinoxes and solstices or atmospheric conditions; ""the regular sequence of the seasons""",
15962,noun,"a period of unusually warm weather in the autumn",
15963,noun,"September 22",
15964,adjective,"of or characteristic of or occurring in autumn; ""the autumnal equinox""; ""autumnal fruits""",
15965,adjective,"of plants that bloom during the autumn",
15966,adjective,"of plants that ripen in the fall",
15967,adjective,"characteristic of late maturity verging on decline; ""a serene autumnal mood""",
15968,adjective,"characteristic of maturity; ""mature for her age""",
15969,noun,"growth from increase in cell size without cell division",
15970,adjective,"functioning in a subsidiary or supporting capacity; ""the main library and its auxiliary branches""",
15971,noun,"someone who assists a nurse in tasks that require little formal training",
15972,noun,"electronic equipment not in direct communication (or under the control of) the central processing unit",
15973,noun,"a system of one or more computers and associated software with common storage",
15974,noun,"a data storage device that is not the main memory of a computer",
15975,noun,"a device that preserves information for retrieval",
15976,noun,"a plant hormone that promotes root formation and bud growth",
15977,noun,"(botany) a plant product that acts like a hormone",
15978,noun,"a plant hormone promoting elongation of stems and roots",
15979,noun,"a synthetic plant hormone promoting elongation of stems and roots",
15980,verb,"take or use; ""She helped herself to some of the office supplies""",
15981,noun,"a means of serving; ""of no avail""; ""there's no help for it""",
15982,noun,"the property of providing useful assistance",
15983,adjective,"less in demand and therefore readily obtainable; ""commodities are easy this quarter""",
15984,adjective,"available when required or as promised; ""federal funds were not forthcoming""",
15985,adjective,"capable of being obtained; ""savings of up to 50 percent are obtainable""",
15986,adjective,"available for use or sale; ""they have plenty of stonewashed jeans in stock""",
15987,adjective,"available for lending; ""lendable resources""",
15988,adjective,"present and easily available; ""the cash on hand is adequate for current needs""; ""emergency police were on hand in case of trouble""; ""a visible supply""; ""visible resources""",
15989,adjective,"readily available; ""there will be a wealth of information on hand from the lawyers""",
15990,adjective,"available for immediate use; ""extra personnel on tap""; ""other sports and entertainment facilities are on tap""; ""there are numerous projects on tap""",
15991,adjective,"(of liquids) available by turning a tap; ""ale on tap""; ""hot and cold running water on tap""",
15992,adjective,"not having been filled; ""the job is still open""",
15993,adjective,"available for purchase; ""purchasable goods""; ""many houses in the area are for sale""",
15994,adjective,"(of especially money) immediately available; ""he seems to have ample ready money""; ""a ready source of cash""",
15995,adjective,"not busy; not otherwise committed; ""he was not available for comment""; ""he was available and willing to accompany her""",
15996,adjective,"convenient for use or disposal; ""the house is available after July 1""; ""2000 square feet of usable office space""",
15997,adjective,"free or available for use or disposition; ""every disposable piece of equipment was sent to the fire""; ""disposable assets""",
15998,verb,"gather into a huge mass and roll down a mountain, of snow",
15999,noun,"a slide of large masses of snow and ice and mud down a mountain",
16000,noun,"(geology) the descent of a large mass of earth or rocks or snow etc.",
16001,noun,"an avalanche of volcanic water and mud down the slopes of a volcano",
16002,noun,"a sudden appearance of an overwhelming number of things; ""the program brought an avalanche of mail""",
16003,noun,"reprehensible acquisitiveness; insatiable desire for wealth (personified as one of the deadly sins)",
16004,noun,"extreme greed for material wealth",
16005,noun,"excessive desire to acquire or possess more (especially more material wealth) than one needs or deserves",
16006,verb,"take revenge for a perceived wrong; ""He wants to avenge the murder of his brother""",
16007,verb,"take revenge or even out a score; ""I cannot accept the defeat--I want to get even""",
16008,noun,"any of various perennials of the genus Geum having usually pinnate basal leaves and variously colored flowers",
16009,noun,avens,
16010,noun,"low-growing woody shrub or perennial with woody base",
16011,noun,"erect subshrub with deep yellow flowers; Europe and Asia and North America",
16012,noun,"North American white-flowered avens",
16013,noun,"hairy yellow-flowered plant of eastern Asia and North America",
16014,noun,"erect perennial of north temperate zone having pinnate leaves and a few nodding flowers with a brown-purple calyx and orange and pink petals",
16015,noun,"North American perennial with hairy basal pinnate leaves and purple flowers and plume-tipped fruits",
16016,noun,"hairy Eurasian plant with small yellow flowers and an astringent root formerly used medicinally",
16017,noun,"avens of Virginia having pale or greenish yellow flowers",
16018,adjective,"approximating the statistical norm or average or expected value; ""the average income in New England is below that of the nation""; ""of average height for his age""; ""the mean annual rainfall""",
16019,adjective,"conforming with or constituting a norm or standard or level or type or social norm; not abnormal; ""serve wine at normal room temperature""; ""normal diplomatic relations""; ""normal working hours""; ""normal word order""; ""normal curiosity""; ""the normal course of events""",
16020,adjective,"lacking special distinction, rank, or status; commonly encountered; ""average people""; ""the ordinary (or common) man in the street""",
16021,adjective,"having  no special distinction or quality; widely known or commonly encountered; average or ordinary or usual; ""the common man""; ""a common sailor""; ""the common cold""; ""a common nuisance""; ""followed common procedure""; ""it is common knowledge that she lives alone""; ""the common housefly""; ""a common brand of soap""",
16022,adjective,"lacking exceptional quality or ability; ""a novel of average merit""; ""only a fair performance of the sonata""; ""in fair health""; ""the caliber of the students has gone from mediocre to above average""; ""the performance was middling at best""",
16023,adjective,"not exceptional in any way especially in quality or ability or size or degree; ""ordinary everyday objects""; ""ordinary decency""; ""an ordinary day""; ""an ordinary wine""",
16024,adjective,"around the middle of a scale of evaluation of physical measures; ""an orange of average size""; ""intermediate capacity""; ""a plane with intermediate range""; ""medium bombers""",
16025,adjective,"being within reasonable or average limits; not excessive or extreme; ""moderate prices""; ""a moderate income""; ""a moderate fine""; ""moderate demands""; ""a moderate estimate""; ""a moderate eater""; ""moderate success""; ""a kitchen of moderate size""; ""the X-ray showed moderate enlargement of the heart""",
16026,adjective,"relating to or constituting the most frequent value in a distribution; ""the modal age at which American novelists reach their peak is 30""",
16027,adjective,"relating to or constituting the middle value of an ordered set of values (or the average of the middle two in a set with an even number of values); ""the median value of 17, 20, and 36 is 20""; ""the median income for the year was $15,000""",
16028,noun,"a statistic describing the location of a distribution; ""it set the norm for American homes""",
16029,noun,"a datum that can be represented numerically",
16030,noun,"the average age at which particular performances are expected to appear",
16031,noun,"the most frequent value of a random variable",
16032,noun,"the value below which 50% of the cases fall",
16033,noun,"an average of n numbers computed by adding some function of the numbers and dividing by some function of n",
16034,noun,"the act of turning yourself (or your gaze) away; ""averting her gaze meant that she was angry""",
16035,noun,"deliberately avoiding; keeping away from or preventing from happening",
16036,verb,"prevent the occurrence of; prevent from happening; ""Let's avoid a confrontation""; ""head off a confrontation""; ""avert a strike""",
16037,verb,"keep from happening or arising; make impossible; ""My sense of tact forbids an honest answer""; ""Your role in the projects precludes your involvement in the competitive project""",
16038,verb,"turn away or aside; ""They averted their eyes when the King entered""",
16039,verb,"change orientation or direction, also in the abstract sense; ""Turn towards me""; ""The mugger turned and fled before I could see his face""; ""She turned from herself and learned to listen to others' needs""",
16040,noun,"a collection of Zoroastrian texts gathered during the 4th or 6th centuries",
16041,adjective,"of or pertaining to the Avesta  (sacred text of Zoroastrianism)",
16042,noun,"system of religion founded in Persia in the 6th century BC by Zoroaster; set forth in the Zend-Avesta; based on concept of struggle between light (good) and dark (evil)",
16043,noun,"an ancient Iranian language",
16044,noun,"the modern Persian language spoken in Iran",
16045,noun,"the script in which the ancient Persian language of the Avesta is written",
16046,adjective,"pertaining to or characteristic of birds",
16047,noun,"a building where birds are kept",
16048,verb,"travel through the air; be airborne; ""Man cannot fly""",
16049,verb,"handle and cause to function; ""do not operate machinery after imbibing alcohol""; ""control the lever""",
16050,verb,"glide on the water in a hydroplane",
16051,verb,"ride in a hot-air balloon; ""He tried to balloon around the earth but storms forced him to land in China""",
16052,verb,"fly very close to the ground",
16053,verb,"fly by means of a hang glider",
16054,verb,"travel over (an area of land or sea) in an aircraft; ""Lindbergh was the first to fly the Atlantic""",
16055,noun,"the operation of aircraft to provide transportation",
16056,noun,"the people or companies engaged in a particular kind of commercial enterprise; ""each industry has its own trade publications""",
16057,adjective,"(often followed by `for') ardently or excessively desirous; ""avid for adventure""; ""an avid ambition to succeed""; ""fierce devouring affection""; ""the esurient eyes of an avid curiosity""; ""greedy for fame""",
16058,adjective,"marked by active interest and enthusiasm; ""an avid sports fan""; ""a great walker""; ""an eager beaver""",
16059,noun,"a feeling of excitement",
16060,noun,"the birds of a particular region or period",
16061,noun,"any of several diseases caused by deficiency of one or more vitamins",
16062,noun,"a state of poor nutrition; can result from insufficient or excessive or unbalanced diet or from inability to absorb foods",
16063,noun,"avitaminosis caused by lack of thiamine (vitamin B1)",
16064,noun,"a disease caused by deficiency of niacin or tryptophan (or by a defect in the metabolic conversion of tryptophan to niacin); characterized by gastrointestinal disturbances and erythema and nervous or mental disorders; may be caused by malnutrition or alcoholism or other nutritional impairments",
16065,noun,"childhood disease caused by deficiency of vitamin D and sunlight associated with impaired metabolism of calcium and phosphorus",
16066,noun,"a condition caused by deficiency of ascorbic acid (vitamin C)",
16067,noun,"inability to see clearly in dim light; due to a deficiency of vitamin A or to a retinal disorder",
16068,adjective,"of the dull yellowish green of the meat of an avocado",
16069,noun,"a pear-shaped tropical fruit with green or blackish skin and rich yellowish pulp enclosing a single large seed",
16070,noun,"tropical American tree bearing large pulpy green fruits",
16071,noun,avocado,
16072,noun,"an auxiliary activity",
16073,noun,"a diversion that occupies one's time and thoughts (usually pleasantly); ""sailing is her favorite pastime""; ""his main pastime is gambling""; ""he counts reading among his interests""; ""they criticized the boy for his limited pursuits""",
16074,noun,"the pastime of exploring caves",
16075,noun,"long-legged web-footed black-and-white shorebird with slender upward-curving bill",
16076,noun,"type genus of the Recurvirostridae: avocets",
16077,noun,"any of numerous wading birds that frequent mostly seashores and estuaries",
16078,verb,"stay clear from; keep away from; keep out of the way of someone or something; ""Her former friends now avoid her""",
16079,verb,"avoid or try to avoid fulfilling, answering, or performing (duties, questions, or issues); ""He dodged the issue""; ""she skirted the problem""; ""They tend to evade their responsibilities""; ""he evaded the questions skillfully""",
16080,verb,"fail to experience; ""Fortunately, I missed the hurricane""",
16081,verb,"escape potentially unpleasant consequences; get away with a forbidden action; ""She gets away with murder!""; ""I couldn't get out from under these responsibilities""",
16082,verb,"avoid something unpleasant or laborious; ""You cannot bypass these rules!""",
16083,verb,"refrain from entering or walking onto; ""keep off the grass""; ""stay off the premises""",
16084,verb,"avoid dealing with; ""She shirks her duties""",
16085,verb,"avoid having to deal with some unpleasant task; ""I shy away from this task""",
16086,verb,"avoid and stay away from deliberately; stay clear of",
16087,verb,"refrain from doing something; ""She refrains from calling her therapist too often""; ""He should avoid publishing his wife's memories""",
16088,verb,"avoid (one's assigned duties); ""The derelict soldier shirked his duties""",
16089,noun,"an avoidance of danger or difficulty; ""that was a narrow escape""",
16090,noun,"something that barely avoids failure or disaster",
16091,noun,"a system of weights based on the 16-ounce pound (or 7,000 grains)",
16092,noun,"a system of units used to express the weight of something",
16093,noun,"any of the units of the avoirdupois system of weights",
16094,noun,"excess bodily weight; ""she disliked fatness in herself as well as in others""",
16095,noun,"having the property of containing fat; ""he recommended exercise to reduce my adiposity""",
16096,noun,"the bodily property of a protruding belly",
16097,noun,"consisting of or covered with oil",
16098,noun,"more than average fatness",
16099,adjective,"openly declared as such; ""an avowed enemy""; ""her professed love of everything about that country""; ""McKinley was assassinated by a professed anarchist""",
16100,verb,"separate by avulsion",
16101,verb,"divide into components or constituents; ""Separate the wheat from the chaff""",
16102,noun,"a forcible tearing or surgical separation of one body part from another",
16103,noun,"the act of dividing or disconnecting",
16104,adjective,"like an uncle in kindness or indulgence; ""showed avuncular concern""",
16105,adjective,"like or befitting a cousin; ""a cousinly kiss""",
16106,verb,"look forward to the birth of a child; ""She is expecting in March""",
16107,verb,"expect or hope for; ""I look to hear from you soon""",
16108,verb,"turn one's interests or expectations towards; ""look to the future""; ""this method looks to significant wavings""",
16109,verb,"hold the phone line open; ""Please hang on while I get your folder""",
