ID,POS,Gloss
17215,noun,"a balloon sent up to test air currents",
17216,noun,"a cord that is pulled to open the gasbag of a balloon wide enough to release gas and so causes the balloon to descend",
17217,verb,"vote by ballot; ""The voters were balloting in this state""",
17218,verb,"express one's preference for a candidate or for a measure or resolution; cast a vote; ""He voted for the motion""; ""None of the Democrats voted last night""",
17219,noun,"a choice that is made by counting the number of people in favor of each alternative; ""there were only 17 votes in favor of the motion""",
17220,noun,"a vote proportional in magnitude to the number of people that a delegate represents",
17221,noun,"a vote in which each person's choice is secret but the totaled votes are public",
17222,noun,"a ballot cast by a voter who votes for candidates from more than one party",
17223,noun,"a ballot cast by a voter who votes for all the candidates of one party",
17224,noun,"the deciding vote cast by the presiding officer to resolve a tie",
17225,noun,"a vote that blocks a decision",
17226,noun,"a vote cast by writing in the name of a candidate who is not listed on the ballot",
17227,noun,"large room used mainly for dancing",
17228,noun,"a public dance hall for dancing to recorded popular music",
17229,noun,"blatant or sensational promotion",
17230,noun,"any of various aromatic resinous substances used for healing and soothing",
17231,noun,"any of various fragrant oleoresins used in medicines and perfumes",
17232,noun,"a fragrant oleoresin",
17233,noun,"semisolid preparation (usually containing a medicine) applied externally as a remedy or for soothing an irritation",
17234,noun,"an ointment used in treating bruises",
17235,noun,"an ointment for babies",
17236,noun,"an ointment containing a fragrant resin",
17237,noun,"an ointment formerly used to treat burns",
17238,noun,"a hard medicated paste made of lard or oil mixed with wax or resin",
17239,noun,"a consecrated ointment consisting of a mixture of oil and balsam",
17240,noun,"a balm applied to the lips",
17241,noun,"a salve containing menthol",
17242,noun,"an ointment containing mercury",
17243,noun,"an ointment containing zinc that is used to treat certain skin diseases",
17244,noun,"a yellow viscous animal oil extracted from wool; a mixture of fatty acids and esters; used in some ointments and cosmetics",
17245,noun,"the quality of weather that is deliciously mild and soothing; ""the day's heat faded into balminess""; ""the climate had the softness of the south of France""",
17246,noun,"good weather with comfortable temperatures",
17247,noun,"a sturdy laced walking shoe",
17248,noun,"a brimless dark blue Scottish cap with a flat top and a plume on one side",
17249,noun,"a tight-fitting headdress",
17250,adjective,"informal or slang terms for mentally irregular; ""it used to drive my husband balmy""",
17251,adjective,"mild and pleasant; ""balmy days and nights""; ""the climate was mild and conducive to life or growth""; ""a soft breeze""",
17252,adjective,"(of weather or climate) physically mild; ""clement weather""",
17253,noun,"any seed plant yielding balsam",
17254,noun,"plant that reproduces by means of seeds not spores",
17255,noun,"a naturally occurring mixture of a resin and an essential oil; obtained from certain plants",
17256,noun,"aromatic yellowish brown balsam from the tolu balsam tree used especially in cough syrups",
17257,noun,"a sea in northern Europe; stronghold of the Russian navy",
17258,noun,"a northern arm of the Baltic Sea; between Sweden and Finland",
17259,noun,"an eastern arm of the Baltic Sea; between Finland and Estonia",
17260,noun,"an inlet of the Baltic Sea between Latvia and Estonia",
17261,noun,"a branch of the Indo-European family of languages related to the Slavonic languages; Baltic languages have preserved many archaic features that are believed to have existed in Proto-Indo European",
17262,noun,"a family of Indo-European languages including the Slavic and Baltic languages",
17263,noun,"a dead language of the (non-German) Prussians (extinct after 1700); thought to belong to the Baltic branch of Indo-European",
17264,noun,"the official language of Lithuania; belongs to the Baltic branch of  Indo-European",
17265,noun,"the official language of Latvia; belongs to the Baltic branch of Indo-European",
17266,noun,"an Iranian language spoken in Pakistan and Iran and Afghanistan and Russia and the Persian gulf",
17267,noun,"one of a number of closely spaced supports for a railing",
17268,noun,"a structure or object that impedes free movement",
17269,noun,"a barrier consisting of a horizontal bar and supports",
17270,noun,"a young child",
17271,noun,"the hard woody stems of bamboo plants; used in construction and crafts and fishing poles",
17272,noun,"woody tropical grass having hollow woody stems; mature canes used for construction and furniture",
17273,noun,bamboos,
17274,noun,"cosmopolitan herbaceous or woody plants with hollow jointed stems and long narrow leaves",
17275,noun,"extremely vigorous bamboo having thin-walled culms striped green and yellow; so widely cultivated that native area is uncertain",
17276,noun,"tall grass of southern United States growing in thickets",
17277,noun,"small cane of watery or moist areas in southern United States",
17278,noun,"immense tropical southeast Asian bamboo with tough hollow culms that resemble tree trunks",
17279,noun,"small bamboo of southeastern China having slender culms flexuous when young",
17280,noun,"small bamboo having thin green culms turning shining black",
17281,noun,"large bamboo having thick-walled culms; native of China and perhaps Japan; widely brown elsewhere",
17282,noun,"an ideological barrier around communist China especially in the 1950s and 1960s",
17283,noun,"a barrier to cooperation or interaction resulting from conflicting ideologies",
17284,verb,"conceal one's true motives from especially by elaborately feigning good intentions so as to gain an end; ""He bamboozled his professors into thinking that he knew the subject well""",
17285,verb,"cause someone to believe an untruth; ""The insurance company deceived me when they told me they were covering my house""",
17286,verb,"prohibit especially by legal means or social pressure; ""Smoking is banned in this building""",
17287,verb,"command against; ""I forbid you to call me late at night""; ""Mother vetoed the trip to the chocolate store""",
17288,verb,"forbid the public distribution of ( a movie or a newspaper)",
17289,verb,"declare illegal; outlaw; ""Marijuana is criminalized in the U.S.""",
17290,verb,"ban the publication of (documents), as for security or copyright reasons; ""embargoed publications""",
17291,verb,"ban from a place of residence, as for punishment",
17292,verb,"force to leave or move out; ""He was expelled from his native country""",
17293,verb,"send to the country; ""He was rusticated for his bad behavior""",
17294,verb,"expel from a community or group",
17295,noun,"a decree that prohibits something",
17296,noun,"an order that bans something",
17297,noun,"(law) a judicial remedy issued in order to prohibit a party from doing or continuing to do a certain activity; ""injunction were formerly obtained by writ but now by a judicial order""",
17298,noun,"a court order prohibiting a party from doing a certain activity",
17299,noun,"100 bani equal 1 leu in Moldova",
17300,noun,"monetary unit in Moldova",
17301,noun,"100 bani equal 1 leu in Romania",
17302,noun,"the basic unit of money in Romania",
17303,noun,"monetary unit in Romania",
17304,noun,"an official prohibition or edict against something",
17305,noun,"refusal to approve or assent to",
17306,noun,"a ban on the testing of nuclear weapons that is mutually agreed to by countries that possess nuclear weapons",
17307,adjective,"repeated too often; overfamiliar through overuse; ""bromidic sermons""; ""his remarks were trite and commonplace""; ""hackneyed phrases""; ""a stock answer""; ""repeating threadbare jokes""; ""parroting some timeworn axiom""; ""the trite metaphor `hard as nails'""",
17308,adjective,"not original; not being or productive of something fresh and unusual; ""the manuscript contained unoriginal emendations""; ""his life had been unoriginal, conforming completely to the given pattern""- Gwethalyn Graham",
17309,noun,"a trite or obvious remark",
17310,noun,"a statement that expresses a personal opinion or belief; ""from time to time she contributed a personal comment on his account""",
17311,noun,"an obvious truth",
17312,noun,"any of several tropical and subtropical treelike herbs of the genus Musa having a terminal crown of large entire leaves and usually bearing hanging clusters of elongated fruits",
17313,noun,"type genus of the Musaceae: bananas",
17314,noun,"low-growing Asian banana tree cultivated especially in the West Indies for its clusters of edible yellow fruit",
17315,noun,"Asiatic banana plant cultivated especially as a foliage plant in Japan",
17316,noun,"a banana tree bearing hanging clusters of edible angular greenish starchy fruits; tropics and subtropics",
17317,noun,"widely cultivated species of banana trees bearing compact hanging clusters of commercially important edible yellow fruit",
17318,noun,"Philippine banana tree having leafstalks that yield Manila hemp used for rope and paper etc",
17319,noun,"elongated crescent-shaped yellow fruit with soft sweet flesh",
17320,verb,"bind or tie together, as with a band",
17321,verb,"fasten or secure with a rope, string, or cord; ""They tied their victim to the chair""",
17322,noun,"an unofficial association of people or groups; ""the smart set goes there""; ""they were an angry lot""",
17323,noun,"a small group of car drivers who arrange to take turns driving while the others are passengers",
17324,noun,"an exclusive circle of people with a common purpose",
17325,noun,"a band of warriors (originally a unit of a Roman Legion)",
17326,noun,"a group of conspirators banded together to achieve some harmful or illegal purpose",
17327,noun,"the exclusive social set of a city",
17328,noun,"a set of people sharing a devotion to horses and horseback riding and horse racing",
17329,noun,"a set of rich and fashionable people who travel widely for pleasure",
17330,noun,"a band of people associated temporarily in some activity; ""they organized a party to search for food""; ""the company of cooks walked into the kitchen""",
17331,noun,"instrumentalists not including string players",
17332,noun,"an organization of musicians who perform together",
17333,noun,"a group of musicians playing only brass and percussion instruments",
17334,noun,"a group of musicians playing brass and woodwind and percussion instruments",
17335,noun,"a division of an orchestra containing all instruments of the same class",
17336,noun,"a stripe or stripes of contrasting color; ""chromosomes exhibit characteristic bands""; ""the black and yellow banding of bees and wasps""",
17337,noun,"a marking of a different color or texture from the background",
17338,noun,"a narrow band resulting from tension on the skin (as on abdominal skin after pregnancy)",
17339,noun,"a narrow paper band around a cigar",
17340,noun,"a band around the crown of a hat just above the brim",
17341,noun,"a band around the collar of a garment",
17342,noun,"a very thin stripe (especially a white stripe on a dark fabric)",
17343,noun,"a group of musicians playing popular music for dancing",
17344,noun,"a large dance or jazz band usually featuring improvised solos by lead musicians",
17345,noun,"a small band of jazz musicians",
17346,noun,"a band of musicians who play rock'n'roll music",
17347,noun,"a band that plays instruments made from the heads of oil drums (Caribbean Islands)",
17348,noun,"a range of frequencies between two limits",
17349,noun,"a band of adjacent radio frequencies (e.g., assigned for transmitting radio or television signals)",
17350,noun,"a band worn around the upper arm",
17351,noun,"a broad band that passes over the back of a horse and supports the shafts of a vehicle",
17352,noun,"a cloth band that is worn around the waist (as on infants until the navel has healed)",
17353,noun,"a band that fits around the neck and is usually folded over",
17354,noun,"a band of leather or rope that is placed around an animal's neck as a harness or to identify it",
17355,noun,"a band (usually elastic) worn around the leg to hold up a stocking (or around the arm to hold up a sleeve)",
17356,noun,"a band of material around the waist that strengthens a skirt or trousers",
17357,noun,"a band worn around or over the head; ""the earphones were held in place by a headband""",
17358,noun,"the band that is the part of a bridle that fits around a horse's head",
17359,noun,"a rigid circular band of metal or wood or other material used for holding or fastening or hanging or pulling; ""there was still a rusty iron hoop for tying a horse""",
17360,noun,"a narrow band of elastic rubber used to hold things (such as papers) together",
17361,noun,"a band that goes over the shoulder and supports a garment or bag",
17362,noun,"a band of fabric or leather sewn inside the crown of a hat",
17363,noun,"a band of material tied around the forehead or wrist to absorb sweat",
17364,noun,"a band of cloth or leather or metal links attached to a wristwatch and wrapped around the wrist",
17365,noun,"a black band worn by a man (on the arm or hat) as a sign of mourning",
17366,noun,"a band or bracelet worn around the wrist",
17367,noun,"a cord-like tissue connecting two larger parts of an anatomical structure",
17368,noun,"part of an organism consisting of an aggregate of cells having a similar structure and function",
17369,noun,"jewelry consisting of a circlet of precious metal (often set with jewels) worn on the finger; ""she had rings on every finger""; ""he noted that she wore a wedding band""",
17370,noun,"a small ring",
17371,noun,"a ring given and worn as a sign of betrothal",
17372,noun,"a ring worn as a memorial to a dead person",
17373,noun,"a small ring",
17374,noun,"a ring bearing a signet",
17375,noun,"a ring (usually plain gold) given to the bride (and sometimes one is also given to the groom) at the wedding",
17376,noun,"a thin flat strip or loop of flexible material that goes around or over something else",
17377,noun,"anything with a round or oval shape (formed by a curve that is closed and does not intersect itself)",
17378,noun,"a strip of material attached to the leg of a bird to identify it (as in studies of bird migration)",
17379,noun,"a restraint put around something to hold it together",
17380,noun,"a device that retards something's motion; ""the car did not have proper restraints fitted""",
17381,noun,"a band that can be tightened around a shaft to stop its rotation",
17382,noun,"a band or collar that holds an individual stone in a jewellery setting",
17383,noun,"a metal band used to attach a reed to the mouthpiece of a clarinet or saxophone",
17384,noun,"band or rope made of twisted twigs or stems",
17385,noun,"an endless saw consisting of a toothed metal band that is driven around two wheels",
17386,noun,"a power tool for cutting wood",
17387,verb,"wrap around with something so as to cover or enclose",
17388,verb,"dress by covering or binding; ""The nurse bandaged a sprained ankle""; ""bandage an incision""",
17389,verb,"apply a bandage or medication to; ""dress the victim's wounds""",
17390,verb,"bind with a bandage or ligature; ""ligate the artery""",
17391,noun,"a piece of soft material that covers and protects an injured part of the body",
17392,noun,"a cloth covering for a wound or sore",
17393,noun,"bandage consisting of a medical dressing of plain absorbent gauze held in place by a plastic or fabric tape coated with adhesive",
17394,noun,"bandage that covers the head or an amputation stump like a cap",
17395,noun,"bandage consisting of a firm covering (often made of plaster of Paris) that immobilizes broken bones while they heal",
17396,noun,"bandage that stops the flow of blood from an artery by applying pressure",
17397,noun,"a bandage containing stretchable material that can apply local pressure",
17398,noun,"a bandage consisting of a strip of cloth split in two on both ends; the central part is placed under the chin to restrict motion of the mandible and the tails are tied over the top of the head",
17399,noun,"a bandage of cloth impregnated with a substance (e.g., plaster of Paris) that hardens soon after it is applied",
17400,noun,"a bandage in which successive turns proceed obliquely up or down a limb",
17401,noun,"bandage consisting of a strip of sterile fabric (of variable width) rolled into a cylinder to facilitate application",
17402,noun,"bandage to support an injured forearm; consisting of a wide triangular piece of cloth hanging from around the neck",
17403,noun,"a bandage of elastic fabric applied to uplift a dependant part (as the scrotum or a pendulous breast)",
17404,noun,"an enveloping bandage",
17405,noun,"(medicine) a bandage consisting of a pad and belt; worn to hold a hernia in place by pressure",
17406,noun,"(medicine) bleached cotton cloth of plain weave used for bandages and dressings",
17407,noun,"large and brightly colored handkerchief; often used as a neckerchief",
17408,noun,"a square piece of cloth used for wiping the eyes or nose or as a costume accessory",
17409,noun,"a light cylindrical box for holding light articles of attire (especially hats)",
17410,noun,"a (usually rectangular) container; may have a lid; ""he rummaged through a box of spare parts""",
17411,noun,"an undergarment worn by women to support their breasts",
17412,noun,"a garment worn under other garments",
17413,noun,"clothing that is designed for women to wear",
17414,noun,"a brassiere that lifts and supports the breasts",
17415,noun,"an armed thief who is (usually) a member of a band",
17416,noun,"a criminal who takes property belonging to someone else with the intention of keeping it or selling it",
17417,noun,"the practice of plundering in gangs",
17418,noun,"the act of stealing valuable things from a place; ""the plundering of the Parthenon""; ""his plundering of the great authors""",
17419,noun,"the conductor of a band",
17420,noun,"the person who leads a musical group",
17421,noun,"a United States bandmaster and composer of military marches (1854-1932)",
17422,noun,"a broad cartridge belt worn over the shoulder by soldiers",
17423,noun,"a broad belt with loops or pockets for holding ammunition",
17424,noun,"a popular trend that attracts growing support; ""when they saw how things were going everybody jumped on the bandwagon""",
17425,noun,"a large ornate wagon for carrying a musical band; ""the gaudy bandwagon led the circus parade""",
17426,noun,"a data transmission rate; the maximum amount of information (bits/second) that can be transmitted along a channel",
17427,noun,"a system of measurement of information based on the probabilities of the events that convey information",
17428,adjective,"have legs that curve outward at the knees",
17429,verb,"send or toss to and fro, like a shuttlecock",
17430,verb,"exchange blows",
17431,verb,"discuss lightly; ""We bandied around these difficult questions""",
17432,adjective,"exceedingly harmful",
17433,adjective,"injurious to physical or mental health; ""noxious chemical wastes""; ""noxious ideas""",
17434,adverb,"directly; ""he ran bang into the pole""; ""ran slap into her""",
17435,verb,"strike violently; ""slam the ball""",
17436,verb,"deal a blow to, either with the hand or with an instrument; ""He hit her hard in the face""",
17437,verb,"to produce a sharp often metallic explosive or percussive sound; ""One of them banged the sash of the window nearest my bed""",
17438,verb,"close violently; ""He slammed the door shut""",
17439,verb,"move so that an opening or passage is obstructed; make shut; ""Close the door""; ""shut the window""",
17440,verb,"move noisily; ""The window banged shut""; ""The old man banged around the house""",
17441,verb,"have sexual intercourse with; ""This student sleeps with everyone in her dorm""; ""Adam knew Eve""; ""Were you ever intimate with this man?""",
17442,verb,"have sex with; archaic use; ""He had taken this woman when she was most vulnerable""",
17443,verb,"have sex without being married",
17444,verb,"kiss, embrace, or fondle with sexual passion; ""The couple were necking in the back seat of the car""",
17445,verb,"hit against; come into sudden contact with; ""The car hit a tree""; ""He struck the table with his elbow""",
17446,noun,"a vigorous blow; ""the sudden knock floored him""; ""he took a bash right in his face""; ""he got a bang on the head""",
17447,noun,"an impact (as from a collision); ""the bump threw him off the bicycle""",
17448,noun,"a sudden very loud noise",
17449,noun,"sound of any kind (especially unintelligible or dissonant sound); ""he enjoyed the street noises""; ""they heard indistinct noises of people talking""; ""during the firework display that ended the gala the noise reached 98 decibels""",
17450,noun,"the banging sound of steam in pipes",
17451,noun,"a fringe of hair that is cut short squarely across the forehead",
17452,noun,"the swift release of a store of affective force; ""they got a great bang out of it""; ""what a boot!""; ""he got a quick rush from injecting heroin""; ""he does it for kicks""",
17453,noun,"the feeling of lively and cheerful joy; ""he could hardly conceal his excitement when she agreed""",
17454,noun,"a conspicuous success; ""that song was his first hit and marked the beginning of his career""; ""that new Broadway show is a real smasher""; ""the party went with a bang""",
17455,noun,"an unusually successful hit with widespread popularity and huge sales (especially a movie or play or recording or novel)",
17456,noun,"an unexpected hit; ""that movie was the sleeper of the summer""",
17457,noun,"a horse bred for racing",
17458,noun,"solid-hoofed herbivorous quadruped domesticated since prehistoric times",
17459,noun,"an informal term for a racehorse; ""he liked to bet on the ponies""",
17460,noun,"a racehorse considered one year old until the second Jan. 1 following its birth",
17461,noun,"a racehorse that is two years old",
17462,noun,"a racehorse that is three years old",
17463,noun,"a racehorse about which little is known",
17464,noun,"a racehorse that runs well on a muddy racetrack",
17465,noun,"a horse that fails to run in a race for which it has been entered",
17466,noun,"a horse used to set the pace in racing",
17467,noun,"a horse trained to trot; especially a horse trained for harness racing",
17468,verb,"expel, as if by official decree; ""he was banished from his own country""",
17469,verb,"stand in the way of",
17470,verb,"drive away; ""banish bad thoughts""; ""banish gloom""",
17471,verb,"force to go away; used both with concrete and metaphoric meanings; ""Drive away potential burglars""; ""drive away bad thoughts""; ""dispel doubts""; ""The supermarket had to turn back many disappointed customers""",
17472,noun,"the state of being banished or ostracized (excluded from society by general consent); ""the association should get rid of its elderly members--not by euthanasia, of course, but by Coventry""",
17473,noun,"the state of being excluded",
17474,noun,"rejection by means of an act of banishing or proscribing someone",
17475,noun,"the formal act of pronouncing (someone or something) accursed",
17476,noun,"the act of expelling a lawyer from the practice of law",
17477,noun,"the act of forcing out someone or something; ""the ejection of troublemakers by the police""; ""the child's expulsion from school""",
17478,noun,"the act of expelling a person from their native land; ""men in exile dream of hope""; ""his deportation to a penal colony""; ""the expatriation of wealthy farmers""; ""the sentence was one of transportation for life""",
17479,noun,"the act of banishing a member of a church from the communion of believers and the privileges of the church; cutting a person off from a religious society",
17480,noun,"mild banishment; consignment to an inferior position; ""he has been relegated to a post in Siberia""",
17481,noun,"banishment into the country",
17482,noun,"a stringed instrument of the guitar family that has long neck and circular body",
17483,noun,"a musical instrument in which taut strings provide the source of sound",
17484,noun,"a narrow strip of wood on the neck of some stringed instruments (violin or cello or guitar etc) where the strings are held against the wood with the fingers",
17485,verb,"tip laterally; ""the pilot had to bank the aircraft""",
17486,verb,"cause to tilt; ""tip the screen upward""",
17487,verb,"enclose with a bank; ""bank roads""",
17488,verb,"surround completely; ""Darkness enclosed him""; ""They closed in the porch with a fence""",
17489,verb,"do business with a bank or keep an account at a bank; ""Where do you bank in this town?""",
17490,verb,"conduct business; ""transact with foreign governments""",
17491,verb,"be in the banking business",
17492,verb,"be employed; ""Is your husband working again?""; ""My wife never worked""; ""Do you want to work after the age of 60?""; ""She never did any work because she inherited a lot of money""; ""She works as a waitress to put herself through college""",
17493,verb,"put into a bank account; ""She deposits her paycheck every month""",
17494,verb,"deposit anew",
17495,verb,"cover with ashes so to control the rate of burning; ""bank a fire""",
17496,verb,"have confidence or faith in; ""We can trust in God""; ""Rely on your friends""; ""bank on your good education""; ""I swear by my grandmother's recipes""",
17497,verb,"have trust in; trust in the truth or veracity of",
17498,verb,"rely on for support; ""We can lean on this man""",
